,직무중분류,직무소분류,채용공고명,채용기한,해시태그,채용공고상세_text,채용공고상세_img,채용공고상세_url,고용형태,경력,근무지역,학력,급여조건,우대사항,회사명,회사규모,회사분야,복리후생,출처
66,웹프로그래머,PHP,[중견사]웹 개발 팀장급,채용시,웹프로그래머,"◈ 추천회사 소개 - 국내 유명 스터디카페/독서실 업계 1위 브랜드 020 교육플랫폼 회사 * 연 매출액: 350억원 사원수: 70명    ◈ 포지션- [중견사]웹 개발 팀장급    ◈ 담당 업무: 팀원 10명 -백엔드 개발 업무 -어드민 및 앱 개발 -개발 총괄         ◈ Requirement capability - 초 대졸 이상자 - 경력: 해당 직무 경력 10년 ~ 20년차 이하자 - PHP framework (CI3) 및 템플릿 언더바를 이용한 백엔드 개발/운영 경험 - RDBMS를 이용한 개발/운영 경험 (MariaDB, MySQL등) - 비즈니스 요구사항에 따른 RDBMS 설계 경험 - 코드 리뷰에 긍정적이고, 원활한 커뮤니케이션이 가능하신 분 - 개발 프로그램은 PHP 기반이지만 PHP도 알고 다양한 개발언어에 능통한 분 - 합격 결정 후 2주 이내 출근 가능자 선호   [우대사항] - REST API에 대한 이해가 깊으신 분 -버전관리 시스템(git, svn)을 사용한 경험이 있으신 분 -Notion을 활용해 문서화에 익숙하신 분 -클라우드 서비스(AWS)를 활용한 배포, 운영 경험   - 최종 합격 후 즉시 출근 가능자    [근무지]서울시 서초구 소재    ◈제시 연봉 : 경력에 따라 협의(10,000만원 -20,000만원 선)   <전형절차> - (1) 서류 전형 -> (2) 대면 면접 -> (3) 채용 확정   ◈ 제출서류   - 국문이력서 및 자기소개서, 경력기술서(국문) 1 파일로 제출요망   - 포토폴리오(해당자에 한함)   - 이력서 제출시 최종연봉,희망연봉 필수 기재, 문서이름은 “지원분야-성명”으로 표기   - 경력기술서 작성시 보유기술 및 경험직무에 대해서 상세 기술 요망   ◈ 제출기한 및 근무가능일 : ASAP(채용시 마감)   ◈ 접수방법 ; [담당자 : 임정우 본부장] - e-mail 접수 : ******@*******.***  - 제출기한 : 선착순 E-mail 접수 분에 한합니다. - 전화문의 : 02-713-7061 / 010-8480-1100 - 합격통보 : 합격자에 한하여 개별 연락드리오니 양해바랍니다.",,,정규직,경력10~20년,"서울 > 전지역, 서초구, 강남구",초대졸이상,연봉 1억원 이상,,(주)피플스카우트,중소기업 (사원수 67명),용역·인력알선,"주5일근무, 국민연금, 의료보험, 산재보험, 고용보험, 인센티브, 우수사원포상, 장기근속...",https://job.incruit.com/jobdb_info/jobpost.asp?job=2304170004945
67,웹프로그래머,PHP,자바 백엔드 개발,채용시,"웹프로그래머, 데이터베이스·DBA, 응용프로그래머","국내 TOP 기업들이 대주주로 있는 영위 비지니스 TOP 기업입니다.  [담당업무] Part_1 - 정산시스템 개발 - CEO 서비스 개발 - 차세대 서비스 개발  Part_2 • 사이트웹 서비스 개발 • LMS 서비스 개발  [자격사항] - 웹 어플리케이션 개발 및 운영 - Rest API에 대한 이해 및 개발 가능 - RDBMS, NoSQL에 대한 이해 및 개발 가능 - Java(spring boot) 소스코드 이해 및 개발 가능 - 팀 워크 및 원활한 커뮤니케이션 능력  [우대사항] - 신기술 트렌드에 관심이 높으신 분 - 새로운 기술 습득에 거리낌이 없고 학습 의지가 높으신 분 - 객체지향 개발 및 테스트 코드 작성이 능숙하신 분 - MSA 아키텍처 기반의 시스템 개발 경험자 - JPA, Hibernate, JOOQ 등 ORM 사용과 도메인 모델링 경험자 - Fullstack 개발이 가능하신 분 - PHP 개발이 가능하신 분 - Vue.js, React.js 개발 경험이 있으신 분 - 전기차충전운영시스템 개발 경력자 우대  [기타사항] • 근무지 : 서울시 구로구 • 제출서류 : 국문이력서(경력기술서) • 진행절차 : 서류접수 -> 인터뷰 -> 합격 • 담당자 : 정영교전무 010-6260-1189 ******@*******.***",,,정규직,경력3~15년,서울 > 구로구,대졸,협의,,(주)피플케어코리아,중소기업 (사원수 50명),시장조사·여론조사·경영컨설팅,"주5일근무, 연차, 월차, 국민연금, 의료보험, 산재보험, 고용보험, 인센티브, MBO성과...",https://job.incruit.com/jobdb_info/jobpost.asp?job=2303220007137
68,웹프로그래머,PHP,[중견사]백엔드 개발/과장-차장급,채용시,웹프로그래머,"◈ 추천회사 소개 - 국내 유명 스터디카페/독서실 업계 1위 브랜드 020 교육플랫폼 회사 * 연 매출액: 350억원 사원수: 70명    ◈ 포지션- [중견사]백엔드 개발/과장-차장급    ◈ 담당 업무: 팀원 10명 - 웹 플랫폼 운영 및 신규 개발     ◈ Requirement capability - 초 대졸 이상자 - 경력: 해당 직무 경력 5년 ~ 10년차 이하자 -Javascript(Node.js), PHP7에 대한 이해도가 있으신 분 -RDBMS/NOSQL 개발/운영 경험이 있으신 분 -코드 리뷰에 긍정적이고, 자기 주도적이며, 원활한 커뮤니케이션이 가능하신 분   - 합격 결정 후 2주 이내 출근 가능자 선호   [우대사항] -PHP framework(CI) 사용 경험이 있으신 분 -Python, Nginx, React 에 대한 경험이 있으신 분 -클라우드 환경에 익숙하신 분 -버전관리 시스템(git) 사용 경험이 있으신 분 - 최종 합격 후 즉시 출근 가능자    [근무지]서울시 서초구 소재    ◈제시 연봉 : 경력에 따라 협의(5,000만원 -7,500만원 선)   <전형절차> - (1) 서류 전형 -> (2) 대면 면접 -> (3) 채용 확정   ◈ 제출서류   - 국문이력서 및 자기소개서, 경력기술서(국문) 1 파일로 제출요망   - 포토폴리오(해당자에 한함)   - 이력서 제출시 최종연봉,희망연봉 필수 기재, 문서이름은 “지원분야-성명”으로 표기   - 경력기술서 작성시 보유기술 및 경험직무에 대해서 상세 기술 요망   ◈ 제출기한 및 근무가능일 : ASAP(채용시 마감)   ◈ 접수방법 ; [담당자 : 임정우 본부장] - e-mail 접수 : ******@*******.***  - 제출기한 : 선착순 E-mail 접수 분에 한합니다. - 전화문의 : 02-713-7061 / 010-8480-1100 - 합격통보 : 합격자에 한하여 개별 연락드리오니 양해바랍니다.",,,정규직,경력5~10년,"서울 > 전지역, 서초구",초대졸이상,회사내규,,(주)피플스카우트,중소기업 (사원수 67명),용역·인력알선,"주5일근무, 국민연금, 의료보험, 산재보험, 고용보험, 인센티브, 우수사원포상, 장기근속...",https://job.incruit.com/jobdb_info/jobpost.asp?job=2303090003508
69,웹프로그래머,PHP,[중견사]프론트엔드 개발자/과장-차장급/4명,채용시,웹프로그래머,"◈ 추천회사 소개 - 국내 유명 스터디카페/독서실 업계 1위 브랜드 020 교육플랫폼 회사 * 연 매출액: 350억원 사원수: 70명    ◈ 포지션- [중견사]프론트엔드 개발자/과장-차장급/4명    ◈ 담당 업무: 팀원 10명 -자사 웹솔루션 (React) 개발 및 운영 -PC 및 모바일에 최적화된 UI/UX 개발 -GraphQL 서버와 API 연동 -자사 앱서비스 개발 등    ◈ Requirement capability - 초 대졸 이상자 - 경력: 해당 직무 경력 5년 ~ 10년차 이하자 -React 의 경험과 동작 원리에 대한 높은 이해도를 갖추신 분 -REST API 를 활용한 Web 개발 경험이 있으신 분 -Javascript 및 HTML5, CSS3 에 대한 지식 및 경험이 있으신 분 -웹표준 및 웹접근성에 대한 이해가 높으신 분 -웹 성능 최적화 경험이 있으신 분 -기획/디자인 등등 다양한 직군과의 원만한 커뮤니케이션 및 협업이 가능하신 분 -코드 품질에 대한 고민과 새로운 기술에 두려움이 없으신 분   - 합격 결정 후 2주 이내 출근 가능자 선호   [우대사항] -서비스를 시장에 출시하고 운영한 경험 -Back End 시스템에 대한 이해도가 높으신 분 -결제 시스템 연동, 구축 경험 -코드리뷰를 즐기시는 분  - 최종 합격 후 즉시 출근 가능자    [근무지]서울시 서초구 소재    ◈제시 연봉 : 경력에 따라 협의(5,000만원 -7,500만원 선)   <전형절차> - (1) 서류 전형 -> (2) 대면 면접 -> (3) 채용 확정   ◈ 제출서류   - 국문이력서 및 자기소개서, 경력기술서(국문) 1 파일로 제출요망   - 포토폴리오(해당자에 한함)   - 이력서 제출시 최종연봉,희망연봉 필수 기재, 문서이름은 “지원분야-성명”으로 표기   - 경력기술서 작성시 보유기술 및 경험직무에 대해서 상세 기술 요망   ◈ 제출기한 및 근무가능일 : ASAP(채용시 마감)   ◈ 접수방법 ; [담당자 : 임정우 본부장] - e-mail 접수 : ******@*******.***  - 제출기한 : 선착순 E-mail 접수 분에 한합니다. - 전화문의 : 02-713-7061 / 010-8480-1100 - 합격통보 : 합격자에 한하여 개별 연락드리오니 양해바랍니다.",,,정규직,경력5~10년,"서울 > 전지역, 서초구, 강남구",초대졸이상,회사내규,,(주)피플스카우트,중소기업 (사원수 67명),용역·인력알선,"주5일근무, 국민연금, 의료보험, 산재보험, 고용보험, 인센티브, 우수사원포상, 장기근속...",https://job.incruit.com/jobdb_info/jobpost.asp?job=2303090003504
70,웹프로그래머,PHP,의료기기 기구 설계 및 개발,채용시,"웹프로그래머, 광학·의료장비, 연구원·연구개발","의료기기 기구 설계 및 개발 모집부문 및 자격요건 담당업무 자격요건 인원 [담당업무] 의료기기 기구 설계 및 개발 / 인증 및 인허가 문서 작성 / 개발 단계별 문서 작성 [ 우대사항 ] 체외진단의료기기 개발 경력 / Mechanical   및 의료기기 분야 개발 경력/ 사출 개발 경력 / 광학 구조 설계 경력 [자격요건] 경력사항: 경력(5년 이상 ) 학력사항: 대학교(4년)졸업 이상 기타: 관련 업무 경력 : 8 년   ~ 15 년 / 주임연구원   ~   책임연구원 / 기구 설계 ,   자동화 설계 / 3D Solid Works   및   Auto CAD   사용 가능 / 양산이관 경험  0 명 근무조건 고용형태: 정규직 급여조건: 연봉 협의 후 결정 전형단계 및 제출서류 전형단계: 서류전형 > 면접진행 > 최종심사 > 최종합격 추가 제출서류 이력서, 자기소개서 접수방법 채용시 접수방법: 인크루트 채용시스템 접수양식: 인크루트 이력서 기타 유의사항 입사지원서 및 제출서류에 허위사실이 있을 경우 채용이 취소될 수 있습니다.",,,정규직,경력5년이상,경기 > 안양시 동안구,대졸이상,협의,,주식회사 경연파트너스,중소기업 (사원수 20명),용역·인력알선,"(08512) 서울특별시 금천구 디지털로9길 46 (가산동,이앤씨드림타워7차)",https://job.incruit.com/jobdb_info/jobpost.asp?job=2302060005229
71,웹프로그래머,PHP,[중견사]UI/UX 디자인/대리급,채용시,"웹프로그래머, 웹디자인","◈ 추천회사 소개 - 국내 유명 스터디카페/독서실 업계 1위 브랜드 020 교육플랫폼 회사 * 연 매출액: 350억원 사원수: 70명    ◈ 포지션- [중견사]UI/UX 디자인/대리급    ◈ 담당 업무: -웹, 앱, 모바일 UI/UX 디자인 -사용자 경험을 기반으로 UX 설계와 UI 디자인 주도 -정량적/정성적 데이터 분석 및 사용자 시나리오 기반의 디자인 전략 수립    ◈ Requirement capability - 초 대졸 이상자 - 경력: 해당 직무 경력 3년 ~ 7년차 이하자 -사용자 관점 UX/UI 디자인 및 문제도출/해결이 가능하신 분 -디자이너로서 프로젝트를 주도하고 IT조직과의 업무경험이 있으신 분 -모바일 환경에 대해 이해도가 있으신 분   - 합격 결정 후 2주 이내 출근 가능자 선호   [우대사항] -Figma, XD, Sketch, ZEPLIN 프로젝트 경험이 있으신 분 -프로덕트 서비스 출시부터 운영까지 경험해보신 분 -데이터, 비지니스 모델에 관심이 높고 산업에 대한 큰 그림을 보실 수 있는 분  - 최종 합격 후 즉시 출근 가능자    [근무지]서울시 서초구 소재    ◈제시 연봉 : 경력에 따라 협의(3,200만원 -4,000만원 선)   <전형절차> - (1) 서류 전형 -> (2) 대면 면접 -> (3) 채용 확정   ◈ 제출서류   - 국문이력서 및 자기소개서, 경력기술서(국문) 1 파일로 제출요망   - 포토폴리오(필수)   - 이력서 제출시 최종연봉,희망연봉 필수 기재, 문서이름은 “지원분야-성명”으로 표기   - 경력기술서 작성시 보유기술 및 경험직무에 대해서 상세 기술 요망   ◈ 제출기한 및 근무가능일 : ASAP(채용시 마감)   ◈ 접수방법 ; [담당자 : 임정우 본부장] - e-mail 접수 : ******@*******.***  - 제출기한 : 선착순 E-mail 접수 분에 한합니다. - 전화문의 : 02-713-7061 / 010-8480-1100 - 합격통보 : 합격자에 한하여 개별 연락드리오니 양해바랍니다.    ",,,정규직,경력3~7년,"서울 > 전지역, 서초구",초대졸이상,회사내규,,(주)피플스카우트,중소기업 (사원수 67명),용역·인력알선,"주5일근무, 국민연금, 의료보험, 산재보험, 고용보험, 인센티브, 우수사원포상, 장기근속...",https://job.incruit.com/jobdb_info/jobpost.asp?job=2212190002151
72,웹프로그래머,PHP,[중견사]DevOps 개발자/과장-차장급,채용시,웹프로그래머,"◈ 추천회사 소개 - 국내 유명 스터디카페/독서실 업계 1위 브랜드 020 교육플랫폼 회사 * 연 매출액: 350억원 사원수: 70명    ◈ 포지션- [중견사]DevOps 개발자/과장-차장급    ◈ 담당 업무: 팀원 10명 -Admin(관리자) 시스템 개발 및 운영 -현업 업무 기반 시스템 구축 -경영 및 업무에 필요한 자료를 수집, -집계 하여 Dashboard 시스템 구축 -DB 성능관리 및 서버관리     ◈ Requirement capability - 초 대졸 이상자 - 경력: 해당 직무 경력 5년 ~ 10년차 이하자 -DB 성능관리 및 서버관리 동접 1,000 명 이상 관리경험 -Sql 쿼리 -Javascript, PHP -AWS 및 구글클라우드 구축 및 운영   - 합격 결정 후 2주 이내 출근 가능자 선호   [우대사항] -RDB, NoSQL DB 관리 경험 -타 업무 분석 능력 -Admin(관리자) 시스템 경험 - 최종 합격 후 즉시 출근 가능자    [근무지]서울시 서초구 소재    ◈제시 연봉 : 경력에 따라 협의(5,000만원 -7,500만원 선)   <전형절차> - (1) 서류 전형 -> (2) 대면 면접 -> (3) 채용 확정   ◈ 제출서류   - 국문이력서 및 자기소개서, 경력기술서(국문) 1 파일로 제출요망   - 포토폴리오(해당자에 한함)   - 이력서 제출시 최종연봉,희망연봉 필수 기재, 문서이름은 “지원분야-성명”으로 표기   - 경력기술서 작성시 보유기술 및 경험직무에 대해서 상세 기술 요망   ◈ 제출기한 및 근무가능일 : ASAP(채용시 마감)   ◈ 접수방법 ; [담당자 : 임정우 본부장] - e-mail 접수 : ******@*******.***  - 제출기한 : 선착순 E-mail 접수 분에 한합니다. - 전화문의 : 02-713-7061 / 010-8480-1100 - 합격통보 : 합격자에 한하여 개별 연락드리오니 양해바랍니다.",,,정규직,경력5~10년,"서울 > 전지역, 서초구",초대졸이상,회사내규,,(주)피플스카우트,중소기업 (사원수 67명),용역·인력알선,"주5일근무, 국민연금, 의료보험, 산재보험, 고용보험, 인센티브, 우수사원포상, 장기근속...",https://job.incruit.com/jobdb_info/jobpost.asp?job=2212160001699
73,웹프로그래머,PHP,[대기업/그룹사]Frontend Engineer /대리-과장급,채용시,웹프로그래머,"□ 회사소개 * 국내 대기업 계열 유명  여성향 콘텐츠 플랫폼 전문회사 * 2022년 2월 예스이십사(주) 자회사로 새출발 * 연 매출액: 110억원 / 사원수: 30명  □ 포지션: [대기업/그룹사]Frontend Engineer /대리-과장급  □ 주요 담당업무 - Apache PHP MySQL 서비스 개발 - 웹소설 / 웹툰 서비스 개발 - PC/Mobile Web/API/CMS 신규개발 및 서비스 유지보수 - APP API 연동 개발  □ 지원 자격요건 - 학력: 초 대졸 이상자 - 경력: 관련 직무 경력 4년 이상 ~ 10년 이하자 - PHP(5.x & 7.x) 를 이용한 웹 어플리케이션 개발 가능하신 분 - jQuery, Ajax, CSS 높은 이해 - RDBMS(Mysql, MariaDB)를 이용한 DB 설계 및 활용 가능하신 분 - Open API / OAuth 사용 경험이 있으신 분    □ 우대사항 - 대용량 트래픽, 데이터 처리 경험이 있으신 분 - EPUB 화일 생성 가능하신 분 - GD 활용 가능하신분 - git 사용 가능하신 분 - PG (빌딩 시스템) 개발 가능하신 분 - Linux 및 APM 셋팅 및 운영 가능하신 분 - 최종 합격 후 빠른 시일 내 출근 가능자   □ 근무지: 서울시 여의도 소재    □ 제시 연봉 : 경력에 따라 협의(6,500만원 -9,000만원 선)    □ 채용기한: ASAP(채용 시 마감)  □ 채용절차: 서류전형 → 1차 면접(실무진) → 인적성검사 → 2차 면접(임원) → 최종 합격  □ 제출서류 - 이력서 및 자기소개서, 경력기술서(국문 자유양식: 각 1개 파일로 제출 요망) /  포트폴리오(해당자에 한함) - 이력서 제출 시 최종연봉, 희망연봉 필수 기재, 문서이름은 “지원분야-성명”으로 표기 - 경력기술서 작성시 보유기술 및 경험직무에 대해 상세 기술 요망 ※ 중복지원 여부 반드시 체크요망(과거 또는 현재 해당 업체에 지원한 이력이 있는 경우 반드시 사전에 고지요망)  □ 접수방법 [담당자: 임정우 본부장] - e-mail 접수: hunter@peoplescout.co.kr - 제출기한: 선착순 E-mail 접수분에 한합니다. - 전화문의: 00-713-7061 / 010-8480-1100 - 합격통보: 합격자에 한하여 개별로 연락을 드리오니 양해바랍니다.",,,정규직,경력4~10년,"서울 > 전지역, 영등포구",초대졸이상,회사내규,,(주)피플스카우트,중소기업 (사원수 67명),용역·인력알선,"주5일근무, 국민연금, 의료보험, 산재보험, 고용보험, 인센티브, 우수사원포상, 장기근속...",https://job.incruit.com/jobdb_info/jobpost.asp?job=2212050004471
74,웹프로그래머,PHP,자사 커머스 플랫폼 관련 솔루션 웹개발(백엔드)3년이상 경력자,채용시,웹프로그래머,"코리아써치 모집부문 및 자격요건 담당업무 자격요건 인원 자사 솔루션 개발 - 자사 커머스 플랫폼 관련 솔루션 웹개발 - 업무 시스템 개발 및 운영 - 타부서와 협력/소통/협업 등 - 자바/파이썬/PHP 무관 [자격요건] 학력사항: 학력무관 3년 이상 경력자  1 명 근무조건 급여조건: 연봉 연봉범위 전형단계 및 제출서류 전형단계: 서류전형 > 면접진행 > 최종심사 > 최종합격 추가 제출서류 이력서, 자기소개서 접수방법 2022-06-11 (토) 23시59분까지 접수방법: 인크루트 채용시스템 접수양식: 인크루트 이력서 기타 유의사항 입사지원서 및 제출서류에 허위사실이 있을 경우 채용이 취소될 수 있습니다.",https://i.incru.it/jobTemplet/temp2018/img/temp_slogan.png,,정규직,경력3년이상,서울 > 강서구,초대졸,협의,,코리아써치,중소기업 (사원수 15명),용역·인력알선,"주5일근무, 연차, 월차, 경조휴가, 국민연금, 의료보험, 산재보험, 고용보험",https://job.incruit.com/jobdb_info/jobpost.asp?job=2205120001825
75,웹프로그래머,PHP,GUI 시스템 개발 -최고대우,채용시,"응용프로그래머, 웹프로그래머","GUI 시스템 개발 -최고대우 모집부문 및 자격요건 담당업무 자격요건 인원    GUI 시스템 개발 [자격요건]  경력사항: 경력(5년 이상) 학력사항: 학사 이상 - C, C++, C# 유경험자 - GUI 또는 시스템 프로그램(Linux OS 및 통신) 경력자 - Embedded S/W 개발 경험자 우대  0 명 근무조건 급여조건: 연봉 회사내규 -최고대우 전형단계 및 제출서류 전형단계: 서류전형 > 면접진행 > 최종심사 > 최종합격 추가 제출서류 이력서, 자기소개서 접수방법 채용시 마감 접수방법: 인크루트 채용시스템 접수양식: 인크루트 이력서 기타 유의사항 입사지원서 및 제출서류에 허위사실이 있을 경우 채용이 취소될 수 있습니다.",,,정규직,경력5년이상,서울 > 송파구,대졸이상,회사내규,,BM PHR,중소기업 (사원수 20명),용역·인력알선,"(05855) 서울특별시 송파구 법원로 92 909호(문정동,파트너스1)",https://job.incruit.com/jobdb_info/jobpost.asp?job=2204200007788
76,웹프로그래머,PHP,서버 시스템 엔지니어 (경력 4년 이상 / ICT 기업 / 코스닥상장사),채용시,"웹프로그래머, 응용프로그래머","서버 시스템 엔지니어  ( 경력4년 이상 /  ICT 기업 / 코스닥상장사 )  모집부문 및 자격요건 담당업무 자격요건 인원 [담당업무] ㆍ골프장 DB 시스템 고도화, 관리, 운영, 유지보수 ㆍ디바이스 관리 서버 운영 및 유지보수 [자격요건] ㆍWeb, App 개발 경력 3년 이상 ㆍNodejs / PHP / javascript / jQuery 프로그래밍 가능한 분 ㆍMariaDB 연동 프로그래밍 가능한 분 ㆍ 대용량 데이터를 처리/저장/분석하는 환경을         구축/운영한 경험이 있는 분 ㆍ RestAPI를 활용한 I/F 설계 및 연동 가능한 분  [우대사항] ㆍ벡터 수학식이 이해가 가능한 분 ㆍ커스텀 파일 포맷에 대한 처리 경험이 있는 분 ㆍGit, Jira 협업도구 경험이 있는 분 ㆍ SPA 웹개발(ReactJS, VueJS...)경험 있는 분 ㆍ 윈도우, 리눅스, 맥OS, AWS 다양한 환경 개발 경험이 있는 분 1 명 근무조건 고용형태: 정규직 급여조건: 연봉 협의 후 결정 전형단계 및 제출서류 전형단계: 서류전형 > 면접진행 > 2차면접진행 > 최종합격 추가 제출서류 이력서, 자기소개서 접수방법 채용시 접수방법: 인크루트 채용시스템 접수양식: 인크루트 이력서 기타 유의사항 입사지원서 및 제출서류에 허위사실이 있을 경우 채용이 취소될 수 있습니다.",https://i.incru.it/jobTemplet/temp2018/img/temp_slogan.png,,정규직,경력3~8년,서울 > 강남구,대졸,협의,,주식회사 앤드피플,중소기업 (사원수 5명),용역·인력알선,"(12939) 경기도 하남시 미사강변중앙로7번안길 25 (풍산동,u-테크밸리) D동 210호",https://job.incruit.com/jobdb_info/jobpost.asp?job=2202090001228
77,웹프로그래머,PHP,PHP Python 개발 & 운영 경력직원,채용시,웹프로그래머,"(주)휴메인서치 PHP Python 개발 & 운영 경력직원 모집부문 및 자격요건 담당업무 자격요건 인원 [담당업무] 1. 유통정산 -       음원 / 음반 유통 정산 업무 -       시스템 운영 및 관리 -       신규 프로젝트 개발 -       이슈 발생시 대응  2. 웹 개발 (PHP) -       사내 홈페이지 운영 및 유지 관리 -       신규 프로젝트 개발    [근무부서 및 직급/직책] 직급/직책: 대리, 사원 [자격요건] ㆍ경력 : 경력 2년 ~ 6년 ●       학력: 전문대졸 이상 (컴퓨터공학과 또는 유관 전공자 우대) ●     필수 조건: -       PHP, Python 개발 & 운영 가능한 분 -       Mysql, Linux, GIT 운영 가능한 분 -       REST API 경험자 ●     우대 조건: -       동종 업계 경력자 (음악 업계) -       빅데이터 & 정산 업무 경험  1 명 근무조건 고용형태: 정규직 급여조건: 연봉 협의 후 결정 전형단계 및 제출서류 전형단계: 서류전형 > 면접진행 > 최종심사 > 최종합격 추가 제출서류 이력서에 연락처, 희망연봉 기재 제출한 서류는 일체 반환하지 않음 이력서, 자기소개서 서류전형, 면접전형 접수방법 채용시 접수방법: 인크루트 채용시스템, 이메일 접수양식: 인크루트 이력서, 자유양식 기타 유의사항 입사지원서 및 제출서류에 허위사실이 있을 경우 채용이 취소될 수 있습니다.",https://i.incru.it/jobTemplet/temp2018/img/temp_slogan.png,,정규직,경력2~6년,서울 > 영등포구,초대졸이상,협의,,(주)휴메인서치,중소기업 (사원수 32명),시장조사·여론조사·경영컨설팅,"주5일근무, 연차, 월차, 경조휴가, 창립일휴무, 국민연금, 의료보험, 산재보험, 고용보험...",https://job.incruit.com/jobdb_info/jobpost.asp?job=2202020000032
