,직무중분류,직무소분류,채용공고명,채용기한,해시태그,채용공고상세_text,채용공고상세_img,채용공고상세_url,고용형태,경력,근무지역,학력,급여조건,우대사항,회사명,회사규모,회사분야,복리후생,출처
46,웹프로그래머,PHP,자사 서비스 Front-end 개발자 및 앱개발자 채용,~11.23 (목),"웹프로그래머, 응용프로그래머, 데이터베이스·DBA","자사 서비스 Front-end 개발자 및 앱개발자 채용 주식회사 스타채널 모집부문 및 자격요건 모집부문 담당업무 자격요건 인원 개발자 [담당업무] 담당업무  ㆍ자사 서비스 개발 및 유지보수  ㆍ신규 서비스 개발  ㆍnodejs / vue / php / mysql / AWS   [근무부서 및 직급/직책] 근무부서: 개발팀 직급/직책: 사원, 팀원, 대리 [자격요건] 경력사항: 경력(3년 이상 5년 이하) 학력사항: 학력무관  1 명 풀스텍 [담당업무] 담당업무  ㆍ자사 서비스 개발 및 유지보수  ㆍ신규 서비스 개발  ㆍnodejs / vue / php / mysql / AWS   [근무부서 및 직급/직책] 근무부서: 개발팀 직급/직책: 사원, 팀원, 대리 [자격요건] 경력사항: 경력(3년 이상 5년 이하) 학력사항: 학력무관  1 명 프론트엔드 [담당업무] 담당업무  ㆍ자사 서비스 개발 및 유지보수  ㆍ신규 서비스 개발  ㆍnodejs / vue / php / mysql / AWS   [근무부서 및 직급/직책] 근무부서: 개발팀 직급/직책: 사원, 팀원, 대리 [자격요건] 경력사항: 경력(3년 이상 5년 이하) 학력사항: 학력무관  1 명 백엔드 [담당업무] 담당업무  ㆍ자사 서비스 개발 및 유지보수  ㆍ신규 서비스 개발  ㆍnodejs / vue / php / mysql / AWS   [근무부서 및 직급/직책] 근무부서: 개발팀 직급/직책: 사원, 팀원, 대리 [자격요건] 경력사항: 경력(3년 이상 5년 이하) 학력사항: 학력무관  1 명 개발 [담당업무] 담당업무  ㆍ자사 서비스 개발 및 유지보수  ㆍ신규 서비스 개발  ㆍnodejs / vue / php / mysql / AWS   [근무부서 및 직급/직책] 근무부서: 개발팀 직급/직책: 사원, 팀원, 대리 [자격요건] 경력사항: 경력(3년 이상 5년 이하) 학력사항: 학력무관  1 명 근무조건 고용형태: 정규직(수습기간2개월) 근무부서: 개발팀 급여조건: 월급 협의 후 결정 전형단계 및 제출서류 전형단계: 서류전형 > 면접진행 > 최종심사 > 최종합격 추가 제출서류 이력서, 자기소개서 접수방법 2023-11-23 (목) 23시59분까지 접수방법: 인크루트 채용시스템 접수양식: 인크루트 이력서 기타 유의사항 입사지원서 및 제출서류에 허위사실이 있을 경우 채용이 취소될 수 있습니다.",,,정규직 [수습기간: 2개월],경력3~5년,서울 > 성동구,학력무관,"월급, 협의",,주식회사 스타채널,중소기업 (사원수 22명),방송·광고·영상·오디오,"주5일근무, 연차, 월차, 경조휴가, 반차, 국민연금, 의료보험, 산재보험, 고용보험, 자기...",https://job.incruit.com/jobdb_info/jobpost.asp?job=2211230001729
47,웹프로그래머,PHP,PHP 개발 (경력직)을 모집합니다,채용시,웹프로그래머,"회사 소개 올해로 업력 11년차에 접어든 위즈메이드는 다양한 포트폴리오와 레퍼런스를 가진 회사입니다. 웹 기반의 다양한 솔루션 개발 및 네이티브 기반의 어플리케이션 개발을 전문으로 하고 있습니다. 조직 소개 우리는 웹 기반의 다양한 솔루션과 네이티브 언어를 기반으로 하는 앱 개발을 위한 개발조직을 비롯하여, 디자인, 기획, 퍼블리싱 파트로 조직이 구성되어있으며, 각 조직이 유기적으로 협업하여 일하고있습니다.  우리는 월활한 프로젝트 진행을 위해 항상 자유로운 개발문화를 만들고 사내 복지를 개선하는것에 힘쓰고 있으며, 팀과 개인의 성장을 위해 페스트캠퍼스 강의비를 회사에서 지원하는 등의 노력을 하고 있습니다. 모집 분야 및 직무 내용 직무 모집분야 자격요건 및 우대사항 경력직 (팀원급)  00명, 정규직 PHP 팀원급 직무내용 : PHP기반 CMS(그누보드, XE 등) 또는 프레임워크(CI, 라라벨 등)을 활용한 웹 서비스 개발 자격 요건 PHP를 통한 웹 개발경력 2년 이상 HTML/CSS/ja vasc ript를 활용한 웹 서비스 개발 경력 2년 이상 CSS / HTML5 / 크로스브라우징 코딩이 가능하신분 우대 사항 하나이상의 CMS 또는 프레임워크 사용경험이 있으신 분 경력직 (팀원 또는 팀장급)  00명, 정규직 PHP 팀장급 직무내용 : PHP기반 CMS(그누보드, XE 등) 또는 프레임워크(CI, 라라벨 등)을 활용한 웹 서비스 개발 자격 요건 PHP를 통한 웹 개발경력 4년 이상 HTML/CSS/ja vasc ript를 활용한 웹 서비스 개발 경력 4년 이상 CSS / HTML5 / 크로스브라우징 코딩이 가능하신분 하나 이상의 CMS 또는 프레임워크를 자유롭게 활용하실 수 있는 분 우대 사항 하나 이상 Clouud 서비스 (AWS, GCP 등)의 아키텍쳐를 설계하고 사용하는것이 능숙하신 분 데이터베이스 성능 개선 경험이 있으시거나 성능 개선에 관심이 많은분 리눅스 기반 서버 배포와 운영에 관한 경험을 가지고 계신분 공통사항 우대사항 Webpack (또는 Grunt) / LESS (또는 SCSS) 사용이 익숙하신 분 Jquery, Vue.js, React.js 등의 자바스크립트 라이브러리 사용경험이 있으신 분 오픈 소스 프로젝트에 대한 기여 경험 보유하신 분 (사례 필수 기제) 기술블로그의 운영 경험 보유하신 분 개인 프로젝트 진행 경험이 있으신 분 (github link 등) Git을 통한 협업 및 소스 관리에 능숙하신 분 업무와 관련된 새로운 기술에 관심을 가지고 지속적으로 학습 가능한 분 자기주도적이며 복잡한 문제 해결하는 것을 좋아하는 분 기타사항 자격요건란의 경력을 충족하지 못하더라도 그에 준하는 실력이 있으신 경우 경력으로 인정됩니다 ※ 지원시 직무 별 선호도를 선택하여 지원 기타 자격요건 • 최종합격 후, 풀타임 근무가 가능하신 분 (풀타임 근무 가능시 재학생도 지원 가능) 근무조건 • 근무 형태 : 계약직 -> 정규직 (계약직 3개월 후 정규직 전환검토) • 급여 : 최소 3,000만원(2년차) ~ 개인 실력에 따른 차등지급 • 근무 요일/시간 : 월~금 / 09:00 ~ 18:00 / 일 8시간 / 주 40시간 근무 • 근무 장소 : 부산 금정구 금정로 225 6층 (1호선 구서역에서 300m) 모집 기한 • 본 공고는 서류 지원일 순으로 개별 전형이 진행되며 약 1주 이내로 결과를 안내 드립니다. • 본 공고는 TO 소진 시 마감 되오니 빠른 지원 바랍니다. 전형절차 및 제출서류 • 절차 : 지원 접수 -> 온라인 인터뷰 -> 면접 -> 채용 - [지원서 접수] 자유양식의 포트폴리오를 보내주세요. (자신의 기술스팩을 가장 잘 표현하는 양식) - [온라인 인터뷰] 채팅 또는 유선통화로 몇 가지 질문을 보내드립니다. - [면접] 온라인 인터뷰 후에 개별적으로 면접일정을 보내드릴 예정입니다.  • 입사 시기는 최종합격 후 1주 이내로, 개별협의 될 수 있습니다. • 전형절차는 일정 및 상황에 따라 변동될 수 있습니다. 지원 방법 • 인크루트 사이트를 통한 지원 문의사항 & 질문이 있으신 경우 • 익명으로 질문하기    - 질문하기 :  https://bit.ly/wizmade_qna_send (구글폼)    - 답변보기 : https://bit.ly/wizmade_qna (Notion)  • 유선으로 질문하기    010-6831-2226 (유선통화 또는 문자로 문의)   업무환경 미리보기 혹시 채용공고와 관련하여 정보가 부족했거나 개선이 필요한가요? 더 나은 채용경험을 제공해드리고자 채용공고와 관련된 피드백을 제출해주세요! 제출해주신 의견은 모두 익명으로 처리됩니다 / 피드백 제출하기 : https://bit.ly/wizmade_feedback","https://i.imgur.com/bHeYhIt.png, https://i.imgur.com/k9ejVZE.png",,정규직 [수습기간: 3개월],경력2년이상,"부산 > 금정구, 전지역",학력무관,연봉 3000만원 ~ 3500만원,,위즈메이드(주),,,,https://job.incruit.com/jobdb_info/jobpost.asp?job=2110080004316
48,웹프로그래머,PHP,"Android 개발, iOS개발 외 경력 정규직 채용",채용시,"응용프로그래머, 웹프로그래머","비포 Android 개발, iOS개발 외 경력 정규직 채용 모집부문 및 자격요건 모집부문 담당업무 자격요건 인원 Android 개발 iOS개발 웹 개발 (JSP JAVA) [담당업무] 어플개발, 웹개발, 관공소 프로그램 개발  [근무부서 및 직급/직책] 근무부서: 개발팀 직급/직책: 파트장, 대리, 팀원 [자격요건] 경력사항: 경력(2년 이상 7년 이하) 학력사항: 대학(2,3년)졸업 이상 직무기술: 아이폰, 안드로이드, 응용프로그래밍, OBJECTIVE-C, 웹개발  [우대사항] 자격증: 정보처리기능사, 정보처리기사 1 명 근무조건 고용형태: 정규직(수습기간3개월) 근무부서: 개발팀 급여조건: 연봉 3000 ~ 3500 만원 전형단계 및 제출서류 전형단계: 서류전형 > 면접진행 > 최종심사 > 최종합격 추가 제출서류 이력서, 자기소개서 포트폴리오 접수방법 채용시 접수방법: 인크루트 채용시스템 접수양식: 인크루트 이력서 기타 유의사항 입사지원서 및 제출서류에 허위사실이 있을 경우 채용이 취소될 수 있습니다.",https://i.incru.it/jobTemplet/temp2018/img/temp_slogan.png,,정규직 [수습기간: 3개월],경력2~7년,"경기 > 하남시, 재택근무",초대졸이상,연봉 3000만원 ~ 3500만원,"자격증 : 정보처리기능사, 정보처리기사",비포,중소기업 (사원수 2명),웹에이젼시·IT컨설팅,"주5일근무, 연차, 월차, 국민연금, 의료보험, 산재보험, 고용보험, 자기개발지원, 도서구...",https://job.incruit.com/jobdb_info/jobpost.asp?job=2108120001023
49,웹프로그래머,PHP,지식 콘텐츠 전문기업 (매출 135억) 개발운영팀장 채용,~07.06 (목),"웹프로그래머, 응용프로그래머","인파트너스 지식 콘텐츠 전문기업 (매출 135억) 개발운영팀장 채용 모집부문 및 자격요건 모집부문 담당업무 자격요건 인원 개뱔운영팀장 [담당업무] 대기업 수준의 직원복지, 작지만 강하게 면접비 10만원  개발운영팀장 ; 자사 비즈니스 모델을 바탕으로 개발조직 운영 [주요업무] - 개발팀 리빌딩 - 개발 단위 리딩 (개발팀/SM) - 개발 계획 및 로드맵에 의한 개발 실행 및 적용 - 도입 기술 검토 및 PoC  [지원자격] - JAVA, JSP, MSSQL, RESTFUL API, 아키텍쳐/프레임워크 이해 - AWS 운영 경험, 콘텐츠 제공 서비스 운영 경험 - 개발팀과 비개발팀과 협업 시 긍정적 커뮤니케이션 역량  [우대사항 ] - 서비스 성능 개선을 위한 튜닝 경험이 있으신 분 - 개발환경 개선 로드맵 수립과 실행 경험 있는 분 - 코딩 컨벤션에 기초하여 팀원 관리를 경험하신 분 - 대외 웹서비스 운영 조직을 경험하신 분 - 성과 관리를 위한 제안과 실행/일정 관리 경험 있는 분 - 업무 관리를 위해 JIRA/Confluence를 적극 활용하신 분 - MSA 아키텍쳐 운영 경험, 검색엔진 운영 경험, 캐시 서비스 운영 경험, 빅데이터 분석 경험 우대, NoSQL/REACT/메세지큐 사용경험, CI/CD 운영 경험 우대 [연봉] 9,000만원~10,000만원(면접후 협의)    [근무부서 및 직급/직책] 직급/직책: 과장, 차장, 부장 [자격요건] 경력사항: 경력(7년 이상 20년 이하) 학력사항: 대학교(4년)졸업 이상  1 명 근무조건 고용형태: 정규직(수습기간3개월) 급여조건: 연봉 9,000만원 ~ 1억원 전형단계 및 제출서류 전형단계: 서류전형 > 면접진행 > 최종심사 > 최종합격 추가 제출서류 이력서에 연락처, 희망연봉 기재 제출한 서류는 일체 반환하지 않음 이력서, 자기소개서 서류전형, 면접전형 접수방법 2023-07-06 (목) 23시59분까지 접수방법: 인크루트 채용시스템 접수양식: 인크루트 이력서 기타 유의사항 입사지원서 및 제출서류에 허위사실이 있을 경우 채용이 취소될 수 있습니다.",,,정규직 [수습기간: 3개월],경력7~20년,서울 > 마포구,대졸이상,연봉 9000만원 ~ 1억원,,인파트너스,소기업 (사원수 10명),용역·인력알선,"(06524) 서울특별시 서초구 강남대로107길 21 (잠원동,대능빌딩) 2층",https://job.incruit.com/jobdb_info/jobpost.asp?job=2306060000115
50,웹프로그래머,PHP,"플랫폼 전문기업, PHP 개발 경력자 모집",상시,웹프로그래머,"플랫폼 전문기업, PHP 개발 경력자 모집 본 공고에 지원하시면 성심성의껏 진행하겠습니다. 모집부문 및 자격요건 모집부문 담당업무 자격요건 및 우대사항 인원 PHP 개발  - 플랫폼 내 서비스 개발 및 운영       [자격조건] - PHP개발 3년 이상 (3년 ~ 8년 선호)  - PHP 프레임워크 기반 개발 경험     ; Zend framework, Laravel, CodeIgniter 등 - MySQL 기반 DB설계 역량 - javascript를 이용한 동적 웹페이지 개발 경험 - Linux 서버 기반 개발 환경 경험 - 소스형상관리에 대한 이해도 (Git/SVN 등)  [우대사항 - 필수아님] - Modern PHP, 객체지향 개발에 대한 역량 - 대용량 트래픽 및 데이터 처리 경험 - Java/Spring 기반 웹서비스 개발 경험  [기타사항] - 정규직, 주 5일근무 - 근무지 : 서울 구로구    1 명 근무조건 고용형태: 정규직  주 5일 근무  근무지: 서울 구로구, 참고로 서울시 금천구는 HR컨설팅회사 위치입니다. 근무부서: 개발팀 급여조건: 연봉 협의 후 결정 전형단계 및 제출서류 전형단계: 서류전형 > 면접전형 > 최종심사 > 최종합격 접수방법 채용시 마감 접수방법: 인크루트 채용시스템 접수양식: 인크루트 이력서, 자유양식 담당자 : 오기범전무 연락처 : 010-8895-4651 이메일 : ******@*******.*** 기타 유의사항 입사지원서 및 제출서류에 허위사실이 있을 경우 채용이 취소될 수 있습니다.",https://i.incru.it/jobTemplet/temp2018/img/temp_slogan.png,,정규직,경력3~8년,서울 > 구로구,초대졸이상,협의,,(주)유비소시어스,중소기업 (사원수 50명),용역·인력알선,"주5일근무, 연차, 월차, 경조휴가, 국민연금, 의료보험, 산재보험, 고용보험, 휴양시설, ...",https://job.incruit.com/jobdb_info/jobpost.asp?job=2201060003799
51,웹프로그래머,PHP,"글로벌 의류 플랫폼 전문기업, PHP 웹개발 경력자 모집",상시,웹프로그래머,"글로벌 의류 플랫폼 전문기업, PHP 웹개발 경력자 모집 본 공고에 지원하시면 성심성의껏  진행하겠습니다. 모집부문 및 자격요건 모집부문 담당업무 자격요건 및 우대사항 인원 PHP 웹개발  [포지션] - 정보팀, 대리~과장급  [담당업무] - 쇼핑몰 통합관리 시스템(백오피스) 개발, 외부 시스템 API 연동 - Cafe24 솔루션 기반의 자사몰 개발/운영에 필요한 전반적인 업무지원        [자격조건] - 웹 개발 해당 경력 4년 이상 - PHP / RESTful API 개발 경험 - 샵링커, 사방넷, 플레이오토등, 이커머스 API 연동 경험자 - B2B, B2C 온라인 쇼핑몰 서비스 기능 개발 관련 경험자 - MS-SQL Server 경험  [우대사항] - 패션,유통,물류 전반적인 이해와 지식을 보유하신 분 우대 - 샵링커, 카페24 연동 유경험자 우대 - ASP/HTML 지식 소유자 우대  [기타사항] - 정규직, 주 5일 근무 - 근무지 : 서울 금천구, 가산디지털단디역 근처    0 명 근무조건 고용형태: 정규직  주 5일 근무  근무지: 서울 금천구  근무부서: 정보팀 급여조건: 연봉 협의 후 결정 전형단계 및 제출서류 전형단계: 서류전형 > 면접전형 > 최종심사 > 최종합격 접수방법 채용시 마감 접수방법: 인크루트 채용시스템 접수양식: 인크루트 이력서, 자유양식 담당자 : 오기범전무 연락처 : 010-8895-4651 이메일 : ******@*******.*** 기타 유의사항 입사지원서 및 제출서류에 허위사실이 있을 경우 채용이 취소될 수 있습니다.",https://i.incru.it/jobTemplet/temp2018/img/temp_slogan.png,,정규직,경력4년이상,서울 > 금천구,초대졸이상,협의,,(주)유비소시어스,중소기업 (사원수 50명),용역·인력알선,"주5일근무, 연차, 월차, 경조휴가, 국민연금, 의료보험, 산재보험, 고용보험, 휴양시설, ...",https://job.incruit.com/jobdb_info/jobpost.asp?job=2109280002701
52,웹프로그래머,PHP,국내금융사 - 플랫폼 서비스 백엔드 개발 채용,~07.03 (월),웹프로그래머,"국내금융사  직급: 대리~과장 업무: - 디지털 컨텐츠 플랫폼 서비스를 위한 백엔드 개발 및 운영 - 데이터 모델과 REST API 설계 및 개발  [자격조건] - 국내외 초대졸 이상 - PHP, Javascript 등을 활용한 개발 경력 8년 이상 - 데이터 모델링 경험  우대 - 비동기 시스템 설계 및 운영 경험  우대   [제출서류] 이력서에 연락처, 현재연봉, 희망연봉 기재 제출한 서류는 일체 반환하지 않음 국문이력서  [전형방법] 서류전형, 면접전형  담당자 : Tim 이사 (Pincus Korea) 문의처 : 02-2051-3913 이메일 : ******@*******.***",,,정규직,경력8년이상,서울 > 전지역,초대졸이상,협의,,(주)핀커스코리아,중소기업 (사원수 34명),용역·인력알선,"주5일근무, 연차, 월차, 경조휴가, 육아휴직, 국민연금, 의료보험, 산재보험, 고용보험, ...",https://job.incruit.com/jobdb_info/jobpost.asp?job=2306300003523
53,웹프로그래머,PHP,[국내솔루션기업] 프론트앤드개발자 채용,~07.23 (일),"응용프로그래머, 웹프로그래머, 컨텐츠·사이트운영","[국내솔루션기업] 프론트앤드개발자 채용 모집부문 및 자격요건 모집부문 담당업무 자격요건 인원 프론트앤드개발자 [담당업무] - 클라우드 솔루션 개발 - R&D 및 DeepLearning 플랫폼 개발 - 반응형 웹 기반 사용자 인터페이스 개발(PHP, JSP) [자격요건] - 초대졸이상 - 관련경력 3년~15년 - 보유 기술 : PHP(필수), Node.js, x-x-javascript, jQuery, bootstrap, CSS, HTML, MySQL, Web-framework - 개발 환경 : 리눅스시스템  [우대사항] - 해당 직무 경험자 - 관련 분야 전공자 - 정보처리기사 자격 보유자 - 웹 솔루션 개발자 - 웹 서비스 기획  [전형절차] 서류전형/1,2차 면접전형  [제출서류] 국문이력서/경력기술서/자기소개서 이메일 제출  ******@*******.***  [담당자] 윤현정부장 010-6317-3302 /  ******@*******.***  0 명 근무조건 고용형태: 정규직 급여조건: 연봉 협의 후 결정 전형단계 및 제출서류 전형단계: 서류전형 > 면접진행 > 최종심사 > 최종합격 추가 제출서류 이력서, 자기소개서 접수방법 2023-07-23 (일) 23시59분까지 접수방법: 인크루트 채용시스템 접수양식: 인크루트 이력서 기타 유의사항 입사지원서 및 제출서류에 허위사실이 있을 경우 채용이 취소될 수 있습니다.",,,정규직,경력3~15년,서울 > 영등포구,초대졸이상,협의,,휴먼인써치,-,시장조사·여론조사·경영컨설팅,"(16954) 경기도 용인시 기흥구 흥덕2로87번길 18 (영덕동,이씨티) B동 4층 409호",https://job.incruit.com/jobdb_info/jobpost.asp?job=2306230001483
54,웹프로그래머,PHP,AI Engineer (1년이상) - 미국계 기업용 지식관리 AI 솔루션,채용시,"응용프로그래머, 빅데이터·AI(인공지능), 웹프로그래머","국내 Top 서치펌 프로매치코리아 윤창진 전무입니다. 아래 포지션에 관심 있으시면 ""MS-Word 이력서"" 송부바랍니다. (ASAP 마감)  공고 : AI Engineer (1년이상) - 미국계 기업용 지식관리 AI 솔루션  채용사는 Deep Learning 기술을 이용하여 ""기업용 지식관리 솔루션""을 제공합니다. 기업내에 구글 닥스, 위키 페이지, 사내 게시판 등에 흩어져서 저장되어 있던 지식을 AI 가 자동으로  하이라트, 분류하고, 관리해 주는 서비스를 제공. (본사는 미국 샌프란시스코이며, 2017년 일본 탑 VC로 부터 투자 유치) * 고객사 : SK그룹, KB금융그룹, 코스맥스 그룹, 노무라, 히타치, 후지쯔 등 유수 기업  담당업무 - 자연어 인식 AI 모델을 개발합니다.  - Text Classification, Named Entity Recognition, Machine Reading Comprehension, Review Conversion,    Question and Answering, Sentiment Analysis, Summarization 모델을 지속적으로 설계하고 개선 - 기업의 프러덕션에서 사용할 수 있는 Accuracy 와 Response Time 을 보장할 수 있도록 엔지니어링을 수행  - 데이터 버젼 관리, 모델 버젼 관리, Online Training  필수자격 - Keras, Tensorflow, PyTorch와 같은 딥러닝 프레임워크에 익숙하신 분  - Keras, Tensorflow, PyTorch의 내부 코드를 살펴 본 적이 있으신 분  - Keras 와 Tensorflow의 내부 코드를 살펴 본 적이 있으신 분  - 최신 NLU 의 모델에 대해서 공부한 경험이 있으신 분  - 고객이 직접 사용하는 프러덕션 서비스의 back-end 개발 및 배포 경험이 있으신 분  - 고객의 요구사항에 대해서 기민하게 반응하고, 디자이너, 기획자, 세일즈와 커뮤니케이션이 가능한 분  - Readable 한 코드를 작성하시는 분  - 백엔드의 코드 체인지가 고객에게 어떤 영향을 미치는지 고객 관점에서 생각하실 수 있는 분  우대사항 - 본인이 알고 있는 지식을 팀원과 공유하는데 적극적이신 분  - Redis, Kafka 등 데이터 파이프라인 쪽 처리 경험이 있으신 분  - Large scale web application 개발 경험이 있으신 분  - Open Source 를 사용하시는 것에 열려있지만, 가져다 쓰시는 코드의 내부는 가급적 들여다 보시는 분  - Agile process 에 익숙하신 분  근무지 및 연봉사항 - 서울시 강남구 - 6,000 ~ 12,000 만원 (역량별 협의)  복지 및 기타사항 [글로벌 인재로 성장할 수 있는 기회]  - 미국 휴스턴 본사 및 실리콘 밸리, 일본 도쿄에 있는 팀과 일할 수 있는 글로벌한 업무 환경을 제공.  - 미국 본사로 Exchange Program(1-2개월)을 운영하며 희망할 경우 경비를 지원.   [자율적이고 업무 몰입을 돕는 근무 환경]  - 근무시간은 9시 - 6시가 기본이지만 상황에 맞게 유연한 출/퇴근이 가능.  - 고사양의 노트북과 모니터를 지원해드려요. 그 외 필요한 장비를 적극 지원.  - 주 2회만 사무실 출근하고 나머지는 재택 할 수 있는 Hybrid Work를 시행 중.  - 사무실에 나오시는 날은 점심 값 걱정 없도록, 식사 비용(식사 후 커피까지!)을 지원.  - 재택 근무 하실 때 업무에 몰입할 수 있도록 재택 근무 환경 구축을 위한 비용을 지원.  ----------------------------------------- 프로매치 Korea & AIMS International 헤드헌터 윤창진 전무 이메일 : ******@*******.*** 전화 : 010-7768-2494 -----------------------------------------",,,정규직,신입/경력1년이상,서울 > 강남구,학력무관,협의,,(주)프로매치코리아,중소기업 (사원수 70명),용역·인력알선,"주5일근무, 연차, 월차, 보건휴가, 경조휴가, 결혼기념일 휴가, 국민연금, 의료보험, 산재...",https://job.incruit.com/jobdb_info/jobpost.asp?job=2301120003771
