대분류,소분류,강의명,난이도,가격(현재가격),가격(원래가격),총소요시간,강의소개,언어,출처
data-science,Data Analysis,아빠가 들려주는 [데이터 수집과 정리의 기본],초급자,"17,000",39000,1시간 주문형 동영상,"배울 내용
데이터를 효과적으로 수집하는 방법
데이터 분석하기 좋도록 데이터를 정리하는 방법
잘못된 데이터를 예방하고 찾고 수정하는 방법",한국어,https://www.udemy.com/course/data_basic/
data-science,Data Analysis,"[마이크임팩트 GFC] 데이터로 이룬 투명성, 우리의 삶을 어떻게 바꾸는가",모든 수준,"17,000",49000,1시간 주문형 동영상,"배울 내용
꿈을 찾고 이루고 싶은 오늘의 청춘들
미래와 기술을 알고 싶은 오늘의 사업가들
미래의 자산가를 꿈꾸는 오늘의 투자자들
더 나은 내일을 살고싶은 오늘의 직장인들",한국어,https://www.udemy.com/course/gfc-rndh/
data-science,Python,"【한글자막】 머신러닝의 모든 것 with Python, R",모든 수준,"17,000",88000,44.5시간 주문형 동영상,"배울 내용
Python과 R로 Machine Learning 핵심 모델 완벽 마스터
다양한 모델의 디테일한 동작 원리와 개념들(Regression, SVM, Random Forest, Logistic Regression, k-NN, Naive Bayes, Clustering, 인공신경망, CNN, PCA 등)
차원 축소(PCA)의 핵심 개념
Machine Learning 모델의 성능 향상을 위한 과정(XGBoost, k-Fold Cross Validation, Grid Search)
문제에 따라 적용할 적절한 Machine Learning 모델을 선택하는 방법
강화학습과 Deep Learning의 핵심 모델 일부(UCB, 톰슨 샘플링, 인공신경망, CNN 등)
Machine Learning 모델을 통해 비즈니스를 성장시키는 법",한국어,https://www.udemy.com/course/machine-learning-atoz/
data-science,Statistics,【한글자막】 비즈니스 분석 및 Data Science 를 위한 핵심 통계학 A-Z™,모든 수준,"17,000",88000,6시간 주문형 동영상,"배울 내용
정규 분포에 대한 이해
표준 편차에 대한 이해
연속변수와 불연속변수의 차이
표본 분포에 대한 이해
중심 극한 정리에 대한 이해
실무에서 중심 극한 정리 적용
가설검정에 평균 적용
가설검정에 비율 적용
Z 점수와 Z 테이블 사용
T 점수와 T 테이블 사용
정규 분포와 T 분포의 차이
통계적 유의성에 대한 이해와 적용
신뢰구간 생성
p값 남용의 잠재적 함정",한국어,https://www.udemy.com/course/best-business-analysis/
data-science,Data Analysis,메타분석 입문을 위한 RevMan 배우기,초급자,"17,000",59000,1시간 주문형 동영상,"배울 내용
메타분석의 기본 개념
메타분석을 위한 검색식 잡기
논문 발표를 위한 메타분석의 최소한의 결과들
깔끔하게 정리된 메타분석의 그래프들",한국어,https://www.udemy.com/course/ez_revman/
data-science,Deep Learning,"【한글자막】 딥러닝의 모든 것 with Python, Tensorflow, Pytorch",모든 수준,"17,000",88000,22.5시간 주문형 동영상,"배울 내용
딥러닝 핵심 모델에 대한 깊은 이해와 실제 데이터 적용 실습
ANN(인공 신경망) 모델의 이해와 적용
CNN(합성곱 신경망) 모델의 이해와 적용
RNN(순환 신경망) 모델의 이해와 적용
SOM(자기조직화지도)의 이해와 적용
볼츠만 머신의 이해와 적용
AutoEncoder의 이해와 적용",한국어,https://www.udemy.com/course/best-artificial-neural-networks/
data-science,Data Visualization,너무 쉬운 엑셀 피벗 테이블,초급자,"19,000",59000,2시간 주문형 동영상,"배울 내용
피벗 테이블의 재미를 배웁니다.
최소 시간으로 가장 효율적으로 데이터를 정리합니다.
데이터를 만나면 일단 반가운 마음이 생깁니다.
엑셀의 함수보다 더 쉬운 피벗 테이블의 기능을 능숙하게 사용하게 됩니다.
피벗 테이블에서 발생하기 쉬운 에러들을 사전에 예방하는 방법을 배웁니다.",한국어,https://www.udemy.com/course/pivot_table/
data-science,Computer Vision,【한글자막】 Computer Vision (컴퓨터 비전) : 마스터 클래스,모든 수준,"17,000",88000,25.5시간 주문형 동영상,"배울 내용
얼굴 감지를 위한 캐스케이드 및 HOG 분류기의 기본적 직관 이해하기
OpenCV 및 Dlib 라이브러리를 사용하여 얼굴 감지 구현하기
자동차, 시계, 눈 및 사람의 전신과 같은 객체를 OpenCV를 사용하여 감지하는 방법 배우기
3 개의 얼굴 감지기 결과 비교하기: 하르 캐스케이드, HOG(그래디언트 방향 히스토그램), CNN(합성곱 신경망)
이미지와 웹캠을 사용한 얼굴 감지하기
얼굴 인식을 위한 LBPH 알고리즘의 기본적 직관 이해하기
OpenCV 및 Dlib 라이브러리를 사용하여 얼굴 인식 구현하기
이미지와 웹캠을 사용한 얼굴 인식하기
객체 트래킹을 위한 KCF 및 CSRT 알고리즘에 대한 기본적 직관 이해하기
OpenCV 라이브러리를 사용하여 영상에서 객체를 트래킹하는 방법 배우기
더 보기",한국어,https://www.udemy.com/course/best-computer-vision/
data-science,ChatGPT,모두를 위한 ChatGPT를 이용한 업무자동화 Part 1,초급자,"49,000",,5.5시간 주문형 동영상,"배울 내용
ChatGPT를 이용한 업무자동화 방법
Python 기초와 ChatGPT를 이용해서 Python 코드를 작성하는 법
ChatGPT의 동작 원리
다양한 업무자동화 방법(엑셀, PPT, 크롤링, 이미지처리)",한국어,https://www.udemy.com/course/chatgpt-business-automation-part-1/
data-science,Data Analysis,ADsP 2주 합격 올인원 패스,초급자,"119,000",,25시간 주문형 동영상,"배울 내용
상황에 따른 분석 방법론과 전반적인 데이터분석 프로세스 학습
데이터분석 실무에 필수적인 통계적 지식과 R 지식 습득
필수 이론 및 요점 정리를 통해 자격 검정 시험 완벽 준비
과목별 최신 기출문제 풀이로 시험 준비 완성",한국어,https://www.udemy.com/course/maso-ds-r-onc2005/
data-science,Python,따라하며 익히는 파이썬 데이터수집 마스터,초급자,"17,000",69000,10.5시간 주문형 동영상,"배울 내용
꼭 필요한 파이썬 문법을, 누구보다 쉽게 배웁니다.
데이터 수집, 크롤링의 정수! 핵심 꿀팁까지 알게 됩니다.
selenium을 이용한 브라우저 조작, 입력, 클릭을 할 수 있습니다.
HTML에서 원하는 것을 찾을 수 있습니다(Feat BeautifulSoup)
데이터 수집 결과를 엑셀 파일로 저장할 수 있습니다.",한국어,https://www.udemy.com/course/python_crawling/
data-science,Natural Language Processing,【한글자막】 NLP : Python 으로 배우는 자연어 처리,중급자,"17,000",88000,11.5시간 주문형 동영상,"배울 내용
Python으로 텍스트 파일 작업하는 방법
Python으로 PDF 파일 작업하는 방법
텍스트에서 패턴 검색을 위한 정규 표현식 활용
초고속 토큰화를 위한 spaCy 사용
어간 추출 및 표제어 추출
단어 집합과 검색
품사 태깅을 사용한 원시(raw) 텍스트 파일 자동 처리
개체명 인식 이해
spaCy로 POS(품사 태깅) 및 NER(개체명 인식) 시각화
SciKit-Learn(사이킷런)을 통한 텍스트 분류
토픽 모델링을 위한 잠재 디리클레 할당
비음수 행렬 분해
더 보기",한국어,https://www.udemy.com/course/global-top-100-nlp-python-246/
data-science,Artificial Intelligence,【한글자막】 AI 만들기 : 강화학습과 인공신경망 완전 정복,모든 수준,"17,000",88000,16.5시간 주문형 동영상,"배울 내용
인공지능의 배경이 되는 핵심 이론 완벽 이해
최신 강화학습 모델을 통한 인공지능 구현 (Q-Learning, Deep Q-Learning, Deep Convolutional Q-Learning, A3C)
최신 딥러닝 핵심 모델을 통한 인공지능 구현 (인공신경망, ANN, CNN)
AI 모델을 실제 문제 해결에 적용하는 과정 실습 (가상의 자율주행 알고리즘 만들기, 게임 필승 AI 모델 만들기)",한국어,https://www.udemy.com/course/best-ai-17-hours/
data-science,Python,【한글자막】 Python : 통계 분석을 위한 파이썬,초급자,"17,000",59000,8.5시간 주문형 동영상,"배울 내용
데이터에 대한 더 깊은 인사이트
파이썬을 사용하여 일반적 또는 복잡한 통계 및 머신 러닝 관련 프로젝트 해결
시각적 출력 및 그래픽 탐색을 통합하여, 결과를 해석하고 시각화하는 방법
파이썬으로 가설을 검증하고 효율적으로 검정을 구현하는 방법
데이터 분석 탐색(데이터 로딩, 아웃라이어, 1D분포 등)
특성화(평균 중간값 모드, 폭, 왜도 및 첨도, 백분위수 등)
확률(확률분포, 확률 함수, 경험적 분포, 샘플링 및 중심극한정리 등)
가설검증(기본검증, 비율 검증 등)",한국어,https://www.udemy.com/course/best-python-statistics/
data-science,R (programming language),【한글자막】 R 프로그래밍 A-Z™: 직접 코딩하며 배우는 R 프로그래밍 !,모든 수준,"17,000",88000,10.5시간 주문형 동영상,"배울 내용
R 프로그래밍을 잘 하는 방법
R 스튜디오 사용법
프로그래밍의 핵심 원칙
R에서 벡터를 만드는 방법
변수를 만드는 방법
R의 정수형, 실수형, 논리형, 문자형 등 여러 자료형
R에서 while() 루프 및for() 루프를 만드는 방법
R에서 행렬을 만들고 사용하는 방법
matrix() 함수, rbind() 및 cbind()
R에서 패키지를 설치하는 방법
R 스튜디오를 내 취향대로 사용자 정의하는 방법
큰 수의 법칙 이해
정규 분포 이해
R에서 통계 데이터를 다루는 연습
더 보기",한국어,https://www.udemy.com/course/best-r-coding/
data-science,Apache Spark,【한글자막】 Apache Spark 와 Scala로 빅 데이터 다루기,모든 수준,"17,000",88000,9시간 주문형 동영상,"배울 내용
빅데이터 분석 문제를 Apache Spark 스크립트로 프레임화
Scala 프로그래밍 언어를 사용하여 분산 코드 개발
파티셔닝, 캐싱 및 기타 기술을 통해 Spark 작업 최적화
Hadoop 클러스터에서 Spark 스크립트 구축, 디플로이 및 실행
Spark Streaming으로 연속적인 데이터 스트림 처리
SparkSQL, DataSets 및 DataFrames를 사용하여 구조화된 데이터 변환
GraphX를 사용하여 그래프 구조 순회 및 분석
Spark의 머신 러닝으로 방대한 데이터 세트 분석",한국어,https://www.udemy.com/course/best-scala-apache-spark/
data-science,Statistics,역학조사관을 위한 통계,초급자,"17,000",49000,3시간 주문형 동영상,"배울 내용
역학조사에 필요한 기본적인 통계적 개념
역학조사에 활용할 수 있는 통계적 도구의 실제 사용법",한국어,https://www.udemy.com/course/ez-epidem/
data-science,Math,【한글자막】 Machine Learning 라이브러리 수학적 기초,모든 수준,"17,000",88000,15.5시간 주문형 동영상,"배울 내용
모든 Machin Learning 및 Data Sciencedml 기초가 되는 중요한 수학 과목인 선형 대수와 미적분학의 기초 이해
가장 중요한 세 가지 세 가지 Python 텐서 라이브러리인 NumPy, TensorFlow 및 PyTorch를 모두 사용하여 텐서를 조작합니다.
머신러닝과 데이터 사이언스에 필수적인 벡터와 행렬 계산을 활용하는 방법
고유벡터, SVD, PCA를 활용하여 복잡한 데이터의 차원을 가장 유익한 요소로 축소하는 방법
심화 기술 (예, 유사역행렬) 및 기본 기술 (소거법)를 활용한 미지수에 대한 해결
파이썬의 interactive code 데모를 통해 미적분 원리의 상세 이해
연쇄 법칙과 같은 심화 미분 법칙 상세 이해
머신러닝 비용 함수의 편도함수를 TensorFlow와 PyTorch를 이용하여 뿐만 아니라 직접 계산
더 보기",한국어,https://www.udemy.com/course/best-ml-math/
data-science,Machine Learning,【한글자막】 Machine Learning 완벽 실습 : 6가지 실제 사례 직접 해결하기,중급자,"17,000",69000,8.5시간 주문형 동영상,"배울 내용
실제 데이터 과학 프로젝트가 어떤지 배우게 됩니다.
이 사례 연구를 이력서에 포함할 수 있습니다.
머신 러닝 실무자로 자신을 홍보할 수 있습니다.
데이터 과학 직무 면접에서 자신감을 느낄 것입니다.
여러 머신 러닝 알고리즘을 연결하여 목표를 달성하는 방법을 배우게 됩니다.
Seaborn과 Matplotlib를 사용한 고급 데이터 시각화 기술을 배우게 됩니다.
로지스틱 회귀에 대해 배우게 됩니다.
L1 정규화(Lasso)에 대해 배우게 됩니다.
랜덤 포레스트 분류기에 대해 배우게 됩니다.",한국어,https://www.udemy.com/course/best-machine-learning-6/
data-science,Data Analysis,【한글자막】 Pandas 및 Python 을 이용한 데이터 분석 : 마스터 클래스,모든 수준,"17,000",79000,21시간 주문형 동영상,"배울 내용
데이터를 관리, 정렬 및 시각화하는 고급 파이썬 도구 마스터
과학적 컴퓨팅을 위한 넘파이, 데이터 분석을 위한 판다스 등 파이썬 주요 라이브러리 사용 방법
맷플롯립 및 씨본 라이브러리를 통해 데이터를 시각화하고 인사이트를 얻어 정보에 입각한 결정 내리기
피처 엔지니어링을 통한 대용량 데이터 세트 관리, 머신 러닝 및 데이터 사이언스에 적용하기 위한 데이터 정리
히트맵, 상관관계 분석, 산점도, 파이 차트, 페어 플롯, 벤다이어그램, 3D 플롯, 히스토그램, 워드 클라우드 및 군집 플롯 생성",한국어,https://www.udemy.com/course/best-pandas-python/
data-science,Amazon Sagemaker,【한글자막】 초보자를 위한 AWS SageMaker 실습 | 6개 프로젝트 구축하기,중급자,"17,000",88000,16시간 주문형 동영상,"배울 내용
AWS SageMaker를 활용한 AI/ML 모델 훈련 및 구현
하이퍼 파라미터 최적화 검색을 통한 모델 파라미터 최적화
선형 회귀 모형 개발, 훈련, 테스트 및 구현을 통한 미래 예측
생산 수준 다중 다항 회귀 분석 모델을 구현해 주어진 특징을 기반으로 매장 매출 예측
이미지 분류를 수행하기 위한 딥러닝 기반 모델 개발
DeepAR을 사용해 미래의 제품 가격을 예측하는 시계열 예측 모델 개발
SageMaker를 사용하여 정서 분석 모델을 개발 및 구현
훈련된 NLP 모델을 구현하고 보안 API를 사용하여 상호 작용 및 예측
SageMaker 내 알고리즘을 사용한 객체 감지 모델 훈련 및 평가",한국어,https://www.udemy.com/course/best-aws-sagemaker/
data-science,Oracle SQL,데이터 분석의 첫걸음! 오라클 SQL 쉽게 배우기,모든 수준,"59,000",,2.5시간 주문형 동영상,"배울 내용
실무에서 필요한 데이터를 직접 뽑아낼 수 있습니다.
엑셀에서 처리할 수 없는 큰 데이터베이스를 관리할 수 있습니다.
수작업으로 수정하지 않고도 몇 개의 스크립트만으로 빅데이터를 이해, 관리할 수 있습니다.
보고서 작성을 위한 단계별로 체계적인 로지컬 뷰를 작성할 수 있습니다.",한국어,https://www.udemy.com/course/cloom-sql-oracle/
data-science,TensorFlow,【한글자막】 TensorFlow 2.0 : 딥러닝 모델 구현 마스터 패키지,초급자,"17,000",88000,13시간 주문형 동영상,"배울 내용
데이터 사이언스에서 TensorFlow 2.0을 사용하는 방법
TensorFlow 1.x와 Tensorflow 2.0의 주요 차이점
TensorFlow 2.0에서 인공 신경망을 구현하는 법
TensorFlow 2.0에서 CNN을 구현하는 법
TensorFlow 2.0에서 RNN을 구현하는 법
TensorFlow 2.0으로 자신만의 전이 학습 애플리케이션을 구축하는 법
강화학습(Deep Q-Learning) 모델을 통해 주식 거래 봇을 만드는 방법
TensorFlow 2.0에서 머신러닝 데이터 파이프라인을 구축하는 법
Tensorflow 변환을 사용하여 데이터 유효성 검사 및 데이터셋 전처리를 수행하는 법
TensorFlow 2.0로 구현한 모델을 실제 서비스에서 운영하는 법
더 보기",한국어,https://www.udemy.com/course/best-keras-api-tensorflow-20/
data-science,Artificial Intelligence,【한글자막】 AI : 인공 지능 마스터 클래스,모든 수준,"17,000",79000,12시간 주문형 동영상,"배울 내용
AI를 만드는 방법
하이브리드 지능 시스템을 만드는 방법
완전 연결형 신경
컨볼루션 신경망
반복 신경망
오토 인코더
가변 오토 인코더
혼합 밀도 네트워크
심층 강화 학습
정책 경사
유전 알고리즘
진화 전략
공분산 행렬 적응 진화 전략(CMA-ES)
컨트롤러
메타 학습
심층 신경 진화",한국어,https://www.udemy.com/course/best-ai-masterclass/
data-science,PySpark,【한글자막】 PySpark 로 빅데이터 분석하기 with Python,중급자,"17,000",88000,10.5시간 주문형 동영상,"배울 내용
Python과 Spark를 함께 사용하여 빅데이터 분석하기
새로운 Spark 2.0 DataFrame 신텍스을 사용하는 방법 알아보기
실제 상황을 모방한 컨설팅 프로젝트를 진행하기
로지스틱 회귀로 고객 이탈 분류하기
분류를 위해 랜덤 포레스트와 함께 Spark 사용하기
Spark의 Gradient Boosted Tree 사용 방법 알아보기
Spark의 MLlib를 사용하여 강력한 기계 학습 모델 만들기
DataBricks 플랫폼에 대해 알아보기
빅데이터 분석을 위한 Amazon Web Services EC2 설정하기
AWS Elastic MapReduce 서비스 사용 방법을 알아보기
더 보기",한국어,https://www.udemy.com/course/best-pyspark-spark-python/
data-science,Data Visualization,【한글자막】 Python 을 사용한 데이터 시각화,모든 수준,"17,000",79000,4.5시간 주문형 동영상,"배울 내용
데이터 시각화를 위한 가장 중요한 구성 요소를 이해
Python 라이브러리를 사용하여 다양한 유형의 그래프를 작성
Flotly, Matplotlib 및 Seaborn 사용 방법을 학습
새로운 통찰력을 얻고 데이터 또는 결과를 명확하게 설명하는 데 도움이 되는 도구를 구축
대화형 시각화를 생성",한국어,https://www.udemy.com/course/best-python-data-visualization/
data-science,Python,파이썬 머신러닝 Starter 강의 (초급),초급자,"17,000",69000,8.5시간 주문형 동영상,"배울 내용
파이썬 머신러닝 실행 가능
Orange3를 통한 메뉴 클릭 버전의 머신러닝 수행
분류(classification) 문제에 대한 4가지 머신러닝 모델 실행
머신러닝 및 딥러닝 개요 학습",한국어,https://www.udemy.com/course/stroke-starter/
data-science,Machine Learning,사무직 직장인 맞춤 | 실전예제로 배우는 파이썬 10시간 완성 | 판다스+크롤링+머신러닝,초급자,"17,000",69000,10시간 주문형 동영상,"배울 내용
판다스 - 데이터프레임, 필터, 그룹바이, 머지, 컨캣
크롤링 - Beautifulsoup, requests, selenium, HTML
머신러닝 - 아래 내용들
데이터전처리
선형회귀
오버샘플링, 언더샘플링
로지스틱회귀
분류모델의 성능확인
서포트 벡터 머신
결정트리, 앙상블 모델
교차검증, 크로스밸리데이션
그리드서치
파이프라인",한국어,https://www.udemy.com/course/6-pthfaw/
data-science,Data Science,왕초보 데이터 분석 with R,모든 수준,"17,000",79000,14시간 주문형 동영상,"배울 내용
R의 기초문법을 배웁니다.
R을 활용한 데이터 전처리, 시각화 등을 배웁니다.
R을 활용하여 캐글데이터를 배웁니다.
R을 활용하여 기초 통계를 배웁니다.",한국어,https://www.udemy.com/course/beginner_with_r/
data-science,ChatGPT,"직장인맞춤 | ChatGPT 로 배우는 초단기 파이썬 코딩 | 실전 문제 13개 | 판다스, 크롤링 포함",초급자,"17,000",49000,1.5시간 주문형 동영상,"배울 내용
코드 작성 없이 코딩 하는법
ChatGPT 활용하는 법
파이썬 기본 개념
판다스
크롤링(스크레이핑)",한국어,https://www.udemy.com/course/code_with_chatgpt/
data-science,Artificial Intelligence,【한글자막】 Deep Reinforcement Learning :딥 강화형 러닝 2.0,초급자,"17,000",69000,9.5시간 주문형 동영상,"배울 내용
Q러닝
딥 Q러닝
정책 그래디언트
액터 크리틱
심층 확정적 정책 그래디언트(DDPG)
트윈 딜레이 DDPG(TD3)
딥 강화형 러닝의 기초 기술
까다로운 가상 애플리케이션 이상의 최첨단 AI 모델을 실행하는 방법",한국어,https://www.udemy.com/course/best-deep-reinforcement-learning/
data-science,Apache Spark,【한글자막】 스파크 스트리밍과 Scala 로 빅 데이터 스트리밍하기 (실전편),모든 수준,"17,000",69000,6.5시간 주문형 동영상,"배울 내용
스파크스트리밍을 사용하여 실시간 대용량 데이터를 스트림 처리합니다
카프카, 플룸, 키네시스와 같은 데이터 소스를 스파크스트리밍을 이용하여 통합합니다
구조화된 스파크 2의 스트리밍 응용 프로그램 인터페이스를 사용합니다
스칼라 프로그래밍 언어를 사용하여 스파크 응용 프로그램을 만듭니다
출력된 결과는 실시간 데이터를 카산드라 또는 파일 시스템으로 변환시킨 것을 배웁니다
스파크 스트리밍을 스파크 구조화 질의어와 통합하여 실시간으로 스트리밍 데이터를 질문합니다
스트리밍 데이터를 사용하여 실시간 교육에 사용하고 머신러닝 모델을 가르쳐서 실시간 예측에 이용합니다
아파치 로그 액세스 데이터를 수집하고 스트림을 변환합니다
더 보기",한국어,https://www.udemy.com/course/best-scala/
data-science,Python,파이썬(Python) 실무 데이터 분석 프로젝트 - 머신러닝 with 사이킷런(scikit-learn),중급자,"69,000",,10.5시간 주문형 동영상,"배울 내용
파이썬 핵심 패키지 정리를 통한 데이터 분석과 데이터 시각화 진행
머신러닝의 지도학습과 비지도학습, 강화학습의 개념과 차이 이해
파이썬 머신러닝 패키지 사이킷런에 대한 이해와 프레임워크 정리
실전 사례와 사이킷런 실습을 통한 알고리즘의 핵심 이해",한국어,https://www.udemy.com/course/maso-ds-python-onc33/
data-science,Financial Analysis,【한글자막】 재무 분석을 위한 Python 및 Machine Learning 완벽가이드,모든 수준,"17,000",79000,23시간 주문형 동영상,"배울 내용
금융에 초점을 맞춘 데이터 과학과 머신 러닝을 위한 파이썬 3 프로그래밍을 마스터하게 됩니다.
파이썬의 강력한 기능을 이용해 일일 포트폴리오 수익률, 리스크 및 샤프 비율 계산과 같은 주요 재무 개념을 활용하는 방법을 배우게 됩니다.
CAPM(자본 자산 가격 모델)에 대한 이론을 이해하고 직관을 가질 수 있습니다.
주피터 노트북을 활용한 데이터 사이언스의 개발, 발표, 공유 방법을 이해할 수 있습니다.
과학 컴퓨팅에 Numpy, 데이터 분석에 Pandas, 데이터 플로팅, 시각화를 위한 Matplotlib, 그리고 통계그림을 위한 Seaborn 등 주요 파이썬 라이브러리 활용법을 배웁니다.
실제 데이터세트를 활용해 싸이킷런 라이브러리를 이용한 머신러닝 모델 구축, 교육, 및 튜닝을 마스터합니다.
주가 예측, 보안 뉴스 감성 분석, 신용카드 사기 탐지, 은행 고객 세분화, 대출 채무 불이행 예측 등 은행과 금융 분야의 실질적인 문제 해결을 위한 머신, 딥러닝 모델을 적용해봅니다.
회귀 작업(단순/다중/다항식), 분류 및 클러스터링(K 평균)에 대한 다양한 기계 학습 알고리즘의 이론을 이해하고 직관을 키웁니다.
더 보기",한국어,https://www.udemy.com/course/best-python-mi-financial-analysis/
data-science,TensorFlow,TensorFlow로 배우는 심층 강화학습 입문 - Deep Reinforcement Learning,중급자,"88,000",,5.5시간 주문형 동영상,"배울 내용
심층 강화학습(Deep Reinforcement Learning)의 기초와 원리
기본 DQN과 Double Q-Learning, Duel Q-Learning, Prioritized Experience Replay(PER) 최신 논문에서 제안된 심화 DQN 기법
Vanila Policy Gradient(REINFORCE) 기법과 Actor-Critic Method 심화 Policy Gradient 기법(Proximal Policy Optimization[PPO])
TensorFlow를 이용한 최신 심층 강화학습(Deep Reinforcement Learning) 기법 구현 방법",한국어,https://www.udemy.com/course/tensorflow-deep-reinforcement-learning/
data-science,Python,【한글자막】 Python 의 모든 것: 실전 문제로 배우는 파이썬,모든 수준,"17,000",79000,11시간 주문형 동영상,"배울 내용
파이썬 상에서 프로그래밍하는 법
Jupyter Notebook 상에서 코드 완성하는 법
프로그래밍의 핵심 원리
변수 생성하는 법
정수형, 실수형, 논리연산, 문자열 등의 파이썬 데이터 타입
while 루프 및 for 루프 생성하는 법
파이썬 패키지 설치법
큰 수의 법칙에 대한 이해",한국어,https://www.udemy.com/course/best-python-data-science/
data-science,TensorFlow,GPT 논문 구현으로 배우는 딥러닝 논문 구현 with TensorFlow 2.0 Part 1,전문가,"119,000",,4.5시간 주문형 동영상,"배울 내용
딥러닝 논문 읽는 법
딥러닝 논문 구현하는 법
GPT(Generative Pre-trained Transformer) 모델 구조에 대한 디테일한 이해
GPT(Generative Pre-trained Transformer) 모델에 대한 배경지식
TensorFlow 2.0을 이용한 코드 작성법",한국어,https://www.udemy.com/course/gpt-transformer-implementation-tensorflow-part1/
