대분류,소분류,강의명,난이도,가격(현재가격),가격(원래가격),총소요시간,강의소개,언어,출처
web-development,React JS,"Social Network App With React ,Redux ,Firebase ,Tailwind CSS",초급자,"17,000","₩59,000",6.5시간 주문형 동영상,"배울 내용
One of the best thing about this course/project is , We Will Not Use Any External Libraries for Components.
So you will learn how to build components like forms , buttons , layouts , modals from scratch
User Authentication with Gmail , Google
Post Interactions and analytics with Firestore snapchats
Tailwind CSS concepts like flex , grid , positions , responsiveness , colours , sizes etc
Deployment to Netlify
Complete source with 24/7 Q/A Support
Popular social networks functionalities like Comments , Shares , Likes with Real time response",영어,https://www.udemy.com/course/social-network-app-with-react-redux-firebase-tailwind-css/
web-development,Redux Framework,The Redux Official Course Tutorial Code Along For All Levels,모든 수준,"17,000","₩23,000",10시간 주문형 동영상,"배울 내용
Master Redux from beginner to advanced level, gaining a deep understanding of Redux concepts, principles, and best practices.
Successfully migrate traditional Redux applications to Redux Toolkit (RTK) for improved productivity and simplified development workflows.
Develop proficiency in querying, caching, and normalization using RTK Query, optimizing data handling in Redux applications.
Apply advanced memoization techniques and optimization strategies to enhance performance and efficiency in Redux applications.
Implement WebSocket streaming for real-time communication in Redux, enabling seamless and instant data updates.
Build a comprehensive social media app from scratch, showcasing advanced Redux architecture, features, and a sophisticated mock database.
Acquire TypeScript fundamentals and integrate TypeScript with Redux for type-safe and robust application development.",영어,https://www.udemy.com/course/the-redux-master-course-tutorial-code-along-for-all-levels/
web-development,Django,The Ultimate Authentication Course with Django and VueJS,모든 수준,"17,000","₩49,000",3.5시간 주문형 동영상,"배울 내용
Use Django Rest Framework
Connect Django with MySQL
Use Access & Refresh Tokens
Use HttpOnly Cookies
Send Emails
Login using 2 Factor Authentication (2FA) with Google Authenticator
Social Authentication using your Google Account
Use Vue 3 Composition API
Use Vuex",영어,https://www.udemy.com/course/vue-django-authentication/
web-development,CSS,Easy CSS with Sass,모든 수준,"23,000",,2시간 주문형 동영상,"배울 내용
By the end of this course you will be able to produce the stylesheet for a set of attractive looking web buttons
In this course you will learn how to install and use Sass in order to easily produce and manage your css files",영어,https://www.udemy.com/course/sass-css/
web-development,Full Stack Web Development,Youtube Clone Website Using Django - FULLSTACK - 2023,모든 수준,"17,000","₩59,000",16.5시간 주문형 동영상,"배울 내용
Create a fully functional web site using the Full-Stack with Django (Latest Version)
Learn how to use HTML to create website content and page structures.
Use Basic to Advanced CSS to create beautifully styled sites and animations.
Learn the power of Python to code out your web applications logic and funtions
Learn how to take advantage of Bootstrap to quickly style sites if needed
Use Javascript to interact with sites on the Front-End and work asynchronously
Implement a full Models-Views-Templates structure for your site using Function Based View
Well-detailed and clear explanation of code line by line
Use Django as a back end for the websites and HTML, CSS and JS as Frontend
Create fantastic landing User Interfaces and Experiences",영어,https://www.udemy.com/course/fullstack-youtube-clone-using-django/
web-development,Web API,Hands-on .NET Web API Documentation with Swagger/OpenAPI,중급자,"17,000","₩23,000",3.5시간 주문형 동영상,"배울 내용
Understand OpenAPI/Swagger, their differences, and the need for documentation in Web API.
Create an OpenAPI document using Swashbuckle in ASP .NET Web API through a step-by-step approach.
Create an OpenAPI document using NSwag in ASP .NET Web API step-by-step.
Use Swagger and Swagger UI tools from the OpenAPI community to create a rich API document.
Use Web API Analyzers to guide you in including appropriate attributes for achieving complete documentation.
Use Web API Conventions to automate and quickly document APIs with minimal efforts.
Learn the various approaches available for documenting a Web API including XML comments, data annotations, and so on.
Understand the steps involved in documenting API with multiple versions by creating one document per version.",영어,https://www.udemy.com/course/aspnetcore-webapi-documentation/
web-development,HTML,Beginning Responsive Web Development with HTML and CSS,중급자,"19,000","₩25,000",7시간 주문형 동영상,"배울 내용
Learn what is a responsive design and its importance in modern web development
Fully utilize cleaner, faster, and semantically rich HTML markup
Integrate CSS media queries into designs to serve unique styles to audiences
Create web forms with built-in validation and interface elements using only HTML
Use latest stylistic flourishes with custom fonts, properties, and selectors
Use SVGs for resolution independence",영어,https://www.udemy.com/course/beginning-responsive-web-development-with-html-and-css/
web-development,PDO,PDO & MySQL: Connect to MySQL DB using PDO & CRUD Operations,모든 수준,"17,000","₩23,000",2시간 주문형 동영상,"배울 내용
1- Connect to MySQL Database using PDO
2- Write simple PDO queries without parameters
3- Write PDO queries with parameters –Prepare statements
4- Get data out of statements using –foreach(), fetch(), fetchAll()
5- Getting data out of statement - PDO::rowCount() – the proper use of the rowCount() function
6- Getting affected rows and last insert id
7- Write a PDO Wrapper class and methods
8- Error handling and Exceptions",영어,https://www.udemy.com/course/connect-to-mysql-db-using-pdo/
web-development,JavaScript,JavaScript DOM Projects InterActive Dynamic WebPages Games,모든 수준,"19,000","₩69,000",11시간 주문형 동영상,"배울 내용
Perfect to get started with JavaScript - loaded with starter projects to get you coding
Master the DOM (document object model)
Explore how you can learn JavaScript while building FUN real world JavaScript projects from Scratch
Create interactive and dynamic web pages
Selection of web page elements and manipulation of elements",영어,https://www.udemy.com/course/javascript-dom-js/
web-development,REST API,Learn how to call REST APIs using JavaScript,초급자,"19,000","₩25,000",1시간 주문형 동영상,"배울 내용
Understand Restful Routing concept
Work on Real Practical examples
Discover online REST APIs
Call REST APIs using JavaScript",영어,https://www.udemy.com/course/restful-routing-with-practical-examples/
web-development,PHP,PHP - A 3-Step Process to Master PHP for Newbies + Templates,모든 수준,"19,000","₩25,000",3.5시간 주문형 동영상,"배울 내용
Learn how to develop impressing PHP programs in a few minutes/ hours.
Learn the basic PHP skills needed to apply for PHP developer positions.
Gain enough experience to pass a core PHP programming interview and perform well on the job.
Be able to sit for and pass the PHP Certificate exams.",영어,https://www.udemy.com/course/php-3-step-process-to-master-php-for-beginners-templates/
web-development,Amazon Affiliate Marketing,Create an Amazon Affiliate Marketing Website with WordPress,초급자,"17,000","₩23,000",1시간 주문형 동영상,"배울 내용
How to create a blog website
How to make money with Amazon affiliate marketing
How to make a website with coding knowledge
How to write converting blog posts",영어,https://www.udemy.com/course/create-an-amazon-affiliate-marketing-website-with-wordpress/
web-development,WordPress,WordPress for Beginners - Create Beautiful Websites Quickly,초급자,"17,000","₩23,000",5시간 주문형 동영상,"배울 내용
This course will teach anyone to build a functional, beautiful, responsive website with WordPress.
Understand the main features of WordPress
Create pages and posts, and most importantly, know the difference between the two.
Understand plugins & themes and how to find/install them
Create a Responsive Website that looks good on any browser",영어,https://www.udemy.com/course/wordpress-for-beginners-create-beautiful-websites-quickly/
web-development,Node.Js,Node Js MongoDb Vs Php Mysql :Build The Same Web Application,모든 수준,"19,000","₩25,000",10시간 주문형 동영상,"배울 내용
php from basics
Mysql database and sql queries
express js,ejs ,bodyParser
MongoDb database and mongoose queries
create a complete web application with an admistration system using php in the first time and recreated in node expresse js
full comparison between mysql and mongodb and between node express js and php",영어,https://www.udemy.com/course/node-js-mongodb-vs-php-mysql-build-the-same-web-application/
web-development,Blockchain,Developer Course for the Algorand Blockchain,중급자,"219,000",,2시간 주문형 동영상,"배울 내용
A deeper understanding of the Algorand Virtual Machine (AVM) including what it is and its functionality.
The ability to use TEAL and PyTeal to write Algorand Smart Contracts (ACS1) and deploy them on the Algorand blockchain.
Learn how to integrate Algorand Smart Contracts (ACS1) into your dApps.
Gain understanding about smart contract security and critical processes in blockchain/Web3 development.",영어,https://www.udemy.com/course/developer-course-for-the-algorand-blockchain/
web-development,WordPress,WordPress & SEO Power 2023: Become a 5 Figure Web Developer,초급자,"17,000","₩23,000",39.5시간 주문형 동영상,"배울 내용
Master WordPress essentials: build, customize & manage dynamic websites for diverse niches
Unlock Elementor's potential: design futuristic AI car landing pages & clone famous sites
Comprehensive WooCommerce guide: establish powerful e-commerce stores with ease & efficiency
Boost site performance: speed optimization using WP Rocket & Cloudflare CDN integration
Robust SEO Masterclass: on-page, off-page, white hat, black hat techniques & best practices
Keyword research & site audit mastery: leverage Ahrefs, Ubersuggest & other powerful tools
Profit from ChatGPT: craft optimized content & establish news blogs for passive income
Freelance opportunities: build consulting sites & upscale affiliate content for success",영어,https://www.udemy.com/course/wordpress-complete-course-2023/
web-development,Rust (programming language),Front end web development in Rust,중급자,"17,000","₩23,000",7시간 주문형 동영상,"배울 내용
Developing frontend components with Yew's virtual DOM
Becoming familiar with the Rust WebAssembly ecosystem
Interacting with browser and listening to events via wasm and websys
Communicating to web APIs for CRUD via an authorization layer",영어,https://www.udemy.com/course/front-end-web-development-in-rust/
web-development,Web API,Minimal Web API Fundamentals in .NET 6/7,모든 수준,"17,000","₩23,000",4.5시간 주문형 동영상,"배울 내용
What is a Minimal Web API?
Build a Minimal Web API Project
Use PostMan and Swagger to Test API Calls
Using the MapGet(), MapPost(), MapPut() and MapDelete() Methods
Build a Router Base Class to Simplify Your Minimal APIs
Add Logging to your Web API Calls
Add Exception Handling to your Web API Calls
Develop a Complete Set of CRUD APIs
Call your Web APIs from JavaScript/jQuery
Add CORS to Allow Cross-Domain Calls
Securing Minimal Web APIs
Creating Asynchronous API Calls",영어,https://www.udemy.com/course/csharp-minimal-web-api-fundamentals/
web-development,HTML,HTML & CSS for Beginners: First Step to Your Coding Career,초급자,"17,000","₩69,000",12시간 주문형 동영상,"배울 내용
How to use HTML tags and CSS selectors
Installing and setting VSC code
Learning super efficient shortcuts including EMMET
What are attributes
How to add image on your website
What are meta tags and what they are used for
How to list elements
How to create internal/external links?
How to format your text professionally using text formatting tags?
How to create user forms with inputs?
How to create tables?
Difference between display block/inline/inlineblock
더 보기",영어,https://www.udemy.com/course/html-css-emmet-for-beginners/
web-development,Node.Js,Mastering MEAN.JS: Fullstack Ultimate Course,초급자,"17,000","₩23,000",19시간 주문형 동영상,"배울 내용
Build e-commerce Angular + NodeJS application from scratch integrate Angular Material.
Use VS Code, Angular Material, Git. Learn debugging both server and client from vscode.
Learn Reactive Angular programming and learn organizing angular modules, folders and their dependencies.
Server side programming using nodeJS and express and debugging & Fixing Bugs. Demo on angular debugging, fixing bugs
Securing web APIs using JWT and implementing authentication and authorization.
Implementing Database Programming using MongoDB & Mongoose npm package.
Building & Deploying Angular App to cloud in Heroku.
Learning Tools & Software like: vs code, git, webpack, NodeJS, express, JWT, angular material.",영어,https://www.udemy.com/course/mastering-meanjs-fullstack-ultimate-course/
web-development,WooCommerce,E-commerce Website powered by WooCommerce and OceanWP,모든 수준,"17,000","₩23,000",7시간 주문형 동영상,"배울 내용
You will learn how to use the OceanWP WordPress Theme to help build a powerful E-commerce website
You will learn how to purchase a domain
You will learn how to host your website files
You will learn the WordPress Basics (pages, posts, menus, themes, plugins, settings)
You will learn the best WooCommerce product settings
You will learn how to create shipping options for your customers
You will learn how to create simple, variable & downloadable products
You will learn how to Integrate payment systems such as Stripe into your website
You will learn how to create discount coupons for your customers
You will learn how to Make all of your pages mobile responsive
더 보기",영어,https://www.udemy.com/course/oceanwp-ecommerce-course/
web-development,Web Hosting,"Beginners Guide To Domain Name, Web Hosting & WordPress.",초급자,"17,000","₩23,000",1.5시간 주문형 동영상,"배울 내용
What is domain names & web hosting?
Things keep in mind to choose good domain.
Various domain extension meanings.
SEO factor for domain ranking.
Best domain firms to buy domain.
What to look in web hosting?
Best web hosting firms to buy hosting.
How to setup domain & web hosting?
One click installer application like WordPress.
Pointing domain & web hosting.
Make professional website with few clicks",영어,https://www.udemy.com/course/beginners-guide-to-domain-name-web-hosting-wordpress/
web-development,WordPress,Build Dating & Marriage Website With WordPress Easily!,모든 수준,"17,000","₩23,000",2.5시간 주문형 동영상,"배울 내용
You will have a fantastic website that you can use to go on and build a Dating & Marriage business.
Be able to use different plugins & features to enhance your website
At the end of this course, you will have comprehensive basic knowledge of how to build a Dating & Marriage website from scratch using Wordpress & Woocommerce.
Plus, how to make blog for your matrimonial website is also included",영어,https://www.udemy.com/course/build-dating-marriage-website-with-wordpress-easily/
web-development,JavaScript,JavaScript Data Pagination Code JavaScript ES6 Project Code,초급자,"19,000","₩25,000",1시간 주문형 동영상,"배울 내용
How to apply JavaScript
How to get data and parse it to output on web pages
Creating elements on the fly with JavaScript",영어,https://www.udemy.com/course/javascript-pagination/
web-development,WordPress,How to build a website with WordPress - A Beginners Course,초급자,"26,000",,1.5시간 주문형 동영상,"배울 내용
Create and Build a Simple yet Professional Website with WordPress and Elementor without any previous experience.
Secure your domain name
Learn to select appropriate colors for a website
Utilize a number of Elementor widgets on your web page
Install and Utilise WordPress
Create multiple pages for your website
Create a blog page and sample post
No coding required, simply drag and drop features!",영어,https://www.udemy.com/course/how-to-build-a-website-with-wordpress-a-beginners-course/
web-development,React JS,"Build a portfolio with React, No external framework/library",초급자,"17,000","₩59,000",3시간 주문형 동영상,"배울 내용
D.R.Y code
Reusable components
Documenting code
CSS variables",영어,https://www.udemy.com/course/build-a-portfolio-with-react-no-external-frameworklibrary/
web-development,WebRTC,Webrtc by Projects,모든 수준,"17,000","₩23,000",2시간 주문형 동영상,"배울 내용
Understand the main components of Webrtc
Webrtc Signaling process
Understand the Ice mechanism
Create 2 Real Time Applications with WebRTC and Canvas",영어,https://www.udemy.com/course/webrtc-by-projects/
web-development,A/B Testing,Data Driven Development: A/B Testing for Product Engineers,중급자,"17,000","₩69,000",11시간 주문형 동영상,"배울 내용
What A/B tests are and how to use them
Build an A/B testing tool from scratch
Learn how to implement A/B tests on your website
How to find things to test on your site
Learn the math and statistics used in A/B testing
How to choose the right metric for your A/B test
A/B testing best practices
How to interpret the results of A/B tests
Gotchas and things to watch out for when A/B Testing",영어,https://www.udemy.com/course/data-driven-development-ab-testing-for-product-engineers/
web-development,WordPress,WordPress for Beginners 2016-Perfect for authors & bloggers,초급자,"19,000","₩25,000",7시간 주문형 동영상,"배울 내용
Understand the difference between wordPress.com and WordPress.org
Understand the basics of choosing a theme for a WordPress.org site
Know what Mobile Responsive is and how important it is
Know how to customize the dashboard as well as all other pages
Know how to manipulate all the basic settings of a WordPress site
Feel comfortable creating content - either posts or pages - including the inclusion of hyperlinks, images and videos
Understand the importance of Categories and Tags
Understand how the ideal post is formulated
Be comfortable manipulating images in the Media Library as well as creating users
Understand the addition and manipulation of a wide variety of plugins
더 보기",영어,https://www.udemy.com/course/wordpress-for-beginners-2016-perfect-for-authors-bloggers/
web-development,Laravel,"3 Portfolio Projects with Laravel + Blade, Vue JS, React JS",중급자,"17,000","₩23,000",8.5시간 주문형 동영상,"배울 내용
Create Full stack application with Laravel
Create portfolio project with Laravel, Blade and Alpine JS
Create Vuejs Portoflio project
Create React JS Portoflio project",영어,https://www.udemy.com/course/3-portfolio-projects-with-laravel-blade-vue-js-react-js-t/
web-development,Front End Web Development,2022 HTML+CSS Mastery,모든 수준,"17,000","₩23,000",3시간 주문형 동영상,"배울 내용
Become a confident and contemporary HTML and CSS Web developer without any prior experience!
developer abilities like utilising tools professionally, reading documentation, and debugging
Flexbox and CSS Grid, two features of modern CSS (prior CSS3), are used for layout.
a framework for web design that includes simple rules and recommendations for creating websites that stand out
How to employ standard elements and layout patterns for expert website building
How to organise a professional website's layout, design, construction, testing, and optimization
How to locate and utilise free design resources like pictures, fonts, and icons
How to employ standard elements and layout patterns for expert website building",영어,https://www.udemy.com/course/html-css-mastery/
web-development,Next.js,"ReactJS, NextJS & OpenAI: In Demand Project Development",모든 수준,"17,000","₩23,000",6.5시간 주문형 동영상,"배울 내용
Building Real-Time Group Chat App in NextJS 13
Open AI for Image, Tweet & ChatBot Generation
NextJS SEO & LightHouse Performance Optimization
Deploy NextJS/ReactJS App to Live
Setup CD/CI Pipeline on GitHub
Converting Template to NextJS Website
Fetch & Axios: To send HTTP Requests
+BONUS: JavaScript Refresher
+BONUS: Handling CSV Files in ReactJS",영어,https://www.udemy.com/course/mastering-nextjs-with-openai-build-modern-web-applications/
web-development,WordPress,How to Create a WordPress Menu Driven Site & blog,초급자,"19,000","₩25,000",1시간 주문형 동영상,"배울 내용
Create a WordPress Site with a Solid Menu System
Customize WordPress Menu
Create WordPress Blog Menu Items
Create External Links in WordPress Menu
Edit WordPress Footer File For Custom Links
Add a Lightbox (Fancybox) to WordPress Links for Privacy and Other Less essential Links
Add Basic Mobile Responsiveness to WordPress
Add Custom Mobile Responsiveness to WordPress to Allow Device Specific Content to Display
Add Custom Mobile Reponsiveness to WordPress to Make Content Show Depending On The Type of Device Viewing the Page (For example: Phone can show different content in a page or post than a computer will show, etc)
Create nesting WordPress menu",영어,https://www.udemy.com/course/wordpress-menu/
web-development,MERN Stack,The MERN Stack Blogify Project: Web Development [2023],초급자,"17,000","₩23,000",18시간 주문형 동영상,"배울 내용
User Authentication: Learn how to implement secure user registration and login processes using strategies like password hashing and JSON Web Tokens.
File Upload: Understand how to allow users to upload files like profile pictures or post attachments securely and efficiently.
User Relationships: Learn to implement social features such as following and unfollowing other users
User Blocking: Implement a blocking and unblocking system, allowing users to manage who can interact with them or see their content.
Post Scheduling: Gain knowledge on how to implement post scheduling, enabling users to create content that will be automatically published at a specified future
User Profile: Learn to create a user profile system where users can view and manage their personal information, posts, and social interactions.
더 보기",영어,https://www.udemy.com/course/mern-stack-blogify-project-based-course/
web-development,React JS,"React and Deno.js Authentication, Forgot and Reset Password",초급자,"17,000","₩35,000",2.5시간 주문형 동영상,"배울 내용
Generate Jwt Token
Use HttpOnly Cookies
Connect Deno with MySQL
Run Migrations with Cotton
Reset User Passwords
Send Emails",영어,https://www.udemy.com/course/react-deno-authentication/
web-development,Django,"DJANGO EASY COURSE, BUILD BLOG WEB APPLICATION with DEPLOY!",초급자,"19,000","₩25,000",9.5시간 주문형 동영상,"배울 내용
How to Setup Django
Setup Virtual Environments
Install & configure Django
How to create Django app
Django widgets and forms
Models, views & migration
Admin panel customization & Bootstrap integration
Pagination under Django
User Authentication
Django Templates
Filtering and Linting issues with flake8
Debugging basics in Django
Deployment on Heroku
Setting up AWS MySQL Database",영어,https://www.udemy.com/course/django-3/
web-development,Bootstrap,Complete Bootstrap with 5 Real time Projects - Live coding,모든 수준,"17,000","₩23,000",11시간 주문형 동영상,"배울 내용
You can create amazing frontend applications & UI with this Bootstrap course
You can also be able to develop all browser compatible websites with responsive in an easy manner using Bootstrap
This course will explain you Bootstrap from Scratch with 5 projects, which gives you a hands-on experience.
This course will help you a lot in your career , as its worlds the most popular frontend framework.",영어,https://www.udemy.com/course/complete-bootstrap-with-5-real-time-projects-live-coding/
web-development,Creative Coding (code art),Mastering Web Animation with Canvas [ JavaScript CSS HTML ],모든 수준,"17,000","₩39,000",3시간 주문형 동영상,"배울 내용
Basic Knowledge of the Canvas element
Techniques and methods of animation using canvas
Using mathematical formulas to build web animations
Introducing the Web Audio API and frequency data visualizing",영어,https://www.udemy.com/course/advenced-web-animation-with-canvas-javascript-css-html/
web-development,React JS,Fetch Api data with React,중급자,"19,000","₩25,000",1시간 주문형 동영상,"배울 내용
Learn how to fetch api data using React",영어,https://www.udemy.com/course/fetch-api-data-with-react/
