대분류,소분류,강의명,난이도,가격(현재가격),가격(원래가격),총소요시간,강의소개,언어,출처
data-science,Python,RA: Data Science and Supply Chain analytics. A-Z with Python,모든 수준,"19,000",69000,37시간 주문형 동영상,"배울 내용
A-Z Guide to Mastering Python for Data Science.
Work as A demand Planner.
Become a data driven supply chain manager.
Use linear Programming in python for logistics optimization and Production scheduling.
Set stock policies and safety stocks for all of your Business products.
Revenue management
Segment Customers, Products and suppliers to maximize service levels and reduce costs.
Learn simulations to make informed supply chain decisions.
Become a supply chain data scientist.
Learn Supply chain techniques you will only find in this course. Guaranteed!",영어,https://www.udemy.com/course/ra-data-science-and-supply-chain-analytics-a-z-with-python/
data-science,Data Analysis,Data Analysis Real world use-cases- Hands on Python,모든 수준,"20,000",69000,7시간 주문형 동영상,"배울 내용
Get a job as a data Analyst on an average $156,000 after showcase these Projects on your Resume
By the end of this course you will understand the inner workings of the data analytics pipeline -joining,manipulating,filtering, extracting data ,Analysing Data
Solve any problem in your business, job or in real-time with powerful data analysis libraries
you will expertise in Pandas , Numpy , Seaborn, Matplotlib , Plotly ,Folium, Geopy , Wordcloud , re and many other..
Learn how to work with various data within python, including: Excel Data,Geographical data,Text Data and Time Series Data Data
Solve any problem in your business, job or in real-time with powerful data analysis libraries",영어,https://www.udemy.com/course/data-analysis-real-world-use-cases-hands-on-python/
data-science,Linear Algebra,Linear Algebra for Data Science & Machine Learning A-Z 2023,모든 수준,"17,000",79000,18시간 주문형 동영상,"배울 내용
Fundamentals of Linear Algebra and how to ace your Linear Algebra exam
Basics of matrices (notation, dimensions, types, addressing the entries etc.)
Operations on a single matrix, e.g. scalar multiplication, transpose, determinant & adjoint
Operations on two matrices, including addition, subtraction and multiplication of matrices
Performing elementary row operations and finding Echelon Forms (REF & RREF)
Inverses, including invertible and singular matrices, and the Cofactor method
Solving systems of linear equations using matrices and inverse matrices, including Cramer’s rule to solve AX = B
Properties of determinants, and how to perform Gauss-Jordan elimination
더 보기",영어,https://www.udemy.com/course/linear-algebra-for-beginners-matrices-and-vector-spaces/
data-science,Computer Vision,Computer Vision Masterclass,모든 수준,"20,000",79000,25.5시간 주문형 동영상,"배울 내용
Understand the basic intuition about Cascade and HOG classifiers to detect faces
Implement face detection using OpenCV and Dlib library
Learn how to detect other objects using OpenCV, such as cars, clocks, eyes, and full body of people
Compare the results of three face detectors: Haarcascade, HOG (Histogram of Oriented Gradients) and CNN (Convolutional Neural Networks)
Detect faces using images and the webcam
Understand the basic intuition about LBPH algorithm to recognize faces
Implement face recognition using OpenCV and Dlib library
Recognize faces using images and the webcam
더 보기",영어,https://www.udemy.com/course/computer-vision-masterclass/
data-science,Data Science,Math for Data Science Masterclass,모든 수준,"17,000",79000,16시간 주문형 동영상,"배울 내용
Understand core concepts about data quality and quantity
Learn about how to measure data with statistics
Discover how to visualize data with a variety of plot types
Use combinatorics to calculate permutations and combinations of objects
Understand the key ideas in using probability to solve problems
Learn how to use data distributions with real world data
Discover the powerful insights from the normal distribution
Use sampling and the central limit theorem
Understand hypothesis testing on sample groups
Cover the basics of linear regression",영어,https://www.udemy.com/course/math-for-data-science-masterclass/
data-science,Databricks,Azure Databricks and Spark SQL (Python),모든 수준,"17,000",69000,12.5시간 주문형 동영상,"배울 내용
Azure Databricks
Data Lakehouse
Delta Lake
Spark SQL
PySpark
Big Data
Real World Scenarios
CI/CD on Databricks
Source Control with Databricks Repos",영어,https://www.udemy.com/course/azure-databricks-and-spark-sql-python/
data-science,Apache Spark,Apache Spark Streaming 3 with Scala | Rock the JVM,모든 수준,"17,000",49000,7시간 주문형 동영상,"배울 내용
Process data as it arrives
Handle data of any scale in real time
Use Structured Streaming and SQL on streaming data
Use low-level, high-control APIs with DStreams
Integrate Spark with Kafka, JDBC, Cassandra
Master advanced concepts including window functions and watermarking",영어,https://www.udemy.com/course/spark-streaming/
data-science,Data Science,Data Science Foundations,모든 수준,"19,000",25000,3시간 주문형 동영상,"배울 내용
Programming with R, Python, and SQL
Understand roles and careers in data science
Sourcing data
Data science in math and statistics
Data science and machine learning",영어,https://www.udemy.com/course/learn-data-science/
data-science,Machine Learning,Machine Learning with Imbalanced Data,중급자,"19,000",79000,11.5시간 주문형 동영상,"배울 내용
Apply random under-sampling to remove observations from majority classes
Perform under-sampling by removing observations that are hard to classify
Carry out under-sampling by retaining observations at the boundary of class separation
Apply random over-sampling to augment the minority class
Create syntethic data to increase the examples of the minority class
Implement SMOTE and its variants to synthetically generate data
Use ensemble methods with sampling techniques to improve model performance
Change the miss-classification cost optimized by the models to accomodate minority classes
Determine model performance with the most suitable metrics for imbalanced datasets",영어,https://www.udemy.com/course/machine-learning-with-imbalanced-data/
data-science,Python,Crash course: Data analytics in Python using Pandas,초급자,"19,000",25000,1시간 주문형 동영상,"배울 내용
Perform data analysis with the Pandas library
Learn about dataframes and how to conduct data analysis in Python
Understand how to handle missing values in your data
Understand how to handle & clean up messy data",영어,https://www.udemy.com/course/python-analytics/
data-science,Amazon Sagemaker,2023 Become AWS SageMaker ML Engineer in 30 Days + ChatGPT,초급자,"17,000",69000,43시간 주문형 동영상,"배울 내용
Build, Train, Test and Deploy Machine Learning Models in AWS
Leverage ChatGPT and GPT-4 to Automate Coding Tasks, Perform Code Debugging, Write Documentation and Add New Features to your Code
Define and Perform Image and Text Labeling Jobs Using AWS SageMaker GroundTruth
Prepare, Clean and Visualize data Using AWS SageMaker Data Wrangler without Writing any Code
Optimize ML model hyperparameters using GridSearch, Bayesian & Random Search Optimization Techniques
Master Key AWS services such as Simple Storage Service (S3), Elastic Compute Cloud (EC2), Identity and Access Management (IAM) and CloudWatch
더 보기",영어,https://www.udemy.com/course/become-an-aws-machine-learning-engineer-in-30-days-new-2022/
data-science,Machine Learning,Machine Learning No-Code Approach: Using Azure ML Studio,초급자,"19,000",25000,2.5시간 주문형 동영상,"배울 내용
Examine the foundations of Supervised Machine Learning
Use Azure ML Studio to create Predictive Models without code
Evaluate different algorithms to find the one that works best
Deploy models live to be used with new data
Build a real estate model to predict house prices
Experiment with the traditional Titanic Dataset to predict survival chances",영어,https://www.udemy.com/course/machine-learning-no-code-approach-using-azure-ml-studio/
data-science,Machine Learning,Beginner Machine Learning in Python + ChatGPT Bonus [2023],초급자,"17,000",69000,3.5시간 주문형 동영상,"배울 내용
Machine Learning
The Machine Learning Process
Regression
Ordinary Least Squares
Simple Linear Regression
Splitting your data into a Training set and a Test set
Multiple Linear Regression
R-Squared
Adjusted R-Squared
Classification
Maximum Likelihood
Feature Scaling
Confusion Matrix
Accuracy
Clustering
K-Means Clustering
더 보기",영어,https://www.udemy.com/course/machine-learning-python-level-1/
data-science,Talend Data Integration,Talend + SQL + Datawarehousing - Beginner to Professional,모든 수준,"149,000",,13시간 주문형 동영상,"배울 내용
Learn Basic concepts of ETL
Learn Talend Open Studio for Data Integration with scenarios to implement.
Learn Basic concepts of Datawareshousing
Learn Basic concepts of SQL",영어,https://www.udemy.com/course/talendsql/
data-science,Amazon AWS,"Data Lake, Firehose, Glue, Athena, S3 and AWS SDK for .NET",모든 수준,"19,000",25000,2시간 주문형 동영상,"배울 내용
How to build a Data Lake using Firehose API for .NET, S3, AWS Glue and Athena",영어,https://www.udemy.com/course/data-lake-firehose-glue-athena-s3-and-aws-sdk-for-net/
data-science,Data Science,Data Science Masterclass With R 8 Case Studies + 4 Projects,모든 수준,"17,000",23000,29.5시간 주문형 동영상,"배울 내용
Learn what is Data Science and how it is helping the modern world!
What are the benefits of Data Science and Machine Learning
Able to Solve Data Science Related Problem with the Help of R Programming
Why R is a Must Have for Data Science , AI and Machine Learning!
Right Guidance of the Path if You want to be a Data Scientist + Data science Interview Preparation Guide
How to switch career in Data Science?
R Data Structure - Matrix, Array, Data Frame, Factor, List
Work with R’s conditional statements, functions, and loops
Systematically Explore data in R
Data Science Package: Dplyr , GGPlot 2
더 보기",영어,https://www.udemy.com/course/data-science-complete-course/
data-science,Machine Learning,The Complete Python Course for Machine Learning Engineers,초급자,"19,000",25000,3시간 주문형 동영상,"배울 내용
You'll learn everything you need to know about Python for authoring basic machine learning models.
You'll work through hands on labs that will test the skills you learned in the lessons.
You'll learn all the Python vernacular you need to take you skills to the next level.
You'll build a basic Deep Neural Network in Python line by line.
You'll use Scikit-Learn to Build a Traditional Machine Learning Model
You'll understand why Python has become the Gold Standard in the Machine Learning Space.",영어,https://www.udemy.com/course/the-complete-python-course-for-machine-learning-engineers/
data-science,Data Science,Machine Learning for Absolute Beginners - Level 2,초급자,"19,000",25000,4시간 주문형 동영상,"배울 내용
Python for Data Science and Machine Learning Projects
Learn to use the Pandas Data Science Library
JupyterLab Development tool
Develop Jupyter Notebooks
Loading and Analysing Tabular Datasets
Selecting, Filtering, and Cleaning Data
Grouping, Sorting, and Exporting Data",영어,https://www.udemy.com/course/machine-learning-for-absolute-beginners-level-2/
data-science,Artificial Intelligence,ZERO to GOD Python 3.8 FULL STACK MASTERCLASS 45 AI projects,모든 수준,"19,000",25000,30시간 주문형 동영상,"배울 내용
Students will be able to create websites, build applications, create Artificial Intelligent learning programs that can recognize handwriting and learn while analyzing data.
Will help you get a job as a Fullstack programmer or Artificial Intelligence data scientist.
Build over 10 AI data analysis tools",영어,https://www.udemy.com/course/zero-to-pro-python-3-fullstack-data-bootcamp-45-ai-projects/
data-science,Machine Learning,Support Vector Machines in Python: SVM Concepts & Code,모든 수준,"19,000",59000,6시간 주문형 동영상,"배울 내용
Get a solid understanding of Support Vector Machines (SVM)
Understand the business scenarios where Support Vector Machines (SVM) is applicable
Tune a machine learning model's hyperparameters and evaluate its performance.
Use Support Vector Machines (SVM) to make predictions
Implementation of SVM models in Python",영어,https://www.udemy.com/course/machine-learning-adv-support-vector-machines-svm-python/
data-science,Computer Vision,Computer Vision: Python OCR & Object Detection Quick Starter,모든 수준,"17,000",49000,4.5시간 주문형 동영상,"배울 내용
Optical Character Recognition with Tesseract Library, Image Recognition using Keras, Object Recognition using MobileNet SSD, Mask R-CNN, YOLO, Tiny YOLO
optical Character Recognition
Image Recognition
Object Recognition",영어,https://www.udemy.com/course/computer-vision-python-ocr-object-detection-quick-starter/
data-science,Sentiment Analysis,Applied Text Mining and Sentiment Analysis with Python,모든 수준,"17,000",39000,2.5시간 주문형 동영상,"배울 내용
How to use common Text Mining and NLP techniques
How to use Regex to clean up Tweets
How to use NLTK to pre-process text
How to use Scikit-Learn to build a Sentiment Analysis prediction model
How to predict the sentiment of any tweet",영어,https://www.udemy.com/course/applied-text-mining-and-sentiment-analysis-with-python/
data-science,dbt (Data Build Tool),The Data Bootcamp: Transform your Data using dbt™,초급자,"17,000",49000,4시간 주문형 동영상,"배울 내용
Learn how to use dbt end-to-end through a realistic project, hands-on project
Learn the fundamentals of dbt including connecting to a data warehouse, developing models, working with sources, creating tests, deploying and much more
Understand how dbt is beneficial in a modern data stack and how the Extract, Load and Transform process works
Learn how to use Macros and Packages in dbt to simplify and reuse your code
Learn how dbt can work with complex SQL queries
Perform Testing in dbt such as singular tests, generic tests and source testing
Develop documentation for your models, understand modularity and dependancies in dbt
Learn about the dbt Project Structure and how to set up your own project
더 보기",영어,https://www.udemy.com/course/the-dbt-bootcamp-transform-your-data-using-data-build-tool/
data-science,Deep Learning,Tensorflow and Keras For Neural Networks and Deep Learning,모든 수준,"20,000",26000,8시간 주문형 동영상,"배울 내용
Harness The Power Of Anaconda/iPython For Practical Data Science
Learn How To Install & Use Tensorflow Within Anaconda
Implement Statistical & Machine Learning With Tensorflow
Implement Neural Network Modelling With Tensorflow & Keras
Implement Deep Learning Based Unsupervised Learning With Tensorflow and Keras
Implement Deep Learning Based Supervised Learning With Tensorflow & Keras
Implement Convolution Neural Networks With Tensorflow & Keras",영어,https://www.udemy.com/course/tensorflow-and-keras-for-neural-networks-and-deep-learning/
data-science,Apache Spark,Apache Spark In-Depth (Spark with Scala),모든 수준,"19,000",25000,40.5시간 주문형 동영상,"배울 내용
Apache Spark from scratch to in-depth, starting from simple word count program to Batch Processing to Spark Structure Streaming, Performance Tuning, Optimization, Application Development and Deployment.
Completing this course will also make you ready for most interview questions
Includes Optional Project and path to success",영어,https://www.udemy.com/course/apache-spark-in-depth-spark-with-scala/
data-science,Spatial Analysis,Spatial Analysis & Geospatial Data Science in Python,모든 수준,"19,000",48000,4시간 주문형 동영상,"배울 내용
The course introduces you to the most essential Geopython Libraries
Perform Spatial Data analysis with Python
Learn the essentials of Geopy,Plotly Library, the workhorse of Geospatial data science in Python.
Learn how to visualize Geospatial data in Python (static and interactive maps)
Learn how to pre-process geospatial data.
Perform Geocoding on Data",영어,https://www.udemy.com/course/spatial-data-science-in-python/
data-science,R (programming language),R Programming for Simulation and Monte Carlo Methods,모든 수준,"17,000",59000,11.5시간 주문형 동영상,"배울 내용
Use R software to program probabilistic simulations, often called Monte Carlo simulations.
Use R software to program mathematical simulations and to create novel mathematical simulation functions.
Use existing R functions and understand how to write their own R functions to perform simulated inference estimates, including likelihoods and confidence intervals, and to model other cases of stochastic simulation.
Be able to generate different different families (and moments) of both discrete and continuous random variables.
Be able to simulate parameter estimation, Monte-Carlo Integration of both continuous and discrete functions, and variance reduction techniques.",영어,https://www.udemy.com/course/r-programming-for-simulation-and-monte-carlo-methods/
data-science,Linear Algebra,Linear Algebra and Feature Selection in Python,초급자,"17,000",23000,3시간 주문형 동영상,"배울 내용
Understand the math behind machine learning models
Become familiar with basic and advanced linear algebra notions
Be able to solve linear equations
Determine independency of a set of vectors
Calculate eigenvalues and eigenvectors
Perform Linear Discriminant Analysis
Perform Dimensionality Reduction in Python
Carry out Principal Components Analysis
Compare the performance of PCA and LDA for classification with SVMs",영어,https://www.udemy.com/course/linear-algebra-and-feature-selection-in-python/
data-science,Reinforcement Learning,Modern Reinforcement Learning: Actor-Critic Algorithms,전문가,"48,000",59000,8.5시간 주문형 동영상,"배울 내용
How to code policy gradient methods in PyTorch
How to code Deep Deterministic Policy Gradients (DDPG) in PyTorch
How to code Twin Delayed Deep Deterministic Policy Gradients (TD3) in PyTorch
How to code actor critic algorithms in PyTorch
How to implement cutting edge artificial intelligence research papers in Python",영어,https://www.udemy.com/course/actor-critic-methods-from-paper-to-code-with-pytorch/
data-science,R (programming language),Data Mining with R: Go from Beginner to Advanced!,모든 수준,"20,000",25000,12시간 주문형 동영상,"배울 내용
Use R software for data import and export, data exploration and visualization, and for data analysis tasks, including performing a comprehensive set of data mining operations.
Effectively use a number of popular, contemporary data mining methods and techniques in demand by industry including: (1) Decision, classification and regression trees (CART); (2) Random forests; (3) Linear and logistic regression; and (4) Various cluster analysis techniques.
Apply the dozens of included ""hands-on"" cases and examples using real data and R scripts to new and unique data analysis and data mining problems.",영어,https://www.udemy.com/course/data-mining-with-r-go-from-beginner-to-advanced/
data-science,Derivatives Trading,Statistical Arbitrage Bot Build in Crypto with Python (A-Z),초급자,"17,000",79000,14.5시간 주문형 동영상,"배울 내용
Gain hands-on experience in developing a Statistical Arbitrage pairs trading crypto bot
Automate and filter searches for all possible co-integrated pairs on a given exchange
Learn what actually moves price in the markets
Understand the use of metrics including hedge ratio, p-value, t-value and c-value
Learn fundamental trading principles and gain a proven statistical edge
Learn the optimal position size
Get clarity on entry and exit signals
Develop an automated bot that can place and manage limit and market orders automatically
Learn backtesting techniques for optimal pair selection
Learn how to calculate spread and Zscore for optimal entry and exit signals",영어,https://www.udemy.com/course/statistical-arbitrage-bot-build-in-crypto-with-python-a-z/
data-science,Databricks,Mastering Databricks & Apache spark -Build ETL data pipeline,모든 수준,"20,000",25000,4.5시간 주문형 동영상,"배울 내용
Databricks
Build your first data pipeline to process CSV, JSON, XML
Orchestrate data pipeline on Azure data factory
Spin up spark cluster
Delta tables
Concept of time travel and vacuum on delta tables
Apache Spark SQL
Filtering Dataframe
Renaming, drop, Select, Cast
Aggregation operations SUM, AVERAGE, MAX, MIN
Rank, Row Number, Dense Rank
Building dashboards
더 보기",영어,https://www.udemy.com/course/mastering-databricks-apache-spark-build-etl-data-pipeline/
data-science,Data Analysis,Advanced Data Analytics using Python [2022],전문가,"19,000",69000,18시간 주문형 동영상,"배울 내용
Learn about python variables and data types.
Learn about loops and conditionals in python.
Learn about the different data structures of python.
Learn about the creation of functions in python.
Learn about object oriented programming using python.
Learn about searching, sorting and time complexity in python.
Learn about Regular expressions and date time objects in Python.
Learn about the Numpy and the Pandas library.
Learn exploring data using Dabl and Sweetviz library.
Learn probability concepts such as Conditional probability, bayes theorem.
더 보기",영어,https://www.udemy.com/course/data-analytics-python/
data-science,Natural Language Processing,Introduction to Natural Language Processing,초급자,"19,000",23000,37분 주문형 동영상,"배울 내용
Learn Basics of Natural Language Processing (NLP)
Learn to use Regular Expressions to extract patterns from text
Perform Text pre-processing
Perform Text classification
Reading and working with text data using Python",영어,https://www.udemy.com/course/introduction-to-natural-language-processing/
data-science,Natural Language Processing,Data Science:Data Mining & Natural Language Processing in R,모든 수준,"19,000",25000,13.5시간 주문형 동영상,"배울 내용
Perform the most important pre-processing tasks needed prior to machine learning in R
Carry out data visualization in R
Use machine learning for unsupervised classification in R
Carry out supervised learning by building classification and regression models in R
Evaluate the accuracy of supervised machine learning algorithms and compare their performance in R
Carry out sentiment analysis using text data in R",영어,https://www.udemy.com/course/data-science-datamining-natural-language-processing-in-r/
data-science,Machine Learning,Complete Machine Learning 2023 A-Z™: 10 Real World Projects,모든 수준,"20,000",25000,37.5시간 주문형 동영상,"배울 내용
Python
Machine Learning
Statistics and Math
Data Science
Natural Language Processing
Data Analysis
Data Visualization",영어,https://www.udemy.com/course/complete-machine-learning-2021-with-10-real-world-projects/
data-science,Financial Analysis,Financial Analysis: Build a ChatGPT Pairs Trading Bot,초급자,"17,000",23000,7시간 주문형 동영상,"배울 내용
Use ChatGPT to build a pairs trading bot in Python
Common mistakes when using ChatGPT for coding
Pairs trading, algorithmic trading, algotrading, stock trading strategies
Computing z-scores, returns and log returns, cumulative returns, portfolio returns
Apply data science to financial analysis
Trading strategies for stocks, forex, cryptocurrencies, Bitcoin, Ethereum, altcoins",영어,https://www.udemy.com/course/chatgpt-pairs-trading/
data-science,Data Analysis,Learn Machine Learning & Data Mining with Python,모든 수준,"20,000",25000,8.5시간 주문형 동영상,"배울 내용
Learn everything about Data Mining and its applications
Understand Machine Learning and its connection with Data Mining
Learn all Machine Learning algorithms, their types, and their usage in business
Learn how to implement Machine Learning algorithms in different business scenarios
Learn how to install and use Python programming language to create machine learning algorithms in a simple way
Learn how to import your data sets into Python and make required cleaning before creating the algorithms
Learn how to interpret the results of each algorithms and compare them with each other to choose the optimum one
Learn how to create graphs in Pythons, such as scattered and regression graphs and use them in your analyses
Learn data analysis in PySpark",영어,https://www.udemy.com/course/implement-machine-learning-in-data-mining-using-python/
data-science,SQL,SQL for Tech and Data Science Interviews,모든 수준,"20,000",26000,2.5시간 주문형 동영상,"배울 내용
Build a winning strategy for the tech/data science interview
How to focus on mock interviews
A guided walkthrough to a set of interview questions
Work on your communication skills and interview style
Tina’s 5-step framework to acing your SQL interview
Know what SQL interviewers want to hear from you
Anticipate follow-up questions
Be able to demonstrate how you think and reason
Reduce interview stress by doing the 10 mock interviews provided in the course",영어,https://www.udemy.com/course/sql-for-tech-and-data-science-interviews/
