대분류,소분류,강의명,난이도,가격(현재가격),가격(원래가격),총소요시간,강의소개,언어,출처
no-code-development,Chatbot,Building & Designing Interactive Chatbot with No Code,모든 수준,"17,000",23000.0,3.5시간 주문형 동영상,"배울 내용
Learning the basic fundamentals of AI chatbot, getting to know technologies behind it as well as understanding its capabilities and limitations
Learning the full process of how AI chatbot works from getting input from user to composing output after analysing user’s request
Learning how to design effective conversation flow and interactive user interaction
Full step by step tutorial on how to build and design AI chatbot using Poe
Full step by step tutorial on how to build and design chatbot using Confer Bot
Full step by step tutorial on how to build and design chatbot using Collect Chat
Chatbot testing objectives: functionality testing, performance testing, user experience testing, and integration testing
Learning strategies to potentially monetise your chatbot, such as selling chatbot templates or offering service to build and design custom chatbot",영어,https://www.udemy.com/course/building-designing-interactive-chatbot-with-no-code/
no-code-development,WordPress,Complete Wordpress Website - Fast & Easy - Start To Finish,모든 수준,"17,000",23000.0,17.5시간 주문형 동영상,"배울 내용
Build complete, flexible, professional Wordpress websites Start to Finish with no coding experience required.
Using Beaver Builder, the most stable and trusted page builders available to speed up site development and minimise your learning curve.
The website you build will include brochure style pages, blog style pages, a shop and a dynamic custom post type section.
You will learn a repeatable process of how to build a complete website from scratch without using pre-built templates.",영어,https://www.udemy.com/course/complete-wordpress-website-fast-easy-start-to-finish/
no-code-development,WordPress,WordPress Mastery: Learn How to Build & Monetize Websites,모든 수준,"25,000",,12시간 주문형 동영상,"배울 내용
Introduction to WordPress and its features
How to install and log into the WordPress dashboard
Understanding and setting up general site settings
Creating pages and posts, and formatting text
Adding media such as images, audio, and video to the WordPress media library
Understanding and using WordPress widgets and menus
Installing and customizing WordPress themes
Installing and updating WordPress plugins
Building and customizing eCommerce, business, and blog websites
Optimizing website performance with WordPress SEO (Search Engine Optimization)
더 보기",영어,https://www.udemy.com/course/wordpress-mastery-learn-how-to-build-websites-and-monetize-your-skill/
no-code-development,WordPress,WordPress For Beginners - Create A Website Step By Step,초급자,"17,000",23000.0,4.5시간 주문형 동영상,"배울 내용
Master WordPress in a few hours.
Have a website up and running in about an hour if you follow all the steps.
Create a landing page with free tools and learn how to get leads and higher conversions with your website.
Learn how to capture emails with your website to build an audience which can lead to more sales.
Use WordPress Landing Pages To Convert affiliate Leads into Sales (Affiliate Marketing)",영어,https://www.udemy.com/course/wordpress-for-beginners-create-a-website-steps-by-step/
no-code-development,WordPress,Create Personal Brand Niche Website without coding,모든 수준,"19,000",25000.0,1시간 주문형 동영상,"배울 내용
Building a Personal Brand Niche Website using WordPress and Elementor Using all FREE Resources
You Will Learn to Use WordPress and Elementor to Make Your Personal Brand Website Without Coding
Increase your Followers by Getting FREE traffic Using Blogging",영어,https://www.udemy.com/course/create-personal-brand-niche-website-without-coding/
no-code-development,Wix,Wix Web Designing and Development Beginner to Pro,모든 수준,"17,000",23000.0,1시간 주문형 동영상,"배울 내용
Creating a website from scratch using Wix drag-and-drop website builder.
Understanding the different types of websites that can be created with Wix(e.g. online store, blog, portfolio, etc.).
Learning how to customize the design of a Wix website using templates, themes, and other design tools.
Adding and editing content on a Wix website, including text, images, videos, and other media.
Creating a mobile-friendly version of a Wix website that looks and functions well on smartphones and tablets.
Configuring the settings and options of a Wix website, including SEO settings, site analytics, and payment processing.",영어,https://www.udemy.com/course/wix-web-designing-and-development-beginner-to-pro-q/
no-code-development,WordPress,"Beginners Guide to WordPress, Elementor & WooCommerce",초급자,"17,000",23000.0,4시간 주문형 동영상,"배울 내용
WordPress, Elementor, WooCommerce Concepts
What is domain name & web hosting?
How to setup domain & web hosting?
One click installer WordPress.
Pointing domain & web hosting.
What is subdomain & setup?
What is SSL & FREE setup?
How to setup & use elementor?
Designing website with elementor.
How to make website easily with NO coding?
How to use & setup professional emails?
WooCommerce settings setup.
Product creation with WooCommerce.",영어,https://www.udemy.com/course/beginners-guide-to-wordpress-elementor-woocommerce/
no-code-development,Rapid Application Development,My First Glide App,초급자,"17,000",23000.0,2시간 주문형 동영상,"배울 내용
In the course, I will teach you all the knowledge needed to build basic applications in Glide.
We will learn what basic settings are needed to build a task and subtask management application.
Working with Glide tables and functions created by Glide.
Understand how to create complex actions using one click.
We will develop the skills required in building applications without code.",영어,https://www.udemy.com/course/my-first-glide-app/
no-code-development,WordPress,Create Personal Branding & Blogging Website without coding,모든 수준,"19,000",25000.0,2시간 주문형 동영상,"배울 내용
Building a Personal Branding Website using wordpress and Elementor
How to add blogging functionality in website
Create a professional website to represent your personal brand
Master Wordpress & Elementor Page Builder
Learn how to create a completely unique and custom wordpress website
Learn how to showcase your work, events, product & service
How to put your image gallery in website
How to add your videos in website
How to showcase your social channel feed in website
Make beautiful about and contact us page
How to write perfect blog article
더 보기",영어,https://www.udemy.com/course/create-personal-branding-blogging-website-without-coding/
no-code-development,Project Management,PMP Mock exam (PMBOK7) 100% pass in Real exam :,모든 수준,"17,000",23000.0,,,영어,https://www.udemy.com/course/pmp-mock-exam-questions-and-detailed-explanations/
no-code-development,WordPress,Wordpress Development For Beginners - Learn From Scratch,초급자,"17,000",23000.0,5시간 주문형 동영상,"배울 내용
What is Wordpress and its Fundamentals
How to Install wordpress in computer and on web hosting
How to create a business website
How to create a shopping website using woocommerce in wordpress",영어,https://www.udemy.com/course/wordpress-development-for-beginners-learn-from-scratch/
no-code-development,Landing Page Optimization,"High Converting Landing Page With WordPress, CRM & Marketing",초급자,"17,000",23000.0,2시간 주문형 동영상,"배울 내용
Create High Converting Landing Page With WordPress
Integrate CRM and Manage Your Leads in the Best Way
Copywriting Tips & Tricks
Promote Your Landing Page with Google Ads",영어,https://www.udemy.com/course/high-converting-landing-page-with-wordpress-crm-marketing/
no-code-development,Web Design,Build websites without code using Carrd,초급자,"17,000",23000.0,2시간 주문형 동영상,"배울 내용
Build a Website without Code
Build simple website at $49/year
Learn Landing Page Basics
Complete and launch your Landing Page
Build Free Website without Code",영어,https://www.udemy.com/course/carrd-tutorials/
no-code-development,E-Commerce,Build FREE Ecommerce Website with WordPress & WooCommerce,모든 수준,"17,000",23000.0,2.5시간 주문형 동영상,"배울 내용
At the end of this course, you will have comprehensive basic knowledge of how to build an ecommerce Wesbite from scratch using Wordpress & Woocommerce.
You can sell both digital & physical products
Be able to use different plugins to enhance your website
How to write perfect blog to get visitors to website
You will learn how to Integrate payment systems including PayPal & Stripe into your website
On page & off-Page SEO for blogging",영어,https://www.udemy.com/course/build-free-ecommerce-website-with-wordpress-woocommerce/
no-code-development,Coding For Kids,Build Artificial Intelligence Projects for kids,초급자,"17,000",23000.0,3시간 주문형 동영상,"배울 내용
1- Getting familiar with the basics of electronics -Building a project using the Pictoblox software
2- Learning about the latest AI technology and its uses
3- How to build interactive AI projects -Problem solving and creative and logical thinking skills
4- To equip children with a strong skill set and knowledge base that can serve them well in future academic and professional endeavors.",영어,https://www.udemy.com/course/artificial-intelligence-eq/
no-code-development,Documentation,"NO-code Documentation (wiki, guide) website [Docusaurus]",초급자,"23,000",,37분 주문형 동영상,"배울 내용
Create a FREE blog & documentation (wiki & white paper) website
Understand the basics of Git, Github and Markdown
Manage content using markdown syntax and how to live preview all the changes
Use Github, CodeSandbox and Vercel for a no-code website management process",영어,https://www.udemy.com/course/i-o-docusaurus/
no-code-development,WordPress,WordPress Crash Course for Beginners - DIY Business Website,초급자,"17,000",23000.0,4시간 주문형 동영상,"배울 내용
WordPress
WordPress Business Website
WordPress Fundamentals
WordPress Porto Theme (Premium Theme)",영어,https://www.udemy.com/course/wordpress-crash-course-for-beginners-diy/
no-code-development,Online Business,Build Ecommerce Website For online Business with Wordpress,모든 수준,"17,000",23000.0,2.5시간 주문형 동영상,"배울 내용
You will have a fantastic store that you can use to go on and build an ecommerce business.
You will have the skills required to become a freelance Wordpress developer.
You can sell both digital & physical products
Be able to use different plugins to enhance your website
At the end of this course, you will have comprehensive basic knowledge of how to build an ecommerce store from scratch using Wordpress & Woocommerce.",영어,https://www.udemy.com/course/build-ecommerce-website-for-online-business-with-wordpress/
no-code-development,WordPress,WP The Easy Way With Elementor,초급자,"17,000",23000.0,6.5시간 주문형 동영상,"배울 내용
How to build WordPress websites, the easy way, without using any code
How to use, and master, Elementor
How to build WordPress websites the same way WordPress agencies do
How to make any website look professional and well designed",영어,https://www.udemy.com/course/wp-the-easy-way/
no-code-development,WordPress,With WordPress Build Dating & Marriage Website Easily!,모든 수준,"17,000",23000.0,2.5시간 주문형 동영상,"배울 내용
You will have a fantastic website that you can use to go on and build a Dating & Marriage business.
At the end of this course, you will have comprehensive basic knowledge of how to build a Dating & Marriage website from scratch using Wordpress & Woocommerce.
Be able to use different plugins & features to enhance your website
Plus, how to make blog for your matrimonial website is also included to get traffic to website",영어,https://www.udemy.com/course/with-wordpress-build-dating-marriage-website-easily/
no-code-development,WordPress,Build Stunning Website for Fitness Business with WordPress,모든 수준,"17,000",23000.0,4.5시간 주문형 동영상,"배울 내용
Step by step building gym, yoga, fitness WordPress website
Choosing the right WordPress theme for your fitness business
Introduction to WordPress and setting it up web hosting & domain names
Adding pages and content to your website
Customizing your WordPress theme to match your branding
Optimizing your website for search engines
Creating a blog to engage your visitors
Integrating social media into your website
Adding functionality to your website with WordPress plugins
Securing your website and protecting it from hackers
Creating an online store to sell your products or services
Designing complete website to make it 100% responsive on all devices
더 보기",영어,https://www.udemy.com/course/build-stunning-website-for-fitness-business-with-wordpress/
no-code-development,WordPress for Ecommerce,Create Ecommerce Website Flatsome Theme + WordPress Part 1/2,초급자,"17,000",23000.0,44분 주문형 동영상,"배울 내용
You will learn to create your online store from scratch and sell physical or digital products.
You will learn to create different types of products like physical digital, or affiliate products.
You will learn how to use the Flatsome theme (the #1 premium woo commerce theme)
You will learn to create different pages for your website and set up blog
You will learn to set up a payment system on your website
You will learn how to manage your own ecommerce website using WordPress and WooCommerce",영어,https://www.udemy.com/course/create-ecommerce-website-flatsome-theme-wordpress-part-12/
no-code-development,DevOps,Learn Terraform and prepare for Job Interview,모든 수준,"17,000",23000.0,3시간 주문형 동영상,"배울 내용
Terraform Introduction
Terraform Create your First Resource
Terraform Generate Secrets
Terraform Strings
Terraform EC2 Create Instance
Terraform Variables
Terraform RDS create
Terraform advance skills
Terraform Hands-On Project Step By Step
Interview Preparation",영어,https://www.udemy.com/course/learn-terraform-and-prepare-for-job-interview/
no-code-development,WooCommerce,Build Upwork Like Freelancing Website With WordPress,모든 수준,"17,000",23000.0,2.5시간 주문형 동영상,"배울 내용
You will have a fantastic website that you can use to go on and build an microjob business.
Be able to use different plugins to enhance your website
You can sell both freelancing services & buy freelancer services
Plus, how to make blog for your Freelancing website is also included
At the end of this course, you will have comprehensive basic knowledge of how to build an microjobs website from scratch using Wordpress & Woocommerce.",영어,https://www.udemy.com/course/build-upwork-like-freelancing-website-with-wordpress/
no-code-development,WordPress,Build 3 Types of WordPress Websites in this 1 Course Only,모든 수준,"17,000",23000.0,10시간 주문형 동영상,"배울 내용
I will Teach to setup WordPress with Web Hosting & Domain Names
I will teach how to make Online Course website with WordPress
I will teach how to make money blogging website with WordPress
I will teach how to make eCommerce website with WordPress",영어,https://www.udemy.com/course/build-3-types-of-wordpress-websites-in-this-1-course-only/
no-code-development,WordPress,Earn 6 Figure passive income Online Business using WordPress,모든 수준,"17,000",23000.0,4.5시간 주문형 동영상,"배울 내용
Designing a Wordpress/ Elementor professional drop service website without coding.
Making a professional email and Making an Email Template
Targetting bloggers to get clients on a daily basis.
Hiring freelancers on advance and learn to earn using them.
Adding payment method to your website to receive direct payment.
Create affiliate system to get free traffic for your niche drop service website
Passive income drop service business from the comfort of your home.
Learn the magic of compounding in your business to get even more Succes in long term & Scale your business to earn even more.
Learn to make logo and edit images for your niche on photoshop/canva.",영어,https://www.udemy.com/course/earn-6-figure-passive-income-online-business-using-wordpress/
no-code-development,WordPress,Learn to Install WordPress on Domain Name & Web Hosting,모든 수준,"17,000",23000.0,1.5시간 주문형 동영상,"배울 내용
What exactly is a Domain Name & Setup
What is website hosting? & Setup
How domain names and web hosting work in relation to each other.
How to change the name servers of a domain to point to a particular web host
Best domain firms to buy a domain.
Making the site secure by installing SSL
Creating an email account to send & receive emails.
Power to Sub Domain for creating Unlimited WordPress Website
One-click installer applications like WordPress
and many more :)",영어,https://www.udemy.com/course/learn-to-install-wordpress-on-domain-name-web-hosting/
no-code-development,Web Development,How to Build A SEO Optimized Website,초급자,"17,000",23000.0,3시간 주문형 동영상,"배울 내용
Learn how to build a creative website from scratch
How Artists, Authors and Musicians can optimize SEO
How to create and upload products
Have your site reflect your personality
How to build your website correctly
How to name your business and doman
How to gain ORGANIC traffic",영어,https://www.udemy.com/course/website-building-made-simple/
no-code-development,Cloud Computing,Ultimate AWS Certification Course by Shiva,모든 수준,"17,000",23000.0,48시간 주문형 동영상,"배울 내용
This course can be applied to multiple Specializations or Professional Certificates programs. Completing this course will count towards your learning
Describe terminology and concepts related to AWS services
Articulate key concepts of AWS security measures and AWS Identity and Access Management (IAM)
Understand AWS database and storage offerings, including Amazon Relational Database Service (Amazon RDS), Amazon DynamoDB, and Amazon S3.
You will learn to distinguish among several AWS compute services, including Amazon EC2, AWS Lambda, and Amazon ECS.",영어,https://www.udemy.com/course/ultimate-aws-certification-course-by-shiva/
no-code-development,Wix,How to build a high performing website from scratch,초급자,"17,000",23000.0,1.5시간 주문형 동영상,"배울 내용
18 must haves for a great website
How to build a DIY website
How to outsource the creation of your website
How to purchase your domain name
How to choose the right hosting provider for you
3 tools for ongoing website management and analysis
How to get maximum exposure to your website",영어,https://www.udemy.com/course/how-to-build-a-high-performing-website-from-scratch/
no-code-development,Bubble Visual Programming,Database design in Bubble,모든 수준,"17,000",23000.0,1시간 주문형 동영상,"배울 내용
Understand the fundamentals of databases and how they work
Understand how databases work within Bubble
Be able to design performant databases and apps in Bubble
Understand linking data and when to use option sets
Know the benefits and costs of using external databases",영어,https://www.udemy.com/course/database-design-in-bubble/
no-code-development,WordPress,Build Stunning WordPress Website For Free 2023,모든 수준,"17,000",23000.0,5시간 주문형 동영상,"배울 내용
Learn to design a stunning WordPress website for Free
Understanding the basics of web design, including typography, color theory, and layout principles
Building beautiful home pages that capture visitors' attention
Creating custom headers and footers that reflect your brand
Adding custom widgets and plugins to extend Elementor's capabilities
Designing blog pages that showcase your content
Optimizing your website for speed and performance
And much more!",영어,https://www.udemy.com/course/build-stunning-wordpress-website-for-free-2023/
no-code-development,Web App Development,Learn How To Build a Web Application Without Coding,초급자,무료,,,,영어,https://www.udemy.com/course/learn-how-to-build-a-web-application-without-coding/
no-code-development,Wix,WIX Tutorial For Beginners - Make A Wix Website Today!,초급자,무료,,,,영어,https://www.udemy.com/course/wix-website-tutorial-for-beginners/
no-code-development,Bubble Visual Programming,Beginner's Guide: Use Bubble to Build an App Without Coding,초급자,무료,,,,영어,https://www.udemy.com/course/beginners-guide-use-bubble-to-build-an-app-without-coding/
no-code-development,WordPress,Build a Pro Website in 30 minutes with WordPress & Wix,초급자,무료,,,,영어,https://www.udemy.com/course/build-a-pro-website-in-30-minutes/
no-code-development,Wix,Velo by Wix Part 2: User Inputs and Data Basics,초급자,무료,,,,영어,https://www.udemy.com/course/corvid-for-wix-part-2-user-inputs-and-data-basics/
no-code-development,Excel Macros,Excel Automation using Uipath,초급자,무료,,,,영어,https://www.udemy.com/course/excel-automation-using-uipath/
no-code-development,Wix,Velo by Wix Part 3: Dynamic Pages and Repeater Basics,초급자,무료,,,,영어,https://www.udemy.com/course/corvid-for-wix-part-3-dynamic-pages-and-repeater-basics/
no-code-development,Wix,WIX Website Tutorial for Complete Beginners: Zero To Expert,초급자,무료,,,,영어,https://www.udemy.com/course/2020-wix-website/
no-code-development,Programming Fundamentals,Citizen Developers of Low-Code / No-Code,초급자,무료,,,,영어,https://www.udemy.com/course/citizen-developers-of-low-code-no-code/
no-code-development,Web Design,How to Create a Website With Zyro Website Builder,초급자,무료,,,,영어,https://www.udemy.com/course/how-to-create-a-website-using-zyro-website-builder/
no-code-development,Data Engineering,Lean Data Practices for Startups and Entrepreneurs,모든 수준,무료,,,,영어,https://www.udemy.com/course/lean-data-practices/
no-code-development,WordPress,WordPress for Beginners: Build Your Business Website Quickly,초급자,무료,,,,영어,https://www.udemy.com/course/wordpress-for-beginners-build-your-business-website-quickly/
no-code-development,Chatbot,Instagram Chatbots 2023. Complete guide on creating chatbot,초급자,무료,,,,영어,https://www.udemy.com/course/instagram-chatbots-complete-guide-on-creating-chatbot/
no-code-development,Blue Prism,Blue Prism - Working with PDF,모든 수준,무료,,,,영어,https://www.udemy.com/course/blue-prism-working-with-pdf/
no-code-development,Salesforce,The Salesforce Validation Rules Crash Course,초급자,무료,,,,영어,https://www.udemy.com/course/the-salesforce-validation-rules-crash-course/
no-code-development,App Development,ZeroCode -Beginner's Guide to App Development,초급자,무료,,,,영어,https://www.udemy.com/course/zerocode-beginners-guide-to-app-development/
no-code-development,WordPress,How to Create A Digital Agency Website with Elementor,초급자,무료,,,,영어,https://www.udemy.com/course/how-to-create-a-digital-agency-website-with-elementor/
no-code-development,WordPress for Ecommerce,Create an Ecommerce Website with WordPress + Flatsome Part2,모든 수준,무료,,,,영어,https://www.udemy.com/course/create-an-ecommerce-website-with-wordpress-flatsome-part2/
no-code-development,E-Commerce,Create Ecommerce Website Flatsome Theme + WordPress Part 2/2,초급자,무료,,,,영어,https://www.udemy.com/course/create-ecommerce-website-flatsome-theme-wordpress-part-22/
no-code-development,Reputation Management,Learning Your Google Count via Online Reputation Management,모든 수준,무료,,,,영어,https://www.udemy.com/course/learning-your-google-count-via-online-reputation-management/
no-code-development,WordPress,Website Build-Along: Beaver Jams,초급자,무료,,,,영어,https://www.udemy.com/course/website-build-along-beaver-jams/
no-code-development,Pega Certification,Pega Portal - The Complete Pega Developer Course - Demo,모든 수준,무료,,,,영어,https://www.udemy.com/course/pega-portal-the-complete-pega-developer-course-demo/
