대분류,소분류,강의명,난이도,가격(현재가격),가격(원래가격),총소요시간,강의소개,언어,출처
web-development,React JS,The Complete Web Development Bootcamp,모든 수준,"17,000","₩69,000",30.5시간 주문형 동영상,"배울 내용
How to create full stack web application with frontend, backend and database parts and build and run all of the services using Docker with auto reload features
How to build Single Page Applications using React and use different React Components, state, props and React hooks such as useState and useEffect
Connect frontend application written in React with backend application written in Python by making REST API requests using axios package in the React app
Understand what is API and how it works, which API methods exists and how to correctly design API endpoints for various resources
Use Python Flask for building backend API service and create different endpoints with corresponding view function, utilize internal and external Python modules
Master full stack web development workflow by using JavaScript, Python, Docker, React, NPM, MongoDB, Postman, Git, GitHub and other tools",영어,https://www.udemy.com/course/full-stack-web-development-bootcamp/
web-development,Laravel,Let's Learn Laravel: A Guided Path For Beginners,초급자,"17,000","₩79,000",14.5시간 주문형 동영상,"배울 내용
The PHP language itself
How to setup your personal computer for Laravel practice
How to keep your code organized (we actually take the time to understand the MVC pattern)
How to deploy your app up to the web (both local Docker practice, and a real public Linux VPS)",영어,https://www.udemy.com/course/lets-learn-laravel-a-guided-path-for-beginners/
web-development,Django,Top Python and Django Web Development Bundle!,초급자,"17,000","₩23,000",11.5시간 주문형 동영상,"배울 내용
How To Program Python From Beginner To Advanced
How To Build Simple Websites With Django
How To Build Database Driven Sites With Django
How To Build Their Own API With Django
Download and Install Python
Download and Install Django
Basic CSS with Bootstrap
How To Access Third Party API's With Django
How To Use The Django Rest Framework
How to Use Templates With Django",영어,https://www.udemy.com/course/top-python-and-django-web-development-bundle/
web-development,Web Development,Web Development Concepts for Everyone,모든 수준,"17,000","₩23,000",5시간 주문형 동영상,"배울 내용
Confidence in Understanding the Technologies that Create and Power the Web
Understanding of Websites and Web Applications
Understanding of Front-End and Back-End Development
Understanding of Databases - Including SQL, NoSQL, and In-Memory
Understanding of Programming Languages and what makes them Different
Understanding of the Cloud and Cloud Services Providers
Understand of Version Control Systems like Git",영어,https://www.udemy.com/course/web-development-concepts-for-everyone/
web-development,Object Oriented Programming,Complete PHP OOP Concepts for Absolute Beginners + Projects,중급자,"59,000","₩79,000",10.5시간 주문형 동영상,"배울 내용
Learn PHP Object Oriented Programming Concepts.
How to Apply OOP Concept in your Project.
Implement OOP Concepts like Inheritance, Polymorphism, Data Encapsulation, Data Abstraction and Overriding.
Learn How to Write Modular Code and Reusable Code using OOP Concepts.
Learn to Write Classes, Interface, Abstract Classes and Traits.
Learn PHP OOP with Examples, Exercises, Assignments and Quiz.
Understand Concepts like Magic Methods, Type Hinting, Namespaces and Dependency Injection.
Learn to use final, static, public, private and protected keywords.
더 보기",영어,https://www.udemy.com/course/complete-php-oop-tutorials-for-absolute-beginners-projects/
web-development,JavaScript,JavaScript for Absolute Beginners,초급자,"19,000","₩25,000",2시간 주문형 동영상,"배울 내용
Learn the basics of JavaScript programming",영어,https://www.udemy.com/course/javascript-for-absolute-beginners/
web-development,JavaScript,Javascript Intermediate level 2 - All about functions,중급자,"19,000","₩25,000",3시간 주문형 동영상,"배울 내용
At the end of this course students will able to MASTER JavaScript Functions
At the end of this course students will able to write more complex JavaScript code
At the end of this course students will able create more flexible JavaScript applications",영어,https://www.udemy.com/course/javascript-intermediate-mastering-functions/
web-development,JavaScript,JavaScript for Beginning Web Developers,초급자,"19,000","₩25,000",4.5시간 주문형 동영상,"배울 내용
Start programming with JavaScript
Create real life projects with JavaScript",영어,https://www.udemy.com/course/learn-javascript-programming/
web-development,WebXR,"Learn to create WebXR, VR and AR, experiences using Three.JS",중급자,"48,000","₩59,000",5시간 주문형 동영상,"배울 내용
How to easily create VR and AR apps that work in the browser
How to use the ThreeJS library to create these apps
How to handle controllers
How to replace the controllers with custom models
How to create architectural walk-throughs, games and training apps.
How to add an in world UI
Developing AR apps that support real world hit testing
Learn game VR techniques such as teleporting and interacting with models in the scene using controllers.",영어,https://www.udemy.com/course/learn-webxr/
web-development,ASP.NET Core,Building RESTful Web APIs with ASP.NET Core 3.1,모든 수준,"20,000","₩25,000",11.5시간 주문형 동영상,"배울 내용
Build Web APIs with .NET Core
Deploy Web APIs to Azure and IIS
Use Azure DevOps for Continuous Integration and Continuous Delivery (CI/CD)
Develop RESTful Web APIs",영어,https://www.udemy.com/course/building-restful-web-apis-with-aspnet-core/
web-development,JavaScript,JavaScript for Beginners - Learn with 6 main projects!,초급자,"20,000","₩25,000",8시간 주문형 동영상,"배울 내용
How to read, write and understand JavaScript
How to confidently work in JavaScript
How to use conditional statements in JavaScript
How to write loops in JavaScript
Have a strong understanding of JavaScript fundamentals
Learn core programming fundamentals that can be used in other coding languages
How to write functions in JavaScript
How to write object oriented code (OOP) in JavaScript
How the strange quirks like hoisting and closures work in JavaScript
How to write and understand data types and data structures in JavaScript
더 보기",영어,https://www.udemy.com/course/learn-javascript-for-beginners-course/
web-development,Web Development,How to create Websites Build 10 Websites From Scratch,초급자,"19,000","₩25,000",32.5시간 주문형 동영상,"배울 내용
create several different types of websites
understand what HTML CSS and JavaScript can do
Be able to make webpages dynamic
Create modern websites from scratch
make interactive web content
design and develop a website",영어,https://www.udemy.com/course/ultimate-web-developer-course-build-10-websites-from-scratch/
web-development,JSON,Javascript Intermediate level 3 - JSON,모든 수준,"19,000","₩25,000",2.5시간 주문형 동영상,"배울 내용
Learn to use JSON with Javascript
At the end of this course students will be able to take their existing javascript skill to an intermediate level
Build clean Javascript applications",영어,https://www.udemy.com/course/javascript-intermediate-json-course/
web-development,AWS CloudFormation,AWS CloudFormation Step By Step: Beginner to Intermediate,초급자,"59,000","₩79,000",6시간 주문형 동영상,"배울 내용
Start as a beginner to AWS CloudFormation, learn its Associate-level features and use them for your daily AWS provisioning needs.
Learn to manage your AWS infrastructure as code using AWS CloudFormation and YAML.
Learn to write your own AWS CloudFormation templates in YAML and define your AWS resources in them.
Learn to use AWS CloudFormation reference to define different types of AWS resources in your templates.
Enrich your templates with parameters, mappings, conditions, metadata, and outputs.
Learn theory and practice from a Professional-level certified AWS expert according to AWS best practices.
Learn to use change sets to update your AWS CloudFormation stacks safely.
Learn to use CloudFormation commands of AWS CLI.",영어,https://www.udemy.com/course/aws-cloudformation-step-by-step-beginner-to-intermediate/
web-development,ASP.NET Core,Create ASP.Net Core Web API (step by step for beginners),모든 수준,"20,000","₩25,000",10시간 주문형 동영상,"배울 내용
Creation of CRUD API in Asp .Net Core
.Net Core Services
Data Transfer Objects (DTO)
Use of DbContext for 1-to-many and many-to-many relationship
Understanding of Dependency Injection
Understanding of the use of Interfaces in C# and .Net Core",영어,https://www.udemy.com/course/creating-net-core-api/
web-development,ASP.NET Core,Complete Guide to Web API in .NET 8: Master API Development,모든 수준,"19,000","₩69,000",23시간 주문형 동영상,"배울 내용
Master ASPNET Core Web API (from zero to hero)
Create a Blazor WebAssembly App to consume the Web API
Using Identity Server 4 in-depth
Proper Web Development Architecture and Best Practices
What is Web API
RESTful API Design
ASPNET Core Platform Basics
Web API Routing, Model Binding, Model Validation, Filter Pipeline
Web API versioning, OpenAPI / Swagger documentation
Entity Framework Core Basics
Create a bug tracker Web API
Testing Web API with PowerShell and Postman
더 보기",영어,https://www.udemy.com/course/complete-web-api-course/
web-development,HTML,"HTML, CSS and JavaScript Complete course",모든 수준,"19,000","₩25,000",10시간 주문형 동영상,"배울 내용
Develop your own website
Design beautiful website using html and css
Bag strong basic fundamental knowledge from html to html5
Have a good knowledge on CSS3
Complete knowledge starting from the basics in html and css to advanced topics in html5 and css3",영어,https://www.udemy.com/course/learn-complete-html5-and-css3-from-scratch/
web-development,Azure Machine Learning,Azure Machine Learning using Cognitive Services,모든 수준,"20,000","₩25,000",16.5시간 주문형 동영상,"배울 내용
By the end of the course you'll be able to add powerful Machine Learning functionality to your apps with simple REST requests!
You will know how Microsoft Cognitive Services provide advance Machine Learning functionality to any kind of app.
You will be able to create amazing apps (or improve those you’ve already created) by adding superior functionalities and superpowers such as language understanding for executing user-requests, verification of users through speech, face detection, identify people in images, and so much more!
You can bring into play Machine Learning models to simplify business processes when moderating content.
You’ll be able to create better experiences for your users by adding more interfaces and functionalities such as bots.",영어,https://www.udemy.com/course/azure-machine-learning-using-cognitive-services/
web-development,Jekyll,"Jekyll: make fast, secure static sites and blogs with Jekyll",초급자,"17,000","₩39,000",2시간 주문형 동영상,"배울 내용
Create a website or a blog with Jekyll
Create layouts
Use Liquid templating language
Deploy the page to Github
Use custom data from external files",영어,https://www.udemy.com/course/static-website-generator-fast-secure-sites-blogs-with-jekyll/
web-development,WordPress Themes,Complete WordPress Theme Developer Course With Bootstrap,모든 수준,"20,000","₩25,000",26.5시간 주문형 동영상,"배울 내용
How to sell your themes to other webmasters
Develop a complete theme from scratch using concepts presented in this course
Know how to set up the exact development environment perfect for theme development.
Learn how to identify their theme to the WordPress system
Build important theme features including the header, footer and sidebar
Add important information to blog posts including permalinks, author information and publish date
Develop custom templates which include multi-column templates with sidebars and full page templates
Create a search form and search results page
더 보기",영어,https://www.udemy.com/course/the-complete-wordpress-theme-developer-course/
web-development,JavaScript,Javascript ES6! A Complete Reference Guide to Javascript ES6,중급자,"19,000","₩25,000",6.5시간 주문형 동영상,"배울 내용
You will get an in depth understanding of all the new changes (and the most effective ones) in ES6 for your Javascript Development
You will get ready to more advanced javascript languages like React, Angular, meteor or Vue.
You will be able to write better, faster and efficient code with ES6 syntax in Javascript
You will be able to understand the important changes/introduction that happened to Strings
You will be able to use the newly Introduced Template Literals
You will be having a better understanding the scope and block bindings, using let and const v/s var
You will be able to understand and implement the upgrades that functions have gone through - including default parameters, rest parameters, spread parameters, block level functions and of course the most talked about arrow functions.
You will be able to understand the changes/upgrades that have happened to Objects, the new methods added and see how Prototypes have been given more power.
더 보기",영어,https://www.udemy.com/course/javascript-es6-a-complete-reference-guide-to-javascript-es6/
web-development,Python,Python Mega Course: Learn Python Programming,초급자,"19,000","₩59,000",33.5시간 주문형 동영상,"배울 내용
Learn Python from the ground up.
Learn how to setup a python development environment.
Learn how to create GUI applications
Create a functional todo app and deploy to cloud
Create a functional portfolio app
Create a basic calculator
Create a digital clock
Create a times table generator
Create a weight conversion tool
Create a number guessing game
Create a random number generator
Create a vowel stripping program
Create a countdown timer
Create a lottery number simulator
더 보기",영어,https://www.udemy.com/course/learn-python-from-scratch-create-your-own-apps/
web-development,DevOps,Mastering DevOps,중급자,"20,000","₩25,000",6시간 주문형 동영상,"배울 내용
Apply systems thinking and feedback loops to build great architectures like Google and Netflix
Maximize the throughput of your organization by the CAMS model.
To examine what cultural elements create a high performing IT organization.
Master agile infrastructure with configuration management.
Learn delivery of high quality with speed with Continuous delivery.
Learn how monitoring can help you outpace the competition.
Learn how breaking down silos helps everyone to go faster.
Tying it all together, how to spread the DevOps paradigm beyond just Dev and Ops.",영어,https://www.udemy.com/course/mastering-devops/
web-development,React JS,Building Applications with React 17 and ASP.NET Core 6,중급자,"17,000","₩69,000",19.5시간 주문형 동영상,"배울 내용
Make a Web API with .NET Core
Develop React web applications
Use React Hooks for building functional components
Use Entity Framework Core for building a SQL Server database",영어,https://www.udemy.com/course/building-applications-with-react-and-aspnet-core/
web-development,Coding Interview,JavaScript Interview Questions - Coding Interview 2023,모든 수준,"17,000","₩23,000",3.5시간 주문형 동영상,"배울 내용
Be very well prepared for any javascript programming interviews you will have
Excel in a wide variety of javascript interview questions that you could be asked in an interview
Strengthen you javascript programming skills and your knowledge of important javascript concepts
Learn the skills, concepts, and techniques necessary to excel in javascript coding interviews
Learn what programming interviews are like and what kind of questions to expect
Feel very confident going into any javascript programming interviews you will have",영어,https://www.udemy.com/course/javascript-interview-questions-coding-interview/
web-development,CSS,Create Websites with HTML & CSS for Beginners,초급자,"19,000","₩25,000",8.5시간 주문형 동영상,"배울 내용
You will learn HTML and CSS from Scratch with Examples and Exercises.
After this course, You will be able to build Websites with HTML and CSS on your own.
This course will teach you to build Websites like Tutorials Site, Blogging Site, Personal Website, Product Landing, Survey and Coming Soon.
Understand how to build Website Layouts like Header, Footer, Content, Side Bars with HTML and CSS.
Get access to our Premium HTML and CSS Documentation site for your future reference.
Start your career as a Web Developer by learning to build websites.
You will get notes, source code, references and assignments for your learning purpose!
Course Materials, Fully Documented Site, Community Support and more!",영어,https://www.udemy.com/course/create-websites-with-html-css-for-beginners/
web-development,WebXR,Introduction to Web AR development,초급자,"17,000","₩59,000",5시간 주문형 동영상,"배울 내용
Gain hands-on experiences on building different types of Web AR applications including Image Effects, Face Effects and World Effects
Acquire basic understandings on how AR works in web browsers
Master using WebXR, mind-ar-js and threejs for building web AR applications
Learn integrating AR with machine learning models using tensorflowjs to build highly interactive experiences
Get to know other important web AR libraries, including AFRAME, model-viewer and commercial SDKs
Learn using effective debugging, simulating and mocking tools to speed up development
Develop a comprehensive understanding on all web AR technologies, now and near future, and know when to use what
Build and publish an online AR portfolio for yourself",영어,https://www.udemy.com/course/introduction-to-web-ar-development/
web-development,ASP.NET,ASP.NET MVC Interview Questions with Answers,모든 수준,"19,000","₩25,000",2시간 주문형 동영상,"배울 내용
Answering questions on MVC architecture, Dependency injection , Middleware , Razor views , Strongly typed views, Kestrel , wwwroot , appsettings json
How to explain interviewer differences Webforms vs MVC vs MVC core,ConfigureServices vs Configure, Transient vs Singleton vs Scope DI.
Handling tricky questions on Session management like Session , ViewData , ViewBag & Tempdata with differences between them.
Tackling tricky questions on WebAPI and REST. Explaining the difference between WebAPI vs MVC , Differences between WCF vs WebAPI and Content negotiation",영어,https://www.udemy.com/course/aspnet-mvc-interview-questions/
web-development,Front End Web Development,*UPDATED* DOM 2023 Build Dynamic Websites JavaScript Part 2,중급자,"17,000","₩79,000",9.5시간 주문형 동영상,"배울 내용
Master front end web development
Master the Document Object Model
*Download lectures (for offline viewing)
Learn how your website can come alive with actions, like zitsy changes on click, color wheels, drop-downs, response on form submissions and much more
Listen for different events (like click events, input events, focus events, and more!!!)
Practical - build awesome dynamic front-end applications with me
I am here to support you, step-by-step
What is a DOM event and why its so important to understand
Become a pro at listening for events that are fired
What a callback function is
더 보기",영어,https://www.udemy.com/course/build-dynamic-websites-dom-2/
web-development,HTML,HTML Web Development Crash Course,초급자,"20,000","₩25,000",1.5시간 주문형 동영상,"배울 내용
Create websites
Use web features
Over 15 lectures
Use the console to debug their website
Create cross platform websites",영어,https://www.udemy.com/course/html-tutorials/
web-development,Web Hosting,How To Create A Web Hosting Business - WHMCS Tutorial,초급자,"19,000","₩25,000",3.5시간 주문형 동영상,"배울 내용
Learn How To Setup Reseller Hosting
How To Setup WHMCS With Wordpress
How To Start Their Own Web Hosting Business Or Company",영어,https://www.udemy.com/course/how-to-create-a-web-hosting-business-whmcs-tutorial/
web-development,CSS,The Ultimate HTML5 Elements & CSS3 Properties BOOTCAMP,모든 수준,"17,000","₩59,000",38.5시간 주문형 동영상,"배울 내용
Understanding How the Web Works
Taking a Deep Look at the Building Blocks of the Web
Understanding What HTML and CSS are and Why and Where They are Used
Understanding the Web Development Process
Chapters Outlining Different Skill Levels for HTML and CSS Best Suited to Each and Every Student
Learning Latest Versions of HTML (HTML5) and CSS (CSS3)
Learning Practical HTML Elements and CSS Properties
Understanding The HTML Syntax
Learning Modern HTML Tags and How to Write Them
HTML5 Semantic Tags and Their Meaning + Practicality
더 보기",영어,https://www.udemy.com/course/the-most-up-tp-date-html5-css3-level-1-essentials-with-100-challenges/
web-development,Tailwind CSS,Tailwind CSS : A Modern Way To Build Websites Using CSS,모든 수준,"17,000","₩49,000",6.5시간 주문형 동영상,"배울 내용
Learn A Modern Way To Style Websites & Never Go Back To Using Regular CSS
Learn & Understand How To Use Tailwind Utility Classes To Style Elements
Build Full Responsive Websites Using Breakpoints
Learn To Build A Real Estate Website
Learn To Build Interactive Dashboards With Components Like Charts
Learn How To Use Tailwind Classes To Create Components",영어,https://www.udemy.com/course/tailwind-css-course/
web-development,Redux Framework,The Ultimate Redux Course 2023 - [LATEST Redux-toolkit],초급자,"17,000","₩59,000",3.5시간 주문형 동영상,"배울 내용
Modern way to write Redux code using Redux-toolkit
Calling API using best methods
Mistakes to avoid while writing redux code
Write clean code like a pro
Debug application using Redux devTools
Best folder structure for maintaining Redux code
Use popular middlewares & create your own
Connect React & Redux using react-redux",영어,https://www.udemy.com/course/the-ultimate-redux-course-state-management-library/
web-development,NestJS,NestJs in Practice (with MongoDB),모든 수준,"17,000","₩59,000",4.5시간 주문형 동영상,"배울 내용
Code in Github repository with downloadable ZIP files per section
NestJs Deep Dive - Modules, Controllers, Services, Pipes, Middleware, Guards, etc.
NestJs Design Patterns - Controllers and Repositories
Complete NestJs / MongoDB CRUD example
Mongoose ODM (Object to Document Mapping) library
Introduction to MongoDB
Decorator-based Data Validation
Authentication in NestJs with JSON Web Tokens (JWT)
NestJs RBAC Authorization (Role-Based Access Control)",영어,https://www.udemy.com/course/nestjs-course/
web-development,Web Development,web development for beginners,초급자,"19,000","₩25,000",6.5시간 주문형 동영상,"배울 내용
Web development front-end from the start",영어,https://www.udemy.com/course/web-development-for-beginners/
web-development,CSS,Crash Course: Fundamentals Of HTML & CSS From Scratch.,초급자,"20,000","₩25,000",2시간 주문형 동영상,"배울 내용
You'll learn the fundamentals of HTML & CSS and have created a webpage from scratch.",영어,https://www.udemy.com/course/beginner-crash-course-fundamentals-of-html-css-in-60-mins/
web-development,MongoDB,Projects in MongoDB - Learn MongoDB Building Projects,모든 수준,"20,000","₩25,000",12시간 주문형 동영상,"배울 내용
Build Web Solutions using MongoDB
Learn to harness full power of document oriented schema
Use server side javascript with mongoDB
Learn best practices for NoSQL development",영어,https://www.udemy.com/course/projects-in-mongodb/
web-development,HTML,Web Development Fundamentals: HTML5 and CSS3 for Beginners,초급자,"19,000","₩25,000",5.5시간 주문형 동영상,"배울 내용
Basics of CSS
Basics of HTML
Common HTML5 elements
Box Model of CSS3
Flexbox
Building Layouts with CSS3
Difference between Inline, Internal and External CSS",영어,https://www.udemy.com/course/html5-and-css3-for-absolute-beginners/
web-development,Amazon Lightsail,Hosting Websites with Amazon Lightsail | AWS for 2020,모든 수준,"19,000","₩25,000",7시간 주문형 동영상,"배울 내용
Utilize the Bitnami LAMP Stack and the Bitnami WordPress Stack
Install, configure, and use the Plesk Hosting Stack for website and email hosting
Install ""Let's Encrypt"" SSL/TLS certificates on Lightsail using Certbot for automation
Sign up for Amazon AWS and Lightsail
Create an Amazon Lightsail Instance and set a Static IP
Connect to a Lightsail Instance via SSH and SFTP
Host multiple websites or web applications on one Amazon Lightsail Instance
Operate one or more WordPress powered sites on a single Lightsail Instance",영어,https://www.udemy.com/course/hosting-websites-with-amazon-lightsail/
web-development,CSS,CSS - MASTERING ANIMATIONS,초급자,"19,000","₩25,000",2시간 주문형 동영상,"배울 내용
Animating colors, shadows.. moving things around & rotating them ...etc
Controlling 100% your animation and even before and after the animation execution.
Create awesome Menus, checkboxs, Spinners, step by step forms",영어,https://www.udemy.com/course/css-mastering-animations/
