대분류,소분류,강의명,난이도,가격(현재가격),가격(원래가격),총소요시간,강의소개,언어,출처
no-code-development,WordPress,WordPress for Beginners 2023 - No Code WordPress Masterclass,모든 수준,"17,000",23000.0,10시간 주문형 동영상,"배울 내용
Design a complete WordPress website from start to finish with total confidence
Understand SEO concepts and apply them to your own site to attract more site visitors
Define WordPress terminology to help you hold your own in any WordPress discussion
Practice WordPress by installing on your own computer for free, or on any third-party host
Answer 5 important planning questions to define who you're designing for and how you want your website to look
Master WordPress's ""Gutenberg Block Editor"" to insert new design elements anywhere, without coding
Create a feature-rich website by assembling WordPress Plugins that work for YOU
Get familiar with WordPress's layout and work areas to improve your productivity
Create new ""Pages"" and ""Blog Posts,"" and understand the importance of content creation for SEO
Develop your own styles and push site-wide changes through full site editing with the ""Site Editor""
더 보기",영어,https://www.udemy.com/course/wordpress-for-non-coders/
no-code-development,WordPress,WordPress for Beginners: Complete Master Course (Sinhala),모든 수준,"17,000",59000.0,11.5시간 주문형 동영상,"배울 내용
Install Wordpress on your PC or Mac computer, so you can learn without having to pay hosting or domain fees.
Anyone may learn how to use Wordpress to create a useful, attractive, and responsive website by taking this course.
Navigate around the Wordpress dashboard, know what everything does and how to use it.
Recognize the core components of Wordpress
How to create pages and posts properly and understand the difference between the pages and posts.
How to Create personalized menus and navigational systems that are helpful to both visitors and search engines.
Use post categories and tags appropriately, and be aware of how doing so might harm your search engine rankings.
learn how to set up Wordpress for the greatest outcomes.
더 보기",영어,https://www.udemy.com/course/wordpress-for-beginners-complete-master-course-sinhala/
no-code-development,Chatbot,How to Build Chatbot with Google DialogFlow,초급자,"17,000",39000.0,7시간 주문형 동영상,"배울 내용
The students will learn how to build professional chatbots
The students will learn that how to integrate chatbot with Facebook Messenger
The students will learn that how to integrate chatbot with WhatsApp and Twilio
The students will learn that how to integrate chatbot with Twitter
The students will learn that how to integrate chatbot with Slack
The students will learn that how to integrate chatbot with ReactJS, VueJs and Wix websites
The students will learn that how to create Backend REST API with Python for Chatbots
The students will learn that how to integrate Chatbot with Firebase Real Time Database
The students will learn how to create Crypto Currency Price Tracker Chatbot
The student will learn that how to create Human Handoff functionality",영어,https://www.udemy.com/course/how-to-build-chatbot-with-google-dialogflow/
no-code-development,Bubble Visual Programming,Build web applications without writing any code with bubble,초급자,"19,000",25000.0,3시간 주문형 동영상,"배울 내용
Build a Photo Sharing Web App from scratch
Build a Todo list App from scratch
Build a user registration and signup system from scratch
Create database and database fields
Create workflow events and actions
Install and use pluggins in your apps
Create multi pages for your applications
Design applications using bubble application editor
Display data using repeating groups
Nest elements inside popups
Using floating groups
Nest elements inside groups
Implement security using privacy rules
Test application in development and live environment
더 보기",영어,https://www.udemy.com/course/build-web-applications-without-writing-any-code-with-bubble/
no-code-development,WordPress,WordPress Masterclass 2023 - Build 10 WordPress Websites,초급자,"17,000",23000.0,38.5시간 주문형 동영상,"배울 내용
Master WordPress: Dive into the world's most popular content management system and unleash its power.
Woocommerce Essentials: Learn to create e-commerce websites using the leading platform in the industry.
Advanced Woocommerce: Enhance your online store with features like Pdf Invoicing and cryptocurrency payments.
Design with Ease: Utilize Elementor, a powerful page builder, to craft visually captivating websites.
Free & Pro Elementor: Explore both versions and leverage advanced features for professional-grade designs.
Hands-On Experience: Work on 10 diverse projects, gaining real-world skills in e-commerce, business, and more.",영어,https://www.udemy.com/course/wordpress-crash-course-for-absolute-beginners/
no-code-development,Web Development,1 Hour Website - Build a Website in 1 Hour,모든 수준,"17,000",23000.0,1시간 주문형 동영상,"배울 내용
How to create a Responsive 1 Page Website in 1 Hour
Methods to design a unique logo and create effective branding for your company
A fast, simple way to create persuasive messaging to attract sales
The basics of using no-code tools such as Carrd
The skills needed to create a website from start to finish
A simple way to save money on expensive web developers and designers
Where to find useful free tools that help you create websites quicker",영어,https://www.udemy.com/course/one-hour-website/
no-code-development,Bubble Visual Programming,Building A LinkedIn Clone With No-Code Using Bubble,모든 수준,"17,000",49000.0,4.5시간 주문형 동영상,"배울 내용
How to build your own professional social network like LinkedIn without writing a single line of code
An overview of Bubble's no-code toolset
How to set up your own custom database
How to register new user accounts
How to create a settings page for users to update their profile information
How to create user-generated posts
How to build a home page feed
How to like & comment on posts
How to display user profile pages
How to send & accept connection requests
How to create company profiles
How to display company profile pages
더 보기",영어,https://www.udemy.com/course/building-a-linkedin-clone-with-no-code-using-bubble/
no-code-development,Salesforce Development,Salesforce Validation Rules - Beginner to Advanced,모든 수준,"19,000",25000.0,3시간 주문형 동영상,"배울 내용
Salesforce Validation Rules
How to make salesforce field mandatory
Criteria based validation rules
Salesforce Validation Functions
Salesforce Validations scenarios and assignments",영어,https://www.udemy.com/course/salesforce-validation-rules/
no-code-development,UiPath Certified RPA Associate (UiRPA),Getting Started With UiPath Robotic Process Automation (RPA),모든 수준,"17,000",23000.0,6.5시간 주문형 동영상,"배울 내용
Understand the fundamentals of Robotic Process Automation (RPA)
Working with UiPath studio for designing RPA
Designing Robots for automation of various workflows involving use of Notepad, Excel file, PDF file, Word File etc.
Perform data scraping from website: Amazon
Controlling Robot using Orchestrator",영어,https://www.udemy.com/course/uipathrpa/
no-code-development,Webflow,Build A Lead-Generating Portfolio Website In 1 Hour (2023),초급자,"17,000",23000.0,1.5시간 주문형 동영상,"배울 내용
The best way to build an portfolio Website that helps you generate new high-paying clients
How to win visitors trust the moment they land on your website and why that's important
How to build a website from scratch without using a single line of code
Creating a website yourself in just a few hours and saving thousands on hiring a developer to do it for you
Learning how to showcase your work in a way which helps you win high-paying clients
Learn how to build an objective driven website which works as the best sales person for your business every day 24/7, 365",영어,https://www.udemy.com/course/build-a-lead-generating-portfolio-website-in-hours-2022/
no-code-development,Niche Website,Build A Lead-Generating Agency Website In 1 Hour (2023),초급자,"17,000",23000.0,1시간 주문형 동영상,"배울 내용
The best way to build an Agency Website that helps you generate new high-paying clients
How to win visitors trust the moment they land on your website and why that's important
How to build a website from scratch without using a single line of code
Creating a website yourself in just a few hours and saving thousands on hiring a developer to do it for you
Learning how to showcase your work in a way which helps you win high-paying clients
Learn how to build an objective driven website which works as the best sales person for your business every day 24/7, 365",영어,https://www.udemy.com/course/build-a-lead-generating-agency-from-scratch-for-free/
no-code-development,WordPress for Ecommerce,Create an Event Booking Website with WordPress,모든 수준,"17,000",23000.0,4시간 주문형 동영상,"배울 내용
Automate an online booking or appointment system online
Create a website that can take bookings online using WordPress
Create a landing page for the booking system
Take payments online",영어,https://www.udemy.com/course/create-an-event-booking-website-with-wordpress/
no-code-development,Bubble Visual Programming,Building A Yelp Clone With No-Code Using Bubble,모든 수준,"17,000",23000.0,3시간 주문형 동영상,"배울 내용
How to build your own review directory like Yelp without writing a single line of code
An overview of Bubble's no-code toolset
How to set-up your own custom database
How to register new user accounts
How to create a settings page for users to update their profile information
How to create a dashboard to edit restaurant details
How to build a home page search function
How to display a list of relevant search results
How to create a dynamic restaurant page
How to create & display user-generated reviews
Additional tips & insights to help on your Bubble journey
더 보기",영어,https://www.udemy.com/course/building-a-yelp-clone-with-no-code-using-bubble/
no-code-development,Mobile App Development,The First Complete Course: Make Mobile App Without Coding,모든 수준,"49,000",,12.5시간 주문형 동영상,"배울 내용
Learn to build mobile apps without code from scratch. No previous experience required
Create both an iOS and Android only by using your computer (PC or Mac)
Mobile app design: How to transform any design into a functional mobile app
How I created 2 apps LIVE in this course (step by step)
How to publish your mobile app to Apple App Store and Google Play Store (step by step process)
Master the fundamentals of Adalo! More than 12 hours of video content!
How to quickly turn your app ideas to life
Build beautifully designed mobile apps",영어,https://www.udemy.com/course/the-first-complete-course-make-mobile-app-without-coding/
no-code-development,WordPress,"WordPress Full guide 2022, develop investment website",모든 수준,"17,000",23000.0,3시간 주문형 동영상,"배울 내용
Master wordPress
Making use of xampp
Database creation/upload
Build a successful paying website
Convert woocommerce plugin to investment website
Learn and Master the use of over 6 plugins
Learn How to publish your local website online
Start making money creating investment websites for their clients",영어,https://www.udemy.com/course/build-investment-website-using-wordpress-woocommerce-2022/
no-code-development,Webflow,Build a Personal Brand Website in only 1 Hour (2023),초급자,"17,000",23000.0,1.5시간 주문형 동영상,"배울 내용
The best way to build a Website for your personal brand to help build your email list and grow your community
How to win visitors trust the moment they land on your website and why that's important
How to build a website from scratch without using a single line of code
Creating a website yourself in just a few hours and saving thousands on hiring a developer to do it for you
Learning how to showcase your work in a way which helps you provide a great user experience for your website traffic
Learn how to build an objective driven website which works hard to sell your personal brand every day, 24/7 365!",영어,https://www.udemy.com/course/the-personal-brand-website-blueprint-course-2022/
no-code-development,Web Design,Create a High Converting Wix Website for Your Business,초급자,"19,000",25000.0,2시간 주문형 동영상,"배울 내용
Learn website planning elements which include branding, competitor analysis, CTAs and sitemap
Create a responsive website layout on Wix from start to finish
Master the high conversion method, having a professional website is not enough to start making sales
Have a website published and live that can also rank for SEO and be found on search engines
Learn a skill that can make you money on the side, and become a WIX Web Designer",영어,https://www.udemy.com/course/create-high-converting-wix-website-for-business/
no-code-development,Terraform,Ultimate Terraform Guide with Interview Preparation,모든 수준,"17,000",23000.0,3.5시간 주문형 동영상,"배울 내용
Terraform Introduction
Terraform Create your First Resource
Terraform Generate Secrets
Terraform Strings
Terraform EC2 Create Instance
Terraform Variables
Terraform RDS create
Terraform advance skills
Terraform Hands-On Project Step By Step
Interview Preparation",영어,https://www.udemy.com/course/ultimate-terraform-guide-with-interview-preparation/
no-code-development,WordPress,WordPress: Backup and Restore,중급자,"17,000",59000.0,4시간 주문형 동영상,"배울 내용
Create an ALL IN ONE WordPress BACKUP SOLUTION without using any plugins
Create a server level backup solution that will backup your database and site files to either the server that is hosting the site or to a remote server
The entire backup process is automated and require no interaction on your part
The correct procedure to restore a WordPress site from the backups",영어,https://www.udemy.com/course/wordpress-backup-and-restore/
no-code-development,Internet Of Things,Internet of Things for beginners - IoT project in 10 mins,초급자,"17,000",23000.0,2시간 주문형 동영상,"배울 내용
Introducing you to Internet of things
Learn basics of electronics, electronic components & simulation platforms
Using cloud solutions to easily develop an IoT applications using magicblocks platform
Implementing several practical applications with IoT technologies",영어,https://www.udemy.com/course/internet-of-things-for-beginners-iot-project-in-10-mins/
no-code-development,Web Scraping,Automate Web Scraping with No Code - Extract Data From Web,초급자,"17,000",23000.0,2시간 주문형 동영상,"배울 내용
Automate Scraping Web Data
Create Automated Work Flows
Share flows
Export flows
Import flows",영어,https://www.udemy.com/course/automate-web-scraping-with-no-code-extract-data-from-web/
no-code-development,Bubble Visual Programming,Building A Slack Clone With No-Code Using Bubble,모든 수준,"17,000",23000.0,3시간 주문형 동영상,"배울 내용
How to build your own team messaging app like Slack without writing a single line of code
An overview of Bubble's no-code toolset
How to set up your own custom database
How to register new user accounts & create a team workspace
How to register accounts for invited team members
How to create a home page for a Slack team workspace
How to create a new Slack channel
How to edit the settings of a Slack channel
How to send and display messages within a Slack channel
How to update user account details
더 보기",영어,https://www.udemy.com/course/building-a-slack-clone-with-no-code-using-bubble/
no-code-development,Elementor,Build Your Own Website With No Code | Elementor Masterclass,모든 수준,"17,000",23000.0,2.5시간 주문형 동영상,"배울 내용
Working with Elementor page builder
Learn what to consider when choosing your domain and hosting provider
The use of blocks and templates to speed up the creation process
Knowledge about the different tools, elements and settings of Elementor",영어,https://www.udemy.com/course/build-your-own-website-with-no-code-elementor-masterclass/
no-code-development,Webflow,Your One-Stop Shop to Learn Webflow for Freelancing,모든 수준,"29,000",,25.5시간 주문형 동영상,"배울 내용
Learn the ins and outs of Webflow Designer
Add and style Webflow elements and layouts
Add different types of animations and interactions to elements
Learn proper techniques to make a responsive website
Build an outstanding responsive portfolio website in Webflow
Connect Webflow website to a custom domain
How to take advantage of Webflow paid plans",영어,https://www.udemy.com/course/your-one-stop-shop-to-learn-webflow-in-2022/
no-code-development,WordPress,How to Create a Newspaper or Magazine Website with WordPress,초급자,"17,000",23000.0,1.5시간 주문형 동영상,"배울 내용
How to create a news or magazine website with WordPress
How to create a multi-blog website
How to create a complete WordPress site without coding knowledge
Learn WordPress basics",영어,https://www.udemy.com/course/how-to-create-a-newspaper-or-magazine-website-with-wordpress/
no-code-development,WordPress,Create Online Education Website by Wordpress and Elementor,모든 수준,"17,000",23000.0,1.5시간 주문형 동영상,"배울 내용
How to transform a design to real webpages
How to create a complete website from scratch in Wordpress
How to Create LMS website from scratch
How to choose themes,colors, fonts etc.",영어,https://www.udemy.com/course/wp-lms-education-elementor-site/
no-code-development,WordPress,Create High Converting Real Estate website with WordPress,모든 수준,"17,000",23000.0,1시간 주문형 동영상,"배울 내용
Create a beautiful website for your real estate business
Generate leads through your website while you sleep
Build an audience and grow traffic to your website
How To Make A Real Estate Website With Wordpress",영어,https://www.udemy.com/course/create-high-converting-real-estate-website-with-wordpress/
no-code-development,WooCommerce,WooCommerce Masterclass 2023 - Build 5 E-commerce Websites,모든 수준,"17,000",23000.0,15시간 주문형 동영상,"배울 내용
To Install, manage users, create menus/pages/posts, and configure settings for a professional website.
To Install and configure the powerful eCommerce plugin for seamless online selling.
To Add, edit, and delete various products to showcase your offerings effectively.
To Configure taxes and shipping options based on different zones for a smooth customer experience.
To Seamlessly integrate popular payment gateways for secure online transactions.
To Set up one-page and multistep checkout processes for improved conversions.
To Tailor the checkout process to capture relevant information from customers.
To Generate PDF invoices and packaging slips for efficient order management.
더 보기",영어,https://www.udemy.com/course/woocommerce-crash-course-for-beginners/
no-code-development,WordPress,Build a Premium Job Board Website With Wordpress,모든 수준,"17,000",23000.0,40분 주문형 동영상,"배울 내용
Build their own hosted Wordpress job board website
Set up a domain and hosting for wordpress
Learn to install wordpress, theme and plugins
Edit pages, blog posts and jobs
Create different users roles like editors, employers, employee
Monetize job board website with subscription
Learn to understand to use employer and employee dashboard and admin control panel",영어,https://www.udemy.com/course/build-a-premium-job-board-website-with-wordpress/
no-code-development,Elementor,Elementor Pro BootCamp (Build Custom Dynamic Websites),중급자,"17,000",23000.0,2.5시간 주문형 동영상,"배울 내용
Using the Elementor Theme Builder, creating loops and listing
Working with Dynamic Content, Custom Post Types, Custom Fields and CSS
Integrating Elementor with 3rds party tools for automation, eCommerce or security
Optimize Elementor sites for performance and SEO
Price web projects, choosing tools and building a dream team",영어,https://www.udemy.com/course/elementor-pro-bootcamp/
no-code-development,Bubble Visual Programming,Building A Quora Clone With No-Code Using Bubble,모든 수준,"17,000",39000.0,5시간 주문형 동영상,"배울 내용
How to build your own question and answer platform like Quora without writing a single line of code
An overview of Bubble's no-code toolset
How to set up your own custom database
How to register new user accounts
How to build a user settings page
How to build a home page with a custom search function
How to process upvotes and downvotes across the platform
How to publish user-generated questions on the platform
How to display the full information of each question on a dedicated page
How users can submit answers to Quora questions
더 보기",영어,https://www.udemy.com/course/building-a-quora-clone-with-no-code-using-bubble/
no-code-development,WordPress,Build Ecommerce Website like Amazon - No Coding Required,모든 수준,"19,000",25000.0,2.5시간 주문형 동영상,"배울 내용
Easily Design a Mutli Vendor Website from Start to Finish.
Easily Maintain Your Website & Make Routine Updates
Have a website published and live that can also be seen on Google
Understand the main features of WordPress
This course will teach anyone to create a functional, beautiful, responsive website with WordPress.",영어,https://www.udemy.com/course/build-ecommerce-website-like-amazon-no-coding-required/
no-code-development,Web Development,Build an e-learning platform using WIX with no coding,초급자,"19,000",25000.0,3.5시간 주문형 동영상,"배울 내용
Create a website in few steps
How to use WIX
Create E-learning platform
Create a website without any line of code",영어,https://www.udemy.com/course/build-e-learning-platform-in-few-steps-using-wix/
no-code-development,Elementor,Build Websites with Elementor Like a Pro,초급자,"17,000",23000.0,3시간 주문형 동영상,"배울 내용
The basics of Elementor and how to set it up on their WordPress website
How to use Elementor's drag-and-drop interface to design custom pages and layouts
How to add widgets and modules to their pages, including text, images, buttons, and more
How to customize the appearance of their website using Elementor's styling options, including fonts, colors, and backgrounds
How to integrate third-party tools and plugins with Elementor for added functionality
How to create responsive designs that look great on any device
Creating Website Using Elementor",영어,https://www.udemy.com/course/build-websites-with-elementor-like-a-pro/
no-code-development,Google AppSheet,Build a Vehicle Inspection App with AppSheet,중급자,"49,000",,3시간 주문형 동영상,"배울 내용
How to create a vehicle inspection app in AppSheet.
Table relationships and setting up references between the tables.
How to set up a bot to email a pdf of a document you set up, as well as some template expressions.",영어,https://www.udemy.com/course/build-a-vehicle-inspection-app-with-appsheet/
no-code-development,Prompt Engineering,Prompt Engineering For Business,모든 수준,"17,000",23000.0,4시간 주문형 동영상,"배울 내용
Enhance decision-making and problem-solving skills for business professionals and managers
Drive innovation and creativity for entrepreneurs and startup founders
Improve data analysis techniques for data analysts and researchers
Foster collaboration and effective communication for project managers and team leaders
Develop practical prompt engineering skills for business students and graduates
Leverage prompts for improved outcomes in product development, marketing, strategy, and operations
Apply prompt engineering principles in a business context for individuals",영어,https://www.udemy.com/course/prompt-engineering-for-business/
no-code-development,RPA Robotic Process Automation,The Complete Social Media Bot Course: Build No Code Bots,중급자,"17,000",23000.0,1.5시간 주문형 동영상,"배울 내용
Save time by automating repetitive online tasks
Learn web automation without needing to code
Learn how to use Microsoft Power Automate 2022 to build any automation
Build quickly bots for Linkedin, Facebook and Twitter",영어,https://www.udemy.com/course/web-automation/
no-code-development,Internet Marketing,How to Customize & Publish a Simple Website in One Day,초급자,"19,000",25000.0,1시간 주문형 동영상,"배울 내용
You'll publish a one-page website on your own custom domain name
You'll configure a one-field form for collecting email addresses through your website
You'll customize your one-page website with royalty-free high-quality background images
You'll learn how to combine Netlify and Gitlab to create an automated publishing system for your website
You'll understand what it means to fork a repo in Gitlab and the simplest way to do it
You'll learn how to make changes to an HTML file using Gitlab's website",영어,https://www.udemy.com/course/launch-a-landing-page-and-start-collecting-leads-in-an-hour/
no-code-development,Metaverse,A practical beginners guide to build Metaverse with Croquet,초급자,"17,000",23000.0,1시간 주문형 동영상,"배울 내용
Learn and Create a spot in metaverse within an hour
Learn fundamentals of a unique metaverse framework
Learn fundamentals of low code tools and frameworks for 3D world creation
Learn how to use node based web products",영어,https://www.udemy.com/course/learn-and-create-a-spot-in-metaverse-within-an-hour/
