대분류,소분류,강의명,난이도,가격(현재가격),가격(원래가격),총소요시간,강의소개,언어,출처
data-science,Machine Learning,Build an AWS Machine Learning Pipeline for Object Detection,중급자,"17,000",23000,16시간 주문형 동영상,"배울 내용
Learn how you can use Google's Open Images Dataset V7 to use any custom dataset you want
Create Sagemaker Domains
Upload and Stream data into you Sagemaker Environment
Learn how to set up secure IAM roles on AWS
Build a Production Ready Object detection Algorithm
Use Pandas, Numpy for Feature and Data Engineering
Understanding Object detection annotations
Visualising Images and Bounding Boxes with Matplotlib
Learn how Sagemaker's Elastic File System(EFS) works
Use AWS' built in Object detection detection algorithm with Transfer Learning
더 보기",영어,https://www.udemy.com/course/build-an-aws-machine-learning-pipeline-for-object-detection/
data-science,Google BigQuery,Google BigQuery ML Machine Learning in SQL (without Python),모든 수준,"17,000",69000,3.5시간 주문형 동영상,"배울 내용
Create Machine Learning model and make prediction using only SQL code
Evaluate and interpret model prediction quality
Do Feature Engineering on different data types
Clean up and limit data source with understanding of consequence of it",영어,https://www.udemy.com/course/google-bigquery-ml-machine-learning-in-sql-without-python/
data-science,,The Complete Unity® Masterclass: Build 2D & 3D AI Games,모든 수준,"17,000",23000,26시간 주문형 동영상,"배울 내용
Code for game development in Unity C#.
Build a Ninja Survival game for mobile in Unity®.
Make games with the pathfinding algorithm A Star.
Make good pathfinding systems to find the best path for characters to navigate to wherever you click.
Learn the fundamentals of building, coding, and designing a mobile game.
Make both the code and the art for mobile game from scratch.
Program characters to move autonomously in a 3D world.
And more!",영어,https://www.udemy.com/course/the-complete-unity-masterclass-build-2d-3d-ai-games/
data-science,Geospatial,Building Big Data Pipelines with R & Sparklyr & Power BI,모든 수준,"19,000",25000,2.5시간 주문형 동영상,"배울 내용
Power BI Data Visualization
R Programming
Data Analysis
Big Data Machine Learning
Geo Mapping with ArcGIS Maps for Power BI
Geospatial Machine Learning
Creating Dashboards",영어,https://www.udemy.com/course/building-big-data-pipelines-with-r-sparklyr-power-bi/
data-science,Machine Learning,Complete Machine Learning course,중급자,"17,000",23000,6.5시간 주문형 동영상,"배울 내용
Basics of machine learning
Linear Regression
Logistic Regression
KNN alogrithm
Clustering
K-Means Clustering
Principal component analysis
Data preprocsseing
EDA
The Machine Learning Process
Naive Bayes Classifier
Supervised learning and unsupervised learning
Confusion Matrix
The Elbow Method
Feature Scaling
Feature Scaling
더 보기",영어,https://www.udemy.com/course/machine-learning-course-f/
data-science,Data Science,100 Days of Code: Data Scientist Challenge,모든 수준,"17,000",23000,28분 주문형 동영상,"배울 내용
solve over 300 exercises in Python
deal with real programming problems
work with documentation
guaranteed instructor support",영어,https://www.udemy.com/course/100-days-of-code-data-scientist-challenge/
data-science,Data Visualization,The Complete Data Visualization Toolkit Bundle,모든 수준,"23,000",,29.5시간 주문형 동영상,"배울 내용
The Tableau interface and its major functions
Which data structures are suitable for Tableau
Connect and manage data sources in Tableau
Create a dashboard in Tableau and animate your visualizations
Use calculated fields and spatial functions in Tableau
Level of Detail (LOD) expressions
Advanced filters and table calculations in Tableau
Advanced Tableau charts?circular, sunburst, bump, funnel, candlestick, and Sankey charts
Using Alteryx workflows to cut out repetitive tasks
Creating reports in Alteryx that run on demand
더 보기",영어,https://www.udemy.com/course/the-complete-data-visualization-toolkit-bundle/
data-science,Web Scraping,Web Scraping: Scrape Data to Google Sheets with Sheets Genie,모든 수준,"23,000",,1.5시간 주문형 동영상,"배울 내용
Scrape data from websites directly to Google Sheets
Set up and use Sheets Genie for web scraping (taught by the creator of Sheets Genie)
Identify elements and data to scrape on website pages via CSS Selectors
Customize scrape setups to get data in your sheets exactly like you want it",영어,https://www.udemy.com/course/web-scraping-scrape-data-to-google-sheets-with-sheets-genie/
data-science,AutoML Automated Machine Learning,Automated Machine Learning Hands on AutoML for beginners,초급자,"17,000",48000,2.5시간 주문형 동영상,"배울 내용
A hands on overview of free python automl packages and how to use them
What is automl
How to use automl in python
Automated machine learning in practise",영어,https://www.udemy.com/course/automated-machine-learning-hands-on-automl-for-beginners/
data-science,Machine Learning,The Complete Supervised Machine Learning Models in R,전문가,"17,000",23000,14시간 주문형 동영상,"배울 내용
Learn Complete Supervised Machine Learning Models in R
Learn the Math behind every Machine Learning Model
Learn the Intuition of each Model
Learn to choose the best Machine Learning Model for a specific problem",영어,https://www.udemy.com/course/the-complete-supervised-machine-learning-models-in-r-u/
data-science,Data Analysis,Analyze NBA data in Python,초급자,"19,000",25000,3.5시간 주문형 동영상,"배울 내용
Clean, analyze, and visualize data about NBA players",영어,https://www.udemy.com/course/data-analysis-python-nba/
data-science,Data Science,Start & Grow Your Career in Machine Learning/Data Science,초급자,"19,000",25000,1.5시간 주문형 동영상,"배울 내용
Introduction to machine learning
How to prepare for coding, technical, behavioral, and on-site interviews
How to apply for full-time jobs and internships
How to prepare a resume
How to navigate internships
Examples of machine learning careers
How to negotiate a job offer
Machine learning resources
Interviewing tips",영어,https://www.udemy.com/course/start-grow-your-career-in-machine-learningdata-science/
data-science,ChatGPT,"Learn ChatGPT, Midjourney, AI and Use it For Passive Income",모든 수준,"17,000",23000,2시간 주문형 동영상,"배울 내용
How to build a website and create landing pages/sales funnels using ChatGPT
Techniques for using ChatGPT to create personalized, profitable, and engaging Youtube content
Create content, synthesize information, and learn faster than ever with effective prompt engineering!
Develop a visual identity, design logos, and generate content to establish a strong online presence!",영어,https://www.udemy.com/course/learn-chatgpt-midjourney-ai-and-use-it-for-passive-income/
data-science,Data Science,Practical Data Science using Python,모든 수준,"17,000",23000,29.5시간 주문형 동영상,"배울 내용
Data Science Core Concepts in Detail
Data Science Use Cases, Life Cycle and Methodologies
Exploratory Data Analysis (EDA)
Statistical Techniques
Detailed coverage of Python for Data Science and Machine Learning
Regression Algorithm - Linear Regression
Classification Problems and Classification Algorithms
Unsupervised Learning using K-Means Clustering
Dimensionality Reduction Techniques (PCA)
Feature Engineering Techniques
Model Optimization using Hyperparameter Tuning
Model Optimization using Grid-Search Cross Validation
더 보기",영어,https://www.udemy.com/course/practical-data-science-using-python-md/
data-science,Data Visualization,Analytics dashboard using python and plotly,초급자,"17,000",23000,3.5시간 주문형 동영상,"배울 내용
Create test data using pandas and numpy
Create comprehensive visuals using plotly
Create a dashboard layout using dash
Add additional functionality to the dashboard using dash callbacks
Deploy the dashboard on Heroku",영어,https://www.udemy.com/course/analytics-dashboard-python/
data-science,Machine Learning,Machine learning for chemical industries to boost profit,모든 수준,"17,000",23000,7.5시간 주문형 동영상,"배울 내용
Master Machine Learning with matlab
Develop intuition for various Machine Learning models
Make accurate predictions
Conduct powerful analysis
Build robust Machine Learning models
Create added value for businesses
Apply Machine Learning for personal purposes
Choose appropriate Machine Learning models for different types of problems
Build an arsenal of powerful Machine Learning models and learn how to combine them to solve any problem.
Develop skills to solve real life industry problem through machine learning",영어,https://www.udemy.com/course/learn-machine-learning-to-apply-it-in-real-life-industries/
data-science,GIS,MySQL for Geospatial Applications,초급자,"17,000",23000,16.5시간 주문형 동영상,"배울 내용
Understand the advantages of storing spatial information in spatially enabled databases
Install MySQL locally for development purposes and/or access an instance of MySQL that is running on their organizations intranet, a web host, or the cloud
Write SQL queries to retrieve and analyze spatial data.
Use the tools available in MySQL to validate data and control user access
Perform basic database administration functions to keep your spatial database running smoothly
Customize your database with your business logic using stored procedures, user defined functions, and triggers
Access your data from a variety of clients including, QGIS, ArcGIS, PhPMyAdmin, MySQL Workbench, the MySQL command line, Python, and web maps",영어,https://www.udemy.com/course/mysql-for-geospatial-applications/
data-science,Machine Learning,Data Science Mastery: Journey into Machine Learning [2023],모든 수준,"17,000",23000,9시간 주문형 동영상,"배울 내용
Gain proficiency in using Python libraries commonly used in data science and machine learning, such as NumPy, Pandas, and Matplotlib.
Learn how to clean and preprocess datasets, including handling missing data, outliers, and feature scaling.
Acquire knowledge of exploratory data analysis techniques to extract insights and patterns from data.
Master the fundamentals of statistical analysis and apply statistical methods to interpret and draw conclusions from data.
Understand the principles of machine learning and its various algorithms, such as regression, classification, and clustering.
Learn how to select appropriate machine learning models and techniques for different types of problems and datasets.
Develop skills in feature engineering and selection to enhance the performance of machine learning models.",영어,https://www.udemy.com/course/data-science-mastery-journey-into-machine-learning-2023/
data-science,Data Science,Data Science: Create Real World Projects,모든 수준,"17,000",23000,20시간 주문형 동영상,"배울 내용
Learn to create real world Data science and Machine learning projects
Learn about different Machine learning models and algorithms
Learn about Data Science life cycle and apply methodologies for creating projects
Learn about different domains of Data Science: Feature engineering, Feature transformation, and model Melection
Learn about Natural Language Processing
Learn about Artificial Intelligence and how to use it to solve the Data Science problems",영어,https://www.udemy.com/course/data-science-create-real-world-projects/
data-science,Prompt Engineering,Mastering Prompt Engineering: ChatGPT Tips & Best Practices,초급자,"17,000",23000,1시간 주문형 동영상,"배울 내용
The basics of prompt engineering and how to apply it to large language models like ChatGPT.
How to design effective prompts that give you the results you want from ChatGPT, including different types of prompts and prompt patterns.
How to automate software development tasks and generate content for your blog using ChatGPT.
Best practices for prompt engineering, including how to avoid common pitfalls and ensure that your prompts are effective and efficient.",영어,https://www.udemy.com/course/mastering-prompt-engineering-chatgpt-tips-best-practices/
data-science,Data Science,Machine Learning Python with Theoretically for Data Science,모든 수준,"17,000",23000,4시간 주문형 동영상,"배울 내용
Machine learning describes systems that make predictions using a model trained on real-world data
Machine learning isn’t just useful for predictive texting or smartphone voice recognition. Machine learning is constantly being applied to new industries and ne
Machine learning is a smaller subset of the broader spectrum of artificial intelligence. While artificial intelligence describes any ""intelligent machine""
Machine learning is one of the fastest-growing and popular computer science careers today. Constantly growing and evolving.
Machine learning is generally divided between supervised machine learning and unsupervised machine learning. In supervised machine learning.
Machine learning is being applied to virtually every field today. That includes medical diagnoses, facial recognition, weather forecasts, image processing.
더 보기",영어,https://www.udemy.com/course/machine-learning-python-with-theoretically-for-data-science/
data-science,TensorFlow,TensorFlow Interview Questions & Answers,모든 수준,"19,000",25000,3시간 주문형 동영상,"배울 내용
TensorFlow interview questions with answers
Crack TensorFlow and Deep Learning / Machine Learning job interviews
Enhance your knowledge of TensorFlow
Become a TensorFlow / Deep Learning Engineer
Get aware about the most trending topics on TensorFlow",영어,https://www.udemy.com/course/tensorflow-interview-questions-and-answers/
data-science,Data Analysis,The Complete SQL Bootcamp for Data Analysis ? Level 1,초급자,"17,000",23000,2시간 주문형 동영상,"배울 내용
Use SQL to query data in databases
Perform data analysis and extract useful insights
Install and use PostgresSQL
Create database objects - databases, schemas and tables
Load datasets from external CSV files
Query data with various types of filtering conditions
Explore and count distinct values across the dataset
Aggregate rows into groups",영어,https://www.udemy.com/course/the-complete-sql-bootcamp-for-data-analysis-level-1/
data-science,Natural Language Processing,Natural Language Processing With TextBlob (Python NLP),모든 수준,"17,000",23000,1.5시간 주문형 동영상,"배울 내용
Natural Language Processing (NLP)
TextBlob -- a Python framework built on top of NLTK
Tokenization
Text classification
Part-of-speech tagging
Producing definitions
Comparing the similarity of words
Generating n-grams
Spell checking
Sentiment analysis
Hugging Face's Datasets library",영어,https://www.udemy.com/course/textblob-nlp/
data-science,Data Analysis,Master Python Data Analysis and Modelling Essentials,모든 수준,"17,000",23000,7.5시간 주문형 동영상,"배울 내용
Data analysis and modelling process
Setting up Python data analysis and modelling environment
Data exploration
Rename the data columns
Data slicing, sorting, filtering, and grouping data
Missing value detection and imputation
Outlier detection and treatment
Correlation Analysis and feature selection
Splitting data set for model fitting and testing
Data normalization with different methods
Developing a classic statistical linear regression model
Developing a machine linear regression model
더 보기",영어,https://www.udemy.com/course/master-python-data-analysis-and-modelling-essentials/
data-science,Pandas,Python- Numpy & Pandas Python Programming Language Libraries,모든 수준,"17,000",23000,21시간 주문형 동영상,"배울 내용
Python is a computer programming language often used to build websites and software, automate tasks, and conduct data analysis.
Python is a general-purpose language, meaning it can be used to create a variety of different programs and isn't specialized for any specific problems.
Whether you work in artificial intelligence or finance or are pursuing a career in web development or data science, Python is one of the most important skills
Its simple syntax and readability makes Python perfect for Flask, Django, data science, and machine learning.
Installing Anaconda Distribution for Windows
Installing Anaconda Distribution for MacOs
Installing Anaconda Distribution for Linux
Reviewing The Jupyter Notebook
더 보기",영어,https://www.udemy.com/course/python-numpy-pandas-python-programming-language-libraries/
data-science,Machine Learning,Basic Statistics & Regression for Machine Learning in Python,모든 수준,"19,000",25000,5시간 주문형 동영상,"배울 내용
Python Basics, Statistics and Regression behind Machine Learning in Python and also using Manual Calculations",영어,https://www.udemy.com/course/basic-statistics-regression-for-machine-learning-in-python/
data-science,Data Analysis,Data Analytics and Visualisation with Python,초급자,"17,000",23000,3시간 주문형 동영상,"배울 내용
Learn basic data analytics and data visualisation concepts
Be familiar to use Pandas and Matplotlib
Learn how to perform statistical analysis on dataset
Learn how to generate scatterplot and bar plot
Learn how to explore datasets on Kaggle",영어,https://www.udemy.com/course/data-analytics-and-visualisation-with-python/
data-science,Data Science,Data Science Bootcamp: Your First Step as a Data Scientist,모든 수준,"17,000",23000,12시간 주문형 동영상,"배울 내용
Developing Linear Regression in R
Developing Logistic Regression in R
Learning how to Evaluate Data Science Models
Learning how to manipulate data with Dplyr
Building a Data Science Project end-to-end
Submit your own predictions into Kaggle",영어,https://www.udemy.com/course/r-for-data-science-first-step-data-scientist/
data-science,Web Scraping,Automate Data Extraction and Web Scraping using Python,초급자,"17,000",23000,2시간 주문형 동영상,"배울 내용
Setup data extraction environment
Extract | Scape data from the web
Build a web scrapping tool
Prototype a web scraping tool
Inspect HTML elements
Extract data using Beautiful Soup",영어,https://www.udemy.com/course/automate-data-extraction-and-web-scraping-using-python/
data-science,Data Analysis,"Big Data Visualization Toolkit (Tableau, Alteryx, QlikSense)",초급자,"17,000",23000,30시간 주문형 동영상,"배울 내용
What Tableau is and the product suite
The Tableau interface and its major functions
Which data structures are suitable for Tableau
How Tableau reads and categorizes data
How to connect and manage data sources in Tableau
How to build a view and different chart types in Tableau
How to create a dashboard in Tableau
How to publish and share a workbook
How to use numeric, string, conditional, and analytical expressions/functions in Tableau
How to use calculated fields in Tableau
How to use Alteryx workflows to cut out repetitive tasks
How to build visual workflows in Alteryx
더 보기",영어,https://www.udemy.com/course/the-big-data-toolkit-bundle-tableau-alteryx-qliksense/
data-science,Data Science,Data Science: Car Price Prediction-Model Building Deployment,모든 수준,"17,000",23000,1.5시간 주문형 동영상,"배울 내용
Data Analysis and Understanding
Univariate and Bivariate Analysis
Data Preparation
Model Building using XGBoost to predict price of a car.
Model Evaluation
Predicting important variables leading to a car price using XGBoost
Running the model on a local Streamlit Server
Pushing your notebooks and project files to GitHub repository
Deploying the project on Heroku Cloud Platform",영어,https://www.udemy.com/course/hands-on-car-price-prediction-data-analysis-model-building-deployment/
data-science,SQL,"Practical Hands-on Microsoft SQL Joins : SQL Server ,SSMS",초급자,"17,000",23000,2시간 주문형 동영상,"배울 내용
Query Data From Multiple Tables Using JOIN
Combine data using INNER JOIN
Combine data using LEFT JOIN
Combine data using RIGHT JOIN
Combine data using FULL JOIN",영어,https://www.udemy.com/course/practical-hands-on-microsoft-sql-joins-sql-server-ssms/
data-science,Natural Language Processing,Natural Language Processing For Text Analysis With spaCy,모든 수준,"17,000",23000,3시간 주문형 동영상,"배울 내용
Understand the basic concepts of natural language processing, including: part-of-speech, lemmatization, stemming, named entity recognition, and stop words
Implement text summarisation and keyword search
Understand more advanced concepts, such as: dependency parsing, tokenization, word and sentence similarity
Implement text summarisation and keyword search",영어,https://www.udemy.com/course/natural-language-processing-for-text-analysis-with-spacy/
data-science,Machine Learning,Machine Learning with Minitab Predictive Analytics,초급자,"17,000",23000,11.5시간 주문형 동영상,"배울 내용
You will learn the fundamentals of machine learning with a focus on practical applications using Minitab.
You will also learn how to apply these techniques to real world problems in a wide variety of application areas.
This hands-on approach will give you the confidence and skills you need to succeed in a career in data analysis or machine learning.
By the end of the course, you'll be able to build and implement regression and classification models and gain a deep understanding of their underlying concepts.",영어,https://www.udemy.com/course/machine-learning-basics-with-minitab/
data-science,Apache Spark,Spark 3 on Google Cloud Platform-Beginner to Advanced Level,초급자,"17,000",23000,5.5시간 주문형 동영상,"배울 내용
Understand the fundamentals of Apache Spark3, including the architecture and components
Develop and Deploy PySpark Jobs to Dataproc on GCP including setting up a cluster and managing resources
Gain practical experience in using Spark3 for advanced batch data processing , Machine learning and Real Time analytics
Best practices for optimizing Spark3 performance on GCP including Autoscaling , fine tuning and integration with other GCP Components",영어,https://www.udemy.com/course/spark-3-on-google-cloud-platform-beginner-to-advanced-level/
data-science,Data Analysis,Statistics Analysis : Capstone Project on Medical Domain,모든 수준,"17,000",23000,42분 주문형 동영상,"배울 내용
Distinguish and work with different types of distributions
Understand the mechanics of regression analysis
Estimate confidence intervals
Understand the fundamentals of statistics",영어,https://www.udemy.com/course/statistics-analysis-capstone-project-on-medical-domain/
data-science,TensorFlow,【한글자막】 Tensorflow 2와 Keras를 이용한 Deep Learning 부트캠프,모든 수준,"17,000",69000,19시간 주문형 동영상,"배울 내용
딥 러닝을 위해 TensorFlow 2.0을 사용하는 방법
Keras API를 활용하여 Tensorflow 2에서 실행하는 모델을 신속히 구축하는 방법
컨볼루션 신경망(CNN)을 이용한 이미지 분류 수행하는 방법
의료 이미지에 딥 러닝을 사용하는 방법
순환 신경망(RNN)을 이용해서 시계열 데이터를 예측하는 방법
생성적 대립 신경망(GAN)을 사용해서 이미지를 생성하는 방법
스타일 전환을 위해 딥 러닝을 사용하는 방법
RNN 및 자연어 처리를 사용하여 텍스트를 생성하는 방법
API를 통한 Tensorflow 모델을 제공하는 방법
가속화된 딥 러닝을 위해 GPU를 사용하는 방법",영어,https://www.udemy.com/course/best-tensorflow-2-keras-deep-learning/
data-science,Object Detection,"YOLO-NAS, OpenAI, SAM with WebApps using Flask and Streamlit",모든 수준,"17,000",23000,18시간 주문형 동영상,"배울 내용
YOLO-NAS : A New Foundation Model for Object Detection
What's New in YOLO-NAS | Is YOLO-NAS the Future of Object Detection?
YOLO-NAS Implementation | Windows
Object Detection with YOLO-NAS on Images
Object Detection with YOLO-NAS on Videos
Object Detection with YOLO-NAS on Live Webcam Feed
Run YOLO-NAS in Google Colab
YOLO-NAS + DeepSORT Tracking
YOLO-NAS + DeepSORT Tracking on Custom Dataset
YOLO-NAS with SORT Object Tracking
Vehicles Counting (Entering and Leaving) using YOLO-NAS and SORT Object Tracking
Building a Computer Vision Web App & Why UI is important
더 보기",영어,https://www.udemy.com/course/yolo-nas-object-detection-tracking-web-app-in-python-2023/
data-science,Machine Learning,Introduction to Python Machine Learning using Jupyter Lab,초급자,"17,000",23000,2.5시간 주문형 동영상,"배울 내용
Python 3
Exploratory data analysis and visualizations
Machine learning
Building prediction models
Linear regression
Evaluating models
Creating Jupyter notebooks in Jupyter Lab
Common python operations in Jupypter notebooks
Using scikit-learn for machine learning
and more...",영어,https://www.udemy.com/course/python-machine-learning-jupyterlab/
