대분류,소분류,강의명,난이도,가격(현재가격),가격(원래가격),총소요시간,강의소개,언어,출처
web-development,DevOps,DevOps Fundamentals With Agile: Gain Solid Understanding,초급자,"19,000","₩25,000",1.5시간 주문형 동영상,"배울 내용
Be able to gain solid understanding of DevOps principles and methodology
Learn DevOps lifecycle along with SDLC and DevOps culture
Learn the role of QA in DevOps
Gain additional tips and techniques in managing the DevOps cycle
Learn Agile approach along with Lean and Kaizen topics relating to project management basics
See how DevOps and Agile integrate to produce efficient processes and allow organizations to become profitable",영어,https://www.udemy.com/course/devops-core-fundamentals/
web-development,Redux Framework,"Redux, React Redux & Redux Toolkit RTK Course 2023",모든 수준,"17,000","₩69,000",12.5시간 주문형 동영상,"배울 내용
Master the core redux library
Build 6 mini projects and one mega project called project expenses and income tracker
Master the Redux Toolkit core library
Master redux with react
Master Redux Toolkit with react
Understand ins and out of redux
Master Asynchronous redux
Understand how redux works
Learn to use common APIs from Redux Toolkit
Understand createAsyncthunk for asynchronous actions
Understand createSlice, extraReducers, createAction, reducers and redux store",영어,https://www.udemy.com/course/redux-core-react-redux-redux-toolkit-complete-course/
web-development,JavaScript,Google Apps Script Consent Form Exercise - JavaScript Cloud,초급자,"19,000","₩25,000",1시간 주문형 동영상,"배울 내용
Create Google Script to power Google Apps
Create apps with Google Script
Build a form that submits data to a spreadsheet and sends email",영어,https://www.udemy.com/course/google-apps-script-course/
web-development,WordPress Plugins,The Complete Guide to the Best 200 WordPress Plugins,모든 수준,"17,000","₩23,000",18시간 주문형 동영상,"배울 내용
Install and configure over 100 different WordPress plugins
Learn how to choose the right kind of plugins",영어,https://www.udemy.com/course/wordpress-plugins-a-guide-on-the-best-plugins-part-1/
web-development,jQuery,jQuery & React Essentials: Learn jQuery & React Basics,모든 수준,"19,000","₩25,000",7시간 주문형 동영상,"배울 내용
Learn the fundamentals of jQuery & React.
Learn to use the DOM, and work with an external library.
Learn to use jQuery to create interactive sites.
How to build real-life jQuery projects.
Learn about React Libraries
Learn how to set up your development environment.
Learn to create new components; use props and state to pass data between components; use routes to map URLs to views; and organize projects with nested components and routes.
How to start building your own browser-based projects.",영어,https://www.udemy.com/course/jquery-essentials/
web-development,MERN Stack,Apply Jobs as MERN stack developer with this course,모든 수준,"17,000","₩23,000",11시간 주문형 동영상,"배울 내용
You can apply Jobs as a MERN stack developer
You will learn to implement Authentication and Restricted Routes concept
You will become a Pro Fullstack developer
You will learn all the concepts of React, Node, Express and MongoDB in practical project based approach
You will learn various debugging techniques",영어,https://www.udemy.com/course/apply-jobs-as-mern-stack-developer-with-this-course/
web-development,Svelte Framework,Svelte Crash Course through Projects w/ Backend Connections,초급자,"19,000","₩59,000",2시간 주문형 동영상,"배울 내용
Find out why compiled front-end code is such a great idea
Learn Svelte constructs, components, messages and events and many more
See how to use Stores and best practices for them
Learn how to properly connect Svelte to a backend
Get Exceptional Support. All questions answered within 24 hours!",영어,https://www.udemy.com/course/svelte-crash-course-through-projects-w-backend-connections/
web-development,Web Development,How To Build Instagram Clone Using Ruby on Rails 7,모든 수준,"19,000","₩59,000",7.5시간 주문형 동영상,"배울 내용
Building a complete Instagram clone using Ruby on Rails 7
Build Follow System of any Social Media Application
Building Real-Time searching functionality
Implementing authentication easily with Devise gem
Solve Devise integration problems with Ruby on Rails 7
Practice working with Bootstrap components and classes
Handling Authorization
Work with font-awesome to add icons
Handle complex database relationships
Build Like Functionality
Build Commenting System
Uploading images with preview and Drag-Drop using FileBond Javascript library
더 보기",영어,https://www.udemy.com/course/building-instagram-from-scratch-using-ruby-on-rails-7/
web-development,JavaScript,Master JavaScript - The Most Complete JavaScript Course 2022,모든 수준,"48,000","₩59,000",45.5시간 주문형 동영상,"배울 내용
Master JavaScript",영어,https://www.udemy.com/course/master-javascript-the-most-compete-javascript-course-2020/
web-development,Node.Js,"Node, Express JS, Angular 12 & Mongo DB web app development",초급자,"19,000","₩23,000",1시간 주문형 동영상,"배울 내용
Full Stack Web Development
Backend Development with Node, Express JS and Mongo DB
Front End Web Development with Angular 12
Build RESTful APIs",영어,https://www.udemy.com/course/node-express-js-angular-12-mongo-db-web-app-development/
web-development,GIS,Open Source Web GIS Development,초급자,"20,000","₩25,000",4시간 주문형 동영상,"배울 내용
Leafletjs
GeoServer
JavaScript
Open-Source web-GIS development
Bootstrap
HTML and CSS
User Interface design",영어,https://www.udemy.com/course/web-gis-development-2021/
web-development,Google Sites,Google Drive and Google Docs: Ultimate Guide,모든 수준,"19,000","₩25,000",3.5시간 주문형 동영상,"배울 내용
Learn How to Use Google Drive and Google Docs
Learn how to navigate the interface
Learn to create a website with Google Sites
How to create and edit documents, spreadsheets, presentation slides, and drawings
Deep dive into Google Docs and all the features
How to organize, sync, and locate your Drive filesrn to manage your site
Learn to add pages, images, text, videos and more",영어,https://www.udemy.com/course/create-websites-with-google-sites/
web-development,JavaScript,"Learn JavaScript, Get Hired | The Full Bootcamp",모든 수준,"20,000","₩25,000",7시간 주문형 동영상,"배울 내용
the differences between function declarations, expressions, and arrow functions.
a myriad of ways to write clean JavaScript code.
when the `this` keyword is relevant.
intricacies of types - coercion, null vs. undefined, truthy, falsy, and more.
why and how almost everything is an object.
the differences between let, const, and var.
a handful of ways to create object clones.
closures, function factories, and higher-order functions.
constructor functions
prototypes and the prototype-based inheritance model.
더 보기",영어,https://www.udemy.com/course/learn-javascript-get-hired-bootcamp/
web-development,MERN Stack,MERN Stack Doctor Appointment Booking App,초급자,"17,000","₩49,000",10시간 주문형 동영상,"배울 내용
In this course, we will cover a range of topics, including building full-stack applications from scratch, working with complex MongoDB queries, schemas, and mod
We will also cover how to implement JWT authentication and password hashing for securing the application. You will learn how to use the Ant Design library for U
We will also cover how to implement notifications functionality for users, admins, and doctors. You will learn how to manage users, doctors, and appointments fr
We will even cover how to push your code to GitHub and host your application on Heroku. Throughout the course, we will provide 24/7 QA support to help you along
This course is suitable for developers who have some experience working with the MERN stack and want to learn how to build a doctor appointment booking applicat",영어,https://www.udemy.com/course/mern-stack-doctor-appointment-booking-app/
web-development,PHP,The Complete PHP 7 Guide for Web Developers,모든 수준,"19,000","₩25,000",4시간 주문형 동영상,"배울 내용
Learn about how PHP7 is a paradigm shift for web developers
Learn about the new changes and how they impact your old code
Unleash the power of PHP 7 in your new web projects
Hands on examples of PHP7",영어,https://www.udemy.com/course/the-complete-php-7-guide-for-web-developers/
web-development,Coding For Kids,Kids Coding - Beginners CSS,모든 수준,"19,000","₩25,000",1시간 주문형 동영상,"배울 내용
Learn how to program
Learn about software development
Learn about web development
learn the funadmentals of software production
learn the fundamentals of programming",영어,https://www.udemy.com/course/kids-coding-beginners-css/
web-development,Responsive Design,Web Design FORMS Layouts A Must to Learn For All Levels,모든 수준,"20,000","₩25,000",2.5시간 주문형 동영상,"배울 내용
Tons of modern CSS techniques to create stunning designs and effects
Advanced CSS animations with @keyframes, animation and transition
Source Code For Download is Attached
Best way to learn CSS with really real world examples
How CSS works behind the scenes: the cascade, specificity, inheritance, etc.
Control and manipulate transformations of elements from 2D to 3D using scale, rotate, and the translate methods
Latest And Real time Examples with 7X Fast to Write
Using EMMET Short Methods to Write Coding to deliver Fast",영어,https://www.udemy.com/course/web-design-layouts-a-must-to-learn-for-all-levels/
web-development,CSS,Css For Beginners,초급자,"19,000","₩25,000",2.5시간 주문형 동영상,"배울 내용
Learn How to apply styling to divs
Learn how to write CSS Syntax
Learn how to apply Internal stylesheet to an HTML Document
Learn how to apply External stylesheet to an HTML Document
Learn how to make rounded corners on a square
Learn how to change the background color of a webpage
Learn how to position images on a webpage
Learn how to style HTML elements by their id and Class",영어,https://www.udemy.com/course/css-made-simple-for-beginners-learn-to-style-a-website-page/
web-development,Angular,Master Fullstack Web Development with Angular and C# ASP.NET,중급자,"19,000","₩23,000",12시간 주문형 동영상,"배울 내용
Master the C# web development framework ASP net for creating backend applications
Learn the ins and outs of Angular (v14) to master frontend development
Learn TypeScript development for Angular
Learn how to apply unit testing
Learn how to implement and query SQL databases
Develop comprehensive web applications that your employers and peers will love
Become a full-stack web developer in the ASP net and Angular stack
Learn how to build separate frontend and backend applications and how to connect them using the OpenAPI standard",영어,https://www.udemy.com/course/master-fullstack-web-development-with-angular-and-csharp-aspnet/
web-development,React JS,The Complete Web Development Tutorial Using React and Redux,중급자,"19,000","₩25,000",4시간 주문형 동영상,"배울 내용
Master concepts behind Redux, Reactq and JSX
Learn to build apps using React and redux
Understand the concepts behind state containers
Create full fledged project along with the course",영어,https://www.udemy.com/course/the-complete-web-development-tutorial-using-react-and-redux/
web-development,PHP,Develop Computer Based Test (CBT) and Chat App In PHP : 2022,모든 수준,"19,000","₩23,000",17.5시간 주문형 동영상,"배울 내용
Develop complete computer based test (CBT) in php
Have a new PHP Skill that would increase income
Learn to use CodeIgniter
Be able to build any web app you want using codeigniter
Build fully-fledged web apps for your startup or business
Work as a freelance codeigniter developer",영어,https://www.udemy.com/course/develop-computer-based-test-cbt-and-chat-app-in-php-2020/
web-development,SharePoint,Sharepoint 2013 Development,초급자,"20,000","₩25,000",26.5시간 주문형 동영상,"배울 내용
Learning SharePoint Server API
Customizing most widely used sections of the SharePoint (site collections,sites,lists, lists items, list queries, fields)
Using CAML Queries and LINQ to fetch data from SharePoint lists.
Understand features and executing custom code while features are activated and deactivating.
Write code for custom event handlers.
Building and deploying web parts.
Develop custom workflow solutions for SharePoint.
Using features and solutions for deploying projects in Microsoft SharePoint Server 2013.
더 보기",영어,https://www.udemy.com/course/sharepoint-2013-development/
web-development,Bootstrap,Bootstrap 5 From Scratch | Build 5 Modern Websites,모든 수준,"17,000","₩23,000",13.5시간 주문형 동영상,"배울 내용
Create 5 high quality websites from scratch
Create an enviroment boilerplate to compile Sass & customize Bootstrap
3 mini-project challenges
Learn & examine Bootstrap classes & utilities using sandbox files
Learn semantic HTML5 & CSS techniques",영어,https://www.udemy.com/course/bootstrap-from-scratch/
web-development,JavaScript,The Fastest Javascript Course: From ZERO to HERO in 6 Hours,초급자,"19,000","₩23,000",6시간 주문형 동영상,"배울 내용
Learn Javascript quickly and effictively from beginner to advanced
Learn through practice - complete our project from conception to completion
Understand the principles of Javascript: Data Types, Conditionals, Loops & Functions
Learn all the fundamentals of Javascript and the most useful methods
Finish the course with real-life Javascript skills",영어,https://www.udemy.com/course/javascript-flash-course-beginner-to-advanced/
web-development,Elm (programming language),Elm - The Complete Guide (a web development video tutorial),모든 수준,"59,000","₩69,000",21.5시간 주문형 동영상,"배울 내용
Build modern web apps using Elm
Create your own web site with a high quality long term foundation
Fix an old chaotic legacy web app moving to the solid Elm architecture
Learn all about Elm, including visual design, business rules modeling and browser integration using ports",영어,https://www.udemy.com/course/elm-the-complete-guide/
web-development,PHP,PHP Date and Time with Carbon by Edwin Diaz,모든 수준,"19,000","₩25,000",1.5시간 주문형 동영상,"배울 내용
At the end of the course students will be able to customize time in PHP
At the end of this course students will be able to implement custom time and date features to any PHP application
A the end of this course students will be able to create any time and date feature in PHP easily",영어,https://www.udemy.com/course/crash-course-learn-to-create-date-and-time-in-php-easily/
web-development,Django,Intro to Django Python Web Apps,초급자,"20,000","₩25,000",1시간 주문형 동영상,"배울 내용
Django Introduction
How to manage URLs
How to use static files
How to Build Static Web Sites
How to Build a Blog
How to use a Database
How to use the Django Users System",영어,https://www.udemy.com/course/intro-to-django-python-web-apps/
web-development,GraphQL,GraphQL from Scratch with MERN Stack,모든 수준,"19,000","₩23,000",19.5시간 주문형 동영상,"배울 내용
GraphQL from Scratch
Mastering GraphQL Queries Mutations and Subscriptions
Build FullStack GraphQL Project with MERN Stack
Apollo GraphQL Server with Node Express MongoDB
Apollo GraphQL Client with React and Firebase
Firebase Authentication (Client Side / Server Side)
Realtime GraphQL Subscriptions
CRUD (Create Read Update Delete) with MongoDB
Multiple Image Uploads
Authentication and Authorization
User Dashboard with Custom Layout
Private and Public Routing
더 보기",영어,https://www.udemy.com/course/graphql-mern-react-node-firebase/
web-development,SharePoint,SharePoint 2019 Development from Zero to Hero,모든 수준,"17,000","₩48,000",10.5시간 주문형 동영상,"배울 내용
SharePoint Installation
Server Side Object Model
Client Side Object Model
JavaScript Side Object Model
CAML Query & LINQ Query
Event Receiver
SharePoint List Template & List Instance
SharePoint Module
Client Side Rendering
Visual Web-part, Site page, Application page,
Delegate Control
SharePoint Custom Action
SharePoint Profile
Site Definition
SharePoint Business Connectivity Services
SharePoint External Type",영어,https://www.udemy.com/course/sharepoint-2019-development-from-zero-to-hero/
web-development,React JS,"Java Full stack Spring Boot and React (Inc JWT,Router,Redux)",모든 수준,"19,000","₩23,000",7.5시간 주문형 동영상,"배울 내용
Full Stack Development with React and Spring Boot
Redux State Management Application
React Router Dom Implementation on Example Cases
Json Web Token Example on Backend and Frontend",영어,https://www.udemy.com/course/java-full-stack-spring-boot-and-react-inc-jwtrouterredux/
web-development,Web Development,WebAssembly Beginner to Advanced,초급자,"17,000","₩25,000",3시간 주문형 동영상,"배울 내용
Learn what is WebAssembly and why it is useful
How you can use it to speed up your web applications
Compile C/C++ code to create Web Assembly (wasm) modules
Use the powerful Emscripten compiler for local compilations and more
Learn the low-level parts: memory and tables
Create advanced applications using the Emscripten glue code
Understand and use the WebAssembly Text Format (Wat)
Call C/C++ functions from JavaScript
Run JavaScript functions and expressions in C/C++
Debug the created WebAssembly modules",영어,https://www.udemy.com/course/webassembly/
web-development,Progressive Web App,React Progressive Web App With Workbox and Webpack Tutorial,초급자,"17,000","₩23,000",2시간 주문형 동영상,"배울 내용
Creating a custom React PWA with Webpack and Workbox.
React PWA with Workbox",영어,https://www.udemy.com/course/react-progressive-web-app-with-workbox-and-webpack-tutorial/
web-development,PHP,PHP Microframeworks with Slim,초급자,"19,000","₩25,000",2시간 주문형 동영상,"배울 내용
Build six projects using Slim microframework
Slim PHP microframework
Learn what microframeworks are and how to use them
Routing, dependency injection, error handling and middleware",영어,https://www.udemy.com/course/php-microframeworks-with-slim/
web-development,Webflow,Webflow For Beginners Part II: Progress Your Webflow Skills,초급자,"17,000","₩23,000",5.5시간 주문형 동영상,"배울 내용
Webflow
How to use Webflow
How to create a landing page in Webflow
How to create custom navigations in Webflow
How to use interactions in Webflow
How to create animations in Webflow
How to create mobile navigations in Webflow
How to create sections in Webflow
How to create hover effects in Webflow",영어,https://www.udemy.com/course/webflow-for-beginners-part-ii-progress-your-webflow-skills/
web-development,React JS,React.js - Let's build a Tic Tac Toe game.,중급자,"19,000","₩25,000",2시간 주문형 동영상,"배울 내용
How to build a Tic Tac Toe game
How to build a React application from using a HTML / CSS template
Proper way to structure components and state information in React
A way of reducing loops in your code by using hash maps in Javascript
How to use the useState React hook in a decently sized application",영어,https://www.udemy.com/course/reactjs-tic-tac-toe/
web-development,Tailwind CSS,Tailwind CSS 3 | Learn By Building Multiple Projects A-Z,초급자,"17,000","₩69,000",19.5시간 주문형 동영상,"배울 내용
Tailwind CSS 3.0
Install and configure the ideal environment for working with Tailwind CSS
How to customize Tailwind
Using Tailwind in VS Code
Deploying it to WebServer
Create Blog Project Template
Create Complete Ecommerce Template
Responsive Web Design
Ecommerce Home Page Setup
Ecommerce Shop Page Setup
Ecommerce Product Details Page Setup
Ecommerce Login and Register Page Setup
Ecommerce User Account and Register Page Setup
Ecommerce Profile Address Page Setup
더 보기",영어,https://www.udemy.com/course/tailwind-css-build-multiple-projects/
web-development,PHP,"PHP Registration Form, Email Verification & Responsive Email",모든 수준,"19,000","₩25,000",13시간 주문형 동영상,"배울 내용
Modern UI Layout
Object oriented programming
PHP Custom Libraries
Responsive Email Template
Email Confirmation
Forgot Password
Complete Registration Form with Dashboard Settings",영어,https://www.udemy.com/course/php-registration-form-email-confirmation-responsive-email/
web-development,WordPress,Advanced WordPress & Elementor 2023 | Build Dynamic Websites,중급자,"17,000","₩23,000",9.5시간 주문형 동영상,"배울 내용
Learn how to create visually stunning and fully responsive websites using advanced Elementor features and elements
Master Elementor's new ""flexbox containers"" feature to design more sophisticated and dynamic layouts and visually engaging content
Take your development skills to the next level using Custom Post Types, custom taxonomies and custom fields for complete, granular control & functionality
Learn to build ANY website using Elementor Pro's theme builder, template files and dynamic content
Master how to loop through your custom post types and custom fields throughout your webpages using the new ""Loop Grid"" and ""Loop Carousel"" elements in Elementor
Build Mega Menus using Elementor Pro for beautiful, easy-to-navigate website headers and menus
더 보기",영어,https://www.udemy.com/course/advanced-wordpress-elementor-mastery/
web-development,Paypal,"PayPal Payment Integration with PHP, Laravel and Symfony",모든 수준,"19,000","₩69,000",8시간 주문형 동영상,"배울 내용
You will learn the latest and the best rest-api based technique for online payments from PayPal - Checkout service
You will be able to implement PayPal Webhooks to manage automatic transaction notifications
You will be able to implement PayPal payments on your own websites
You will build from scratch object oriented MVC-based simple shopping cart application in pure PHP, Laravel and Symfony
You will build from scratch object oriented MVC-based simple video subscription application in pure PHP, Laravel and Symfony
You will deploy the applications to Heroku live server to test real PayPal transaction notifications",영어,https://www.udemy.com/course/paypal-payment-integration-with-php-laravel-and-symfony/
web-development,Windows Presentation Foundation,Deep dive into Windows Presentation Foundation(WPF),초급자,"17,000","₩59,000",15.5시간 주문형 동영상,"배울 내용
Understand about the Features of WPF, Types of WPF Application and WPF Architecture.
Understand about the XAML Advantages, Features and Role Of XAML In Building RICH Windows Applications.
Understand the sophisticated GUI using WPF Controls, Menu and Status Bar.
Understand Event Handling and Custom Commands.
Understand about the Look and Feel using Custom styles.
Understand about the types of brushes, Static & Dynamic resources and Scope of Resources.
Reuse UI using User Control.
Explore WPF Data Binding Controls and interacting with data.
Understand about the fixed and flow documents.
Managing animations and media.",영어,https://www.udemy.com/course/windows-presentation-foundation/
web-development,Blogging,Blogging for Beginners with WordPress,모든 수준,"19,000","₩25,000",1.5시간 주문형 동영상,"배울 내용
Develop the confidence you can be a blogger, as long as you have something to say
Create a blog online (using WordPress)
Create new posts for your brand spanking new blog
Add photos and videos to your blog
Manage Comments on your blog, because hey this will be huge, right?
Add new WordPress plugins to your blog to extend what it can do
Change the look of your blog (with different WordPress themes)",영어,https://www.udemy.com/course/blogging-for-beginners-with-wordpress/
web-development,Django,Django 2.0 from Zero to Hero and Deploy on Heroku and Amazon,중급자,"19,000","₩25,000",6시간 주문형 동영상,"배울 내용
Preparing your environment installing Python, Django and Pycharm
Understanding the main Django concepts
Creating the Project and Django app
The Django request life cycle
How to handle static and media files
Creating a Full Django CRUD
Security: Enabling Django login system
Database relationships
Preparing the project to deploy on Heroku
Integrating the project with Bootstrap for better looking
Using Amazon S3 as a storage for static and media files",영어,https://www.udemy.com/course/django-2x-deploying-heroku/
web-development,CSS,HTML and CSS for Beginners - Web Design & Development,모든 수준,"19,000","₩25,000",4시간 주문형 동영상,"배울 내용
you will be able to make websites
you will be able to work with html and css
you will be able to work with javascript
you will be able to create responsive web designs
you will be a pro front- end web developer
you will be hire-able as a front end web developer",영어,https://www.udemy.com/course/html-and-css-for-beginners-web-design-development/
