대분류,소분류,강의명,난이도,가격(현재가격),가격(원래가격),총소요시간,강의소개,언어,출처
data-science,Google Flutter,OpenAI | Dall E | Chat GPT | Make Flutter Siri & Alexa Clone,모든 수준,"17,000",49000,2.5시간 주문형 동영상,"배울 내용
AI Draw Images according to your Imaginations using OpenAI Chat GPT & OpenAI Dale-E
Smart & Intelligent Virtual Assistant using OpenAI
OpenAI Chat GPT
OpenAI DaleE
Text to Speech Converter
Speech to Text Converter
Siri Clone
Alexa Clone
Learn & Build a Smart Chatbot
Learn & Build a smart AI System that draw images according to your imaginations
Learn & Build How to create Advanced Artificial Intelligence Systems
Learn & Build Android & iOS Based AI Applications from Single Code Base using Flutter
더 보기",영어,https://www.udemy.com/course/openai-dall-e-chat-gpt-make-flutter-siri-alexa-clone/
data-science,Natural Language Processing,Natural Language Processing [ Building Real World Projects],초급자,"19,000",25000,4시간 주문형 동영상,"배울 내용
Natural Language Processing [NLP]
Setting up the Environment for NLP
Tokenization
Downloading and Setting up NLTK
Normalization
Part of Speech Tagging
Stopwords
Named Entity Recognition
Classification
Preprocessing
Naive Bayes Classifier
Real World Applications of Natural Language Processing [COMPLETE PROJECT]
Python Programming basics for Natural Language Processing
더 보기",영어,https://www.udemy.com/course/natural-language-processing-building-real-world-projects/
data-science,Probability,Probability and Statistics: Complete Course 2023,모든 수준,"17,000",23000,16.5시간 주문형 동영상,"배울 내용
Descriptive Statistics
Visualizing Data
Probability Theory
Bayesian Statistics
Discrete Distributions (Binomial, Poisson and More)
Continuous Distributions (Normal and Others)
Hypothesis Tests
Regression
Type I and Type II Errors
Chi-Squared Test",영어,https://www.udemy.com/course/probability-and-statistics-complete-course/
data-science,ChatGPT,AI Chatbots Development Exploring Generative AI with ChatGPT,모든 수준,"17,000",23000,30분 주문형 동영상,"배울 내용
Understand the fundamentals of APIs and their role in chatbot development.
Master the usage of Postman for API testing and integration.
Build interactive chatbots using HTML, JavaScript, and CSS.
Configure chatbot behavior and personalize responses.
Deploy chatbots on live servers and make them accessible online.",영어,https://www.udemy.com/course/building-chatbots-with-openai-gpt-model-from-concept-to-deployment/
data-science,LangChain,LangChain 101 for Beginners (OpenAI / ChatGPT / LLMOps),모든 수준,"17,000",23000,1시간 주문형 동영상,"배울 내용
Master the basics of LangChain and the fundamentals of Large Language Models (LLMs) from industry leaders such as OpenAI and HuggingFace.
Gain proficiency in creating, calling, and chaining prompts for effective and interactive applications.
Develop an understanding of conversational chatbots within LangChain, along with exploring memory functionalities for sophisticated responses.
Learn to apply LLM techniques to personal documents and projects, paving the way for real-world application of course knowledge.",영어,https://www.udemy.com/course/langchain-python/
data-science,Data Science,Quant Finance Essentials,모든 수준,"19,000",25000,2.5시간 주문형 동영상,"배울 내용
Use this code at Checkout & get: a) free advertisement in our newsletter for 30 days b) our UK careers course for free. Send a pm: 6F08BC358DB89C326237
Suggestion: Buy this course at www [dot] greenenergyalgorithms [dot] com for 10 GBP and get: lifetime code updates + this course free on udemy + 2 certificates
The Code is UPDATED EVERY 6 months! Visit every 6 months and DOWNLOAD the updated code!
The coding practices are focused on Matlab and on C++ (check promo video for all info )
Understand what Stochastic Optimization is, and specifically what scenarios are and what is ""uncertainty"" and sources of uncertainty.
Understand the different levels of Uncertainty
Implement Monte Carlo Simulations
Model the histograms of different distributions",영어,https://www.udemy.com/course/uncertaintymc/
data-science,Python,Data Science code that appears all the time at workplace,모든 수준,"17,000",59000,13시간 주문형 동영상,"배울 내용
Use this code at Checkout & get: a) free advertisement in our newsletter for 30 days b) our UK careers course for free. Send a pm: E0CBB000F7D2E348518B
Suggestion: Buy this course at www [dot] greenenergyalgorithms [dot] com for 10 GBP and get: lifetime code updates + this course free on udemy + 2 certificates
The Code is UPDATED EVERY 6 months! Visit every 6 months and DOWNLOAD the updated code!
In practice, 1% of Python is used 99% of the time. This course focuses on this 1%
Great for Quants/ Economists, Data Scientists/ Software Engineers: the skills shown here, come up all the time
This is your Help Resource when you are under heavy pressure! You open this course and search for a keyword/command you want. And you will watch the video
You will not need to google-search to find answers all the time. Just have this course open in one tab of your browser so that any time you search in it!",영어,https://www.udemy.com/course/bitesize_python/
data-science,Python,Python Projects: Python & Data Science with Python Projects,모든 수준,"17,000",23000,12.5시간 주문형 동영상,"배울 내용
If you are new to Python, data science or have no idea about what data scientist does no problem, you will learn anything you need to start to Python data scien
If you are a software developer or familiar to other programming language and you want to start a new world, you are also in the right place.
You will encounter many businesses that use Python and its libraries for data science.
In this course you need no previous Knowledge about Python, Pandas or data science.
In this course you need no previous Knowledge about Python, Pandas or data science.
Almost all companies working on machine learning and data science use Python’s Pandas library
Thanks to the large libraries provided, the number of companies and enterprises using python is increasing day by day
Python is the most popular programming language for data science process in recent yeThe world we are in is experiencing the age of informatics.
더 보기",영어,https://www.udemy.com/course/python-projects-python-data-science-with-python-projects/
data-science,Statistics,Modeling Count Data using Stata,초급자,"25,000",,3시간 주문형 동영상,"배울 내용
Understand count tables
Calculate incidence-rate ratios
Understand what count models are
Identify when to use count models
Poisson regression
Negative binomial regression
Truncated models
Zero-inflated models
Predict expected number of outcomes
Apply count models using Stata
Compare different models
Visualise the results",영어,https://www.udemy.com/course/modeling-count-data-using-stata/
data-science,Prompt Engineering,Complete ChatGPT & Bing Prompt Engineering Masterclass 2023,모든 수준,"23,000",,1.5시간 주문형 동영상,"배울 내용
You will understand ChatGPT and Bing Chat Prompt Engineering from basics to advanced concepts and applications.
How to quickly generate images with Bing Chat using the 3-elements technique.
The basics of AI, machine learning, deep learning and NLP.
How to train ChatGPT and Bing Chat to improve the output
How to use ChatGPT and Bing Chat for brainstorming and creating presentations.
How to generate stories and novels in ChatGPT using a template.
How to use ChatGPT and Bing Chat for summarizing texts.
How to use ChatGPT and Bing Chat for solving complex problems.
How to use ChatGPT and Bing Chat for extracting content.
Understand chain of thought prompting and it's application.
더 보기",영어,https://www.udemy.com/course/chatgpt-bing-chat-prompt-engineering-2023-marterclass-course/
data-science,SQL,Learn SQL databases in a weekend,초급자,"17,000",23000,8.5시간 주문형 동영상,"배울 내용
Understand what SQL databases are and how to work with them
Be able to jump in a project requiring SQL knowledge
Create your own SQL database with multiple tables
Write simple SQL queries to fetch the data you need
Have a stable basis for further exploration of more advanced SQL topics
Find community help and documentation for SQL
Use SQL databases in Python, Java and other programming languages",영어,https://www.udemy.com/course/learn-sql-databases-in-a-weekend/
data-science,Generative Adversarial Networks (GAN),High Resolution Generative Adversarial Networks (GANs),중급자,"17,000",37000,7.5시간 주문형 동영상,"배울 내용
Create a GAN capable of generating high resolution images using TensorFlow 2.0
Distribute training on a TPU or multiple GPUS
Implement the R2 loss function
Implement a scaled convolutional layer
Implement up-sampling and down-sampling layers
Implement mini-batch standard deviation to capture dataset variation
Generate infinite random images from a trained generator
Apply a perceptual path length filter to generated images
Generate interpolations between two different generated images",영어,https://www.udemy.com/course/high-resolution-generative-adversarial-networks/
data-science,TensorFlow,"TensorFlow Hub: Deep Learning, Computer Vision and NLP",초급자,"17,000",39000,7시간 주문형 동영상,"배울 내용
Use pre-trained TensorFlow models to solve Computer Vision and Natural Language Processing problems
Classify images of flowers using Convolutional Neural Networks
Detect over 80 different objects in images
Apply style transfer to images
Build a GAN to complete the missing parts of images
Recognize actions in videos
Classify sentiments in texts
Use information retrieval techniques to return similar documents
Classify over 500 audio events",영어,https://www.udemy.com/course/tensorflow-hub-deep-learning-computer-vision-nlp/
data-science,Regression Analysis,SPSS Linear Regression Complete Tutorial with PhD Professor,모든 수준,"19,000",25000,11시간 주문형 동영상,"배울 내용
SPSS Linear Regression for Business or Dissertation
Visualizing Linear Regression Results
Advanced topics like interactions and categorical predictors
Dealing with data, distribution, and missing data problems
Deep understanding of the process and meaning of the results",영어,https://www.udemy.com/course/statsfriend-spss-linear-regression-complete-walkthrough/
data-science,Neural Networks,Neural Radiance Fields (NeRF),초급자,"29,000",,10시간 주문형 동영상,"배울 내용
Introduction to reconstruction
Introduction to 3D reconstruction
Introduction to Neural Radiance Fields (NeRF)
Novel view synthesis with NeRF
3D reconstruction with NeRF (mesh extraction)
Introduction to 3D rendering",영어,https://www.udemy.com/course/neural-radiance-fields-nerf/
data-science,Apache Spark,Spark SQL & Hadoop (For Data Science),중급자,"17,000",23000,5.5시간 주문형 동영상,"배울 내용
Students will get hands-on experience working in a Spark Hadoop environment that’s free and downloadable as part of this course.
Students will have opportunities solve Data Engineering and Data Analysis Problems using Spark on a Hadoop cluster in the sandbox environment that comes as part
Issuing HDFS commands.
Converting a set of data values in a given format stored in HDFS into new data values or a new data format and writing them into HDFS.
Loading data from HDFS for use in Spark applications & writing the results back into HDFS using Spark.
Reading and writing files in a variety of file formats.
더 보기",영어,https://www.udemy.com/course/spark-sql-hadoop-for-data-scientists-big-data-analysts/
data-science,Data Analysis,Mining and Analyzing LinkedIn Data,모든 수준,"17,000",23000,6.5시간 주문형 동영상,"배울 내용
Extract data from your LinkedIn profile using the LinkedIn API and .csv files
Extract and analyze the connections between users, invitations, and text messages
Generate fake usernames to mask real information
Explore and view data related to your contacts' companies and job titles
Use edit Levenshtein distance, n-gram similarity and Jaccard distance to measure similarity between strings
Cluster contacts based on similarity between positions, as well as generate HTML views to improve data presentation
Use location APIs to extract latitude and longitude of contacts, in order to capture the city and country of lives
View the location of contacts dynamically with Google Earth and the Basemap library
더 보기",영어,https://www.udemy.com/course/mining-and-analyzing-linkedin-data/
data-science,Optimization Problem,Optimization Algorithm for Electricity Demand Using Storage,모든 수준,"17,000",23000,4시간 주문형 동영상,"배울 내용
Use this code at Checkout & get: a) free advertisement in our newsletter for 30 days b) our UK careers course for free. Send a pm: E862387445113FCE8525
Suggestion: Buy this course at www [dot] greenenergyalgorithms [dot] com for 10 GBP and get: lifetime code updates + this course free on udemy + 2 certificates
We build an Optimization Model that uses Energy Storage to reduce the peak demand as much as possible
We conduct an extensive sensitivity analysis. We run more than 100 cases and observe the Storage Operation in detail.
You can download all the code and all the data and slides used in the study
Energy Storage can be a career path. Simply search on google and find how important this technology is for the energy sector!
The code is updated regularly. Come back here every 6 months and download the updated code/ slides and watch the updated videos!",영어,https://www.udemy.com/course/optimization-for-load-reduction-with-storage/
data-science,Data Analysis,"Data Science Hands On (PowerBI, SQL, Tableau, Spark, Python)",초급자,"17,000",23000,8시간 주문형 동영상,"배울 내용
Master PowerBI & Tableau to build interactive dashboards that effectively communicate data-driven insights.
Develop a solid understanding of SQL, the bedrock of data manipulation and querying, enabling you to analyze complex datasets with ease.
Dive into Apache Spark's distributed computing system to process and analyze large-scale data, and construct efficient data pipelines.
Get hands-on with Python, learning to load, clean, analyze, & visualize data using Jupyter Notebooks, a tool cherished by data science professionals worldwide.
Apply your skills to real-world projects, reinforcing your understanding and preparing you to tackle data science challenges in your career or future studies.",영어,https://www.udemy.com/course/data-science-hands-on/
data-science,OpenCV,OpenCV with Python (Computer Vision),초급자,"17,000",59000,4시간 주문형 동영상,"배울 내용
Images, Video read in Python using OpenCV.
Resizing, Cropping of images and videos in Python using OpenCV.
Draw shapes on images such as circle, rectangle, ellipse, line.
Adding text message on images.
Hide a portion of images using XOR, NOT and AND operation.
Image manipulation such as smoothing, blurring.
Read different type of images with (single channel, 3 channel, 4 channel images).
Image splitting
Saving Images and Videos files using OpenCV on our PC.
Color conversation of images (BGR to gray), (BGR to RGB).
더 보기",영어,https://www.udemy.com/course/computer-vision-course-on-opencv/
data-science,Natural Language Processing,Practical Natural Language Processing - Go from Zero to Hero,모든 수준,"17,000",23000,21시간 주문형 동영상,"배울 내용
Text Preprocessing using NLTK and Spacy
How to work on NLP pipeline
Perform Tokenization
Stemming & Lemmatization
Apply Word Embeddings
NLP Pipeline for various tasks
Named Entity Recognition
Text Summarization
Building an Enterprise Grade Chatbot with Dialogflow
Building a project on Twitter Tweets
Build Chatbot with RASA with Advanced Integration
Deep Learning for Sequence Data
Transformer NLP Architecture
ChatGPT
더 보기",영어,https://www.udemy.com/course/practical-natural-language-processing-go-from-zero-to-hero/
data-science,Natural Language Processing,Natural Language Processing Introduction in Python,초급자,"17,000",79000,15시간 주문형 동영상,"배울 내용
Dealing with Strings in Python
Working with the Natural Language Toolkit Library
Understanding the Intuition behind Word Vectors
Pre-Processing Text for Analytics
Understanding Text Vectorization
Train a Neural Network to generate Word Embeddings
Obtain Text Data from Web Pages
Read Files with Textual Data
Developing a Sentiment Analysis Tool
Train a Machine Learning Model",영어,https://www.udemy.com/course/nlp_natural_language_processing_python_beginners/
data-science,Apache Spark,Apache Spark with Scala useful for Databricks Certification,모든 수준,"19,000",25000,5.5시간 주문형 동영상,"배울 내용
Apache Spark ( Spark Core, Spark SQL, Spark RDD and Spark DataFrame)
Databricks Certification syllabus included in the Course
An overview of the architecture of Apache Spark.
Work with Apache Spark's primary abstraction, resilient distributed datasets(RDDs) to process and analyze large data sets.
Develop Apache Spark 3.0 applications using RDD transformations and actions and Spark SQL.
Analyze structured and semi-structured data using Datasets and DataFrames, and develop a thorough understanding about Spark SQL.",영어,https://www.udemy.com/course/apache-spark-with-scala-useful-for-databricks-certification/
data-science,Data Science,Data Science Statistics A-Z : Python,모든 수준,"25,000",,14시간 주문형 동영상,"배울 내용
Master Data Science on Python
Learn to use Numpy and Pandas for Data Analysis
Learn All the Mathematics Required to understand Machine Learning Algorithms
Real World Case Studies
Learn to use MatplotLib for Python Plotting
Learn to use Seaborn for Statistical Plots
Learning End to End Data Science Solutions
Learn All Statistical concepts To Make You Ninza in Machine Learning
2 Real time time project with detailed explaination",영어,https://www.udemy.com/course/data-science-statistics-python/
data-science,Data Science,Be Aware of Data Science,초급자,"23,000",,6시간 주문형 동영상,"배울 내용
Learn how data science turns data into valuable information.
Understand what cognitive biases are and how data science helps us fight them.
Know what spurious correlation is and how we can avoid it.
Learn how to conduct a data-driven business experiment that verifies whether a change creates a positive impact.
Realize how Big Data brings unpurposed data collections and how we need to address these.
Make decisions about which of the four essential data science approaches to utilize.
Discover who data scientists are and what it would take for you to become one.
Recognize how Data Science creates scientific models through experimentation and observation.
더 보기",영어,https://www.udemy.com/course/be-aware-of-data-science/
data-science,Natural Language Processing,Natural Language Processing with Machine Learning in Python,초급자,"25,000",,5.5시간 주문형 동영상,"배울 내용
Fundamentals of Natural Language Processing
Tokenization, Stemming and Lemmatization
Named Entity Recognition and Part of Speech Tagging
Count Vectorzation and TF-IDF Vectorization
Improving performance with N-grams
How to use NLTK, SpaCy and Scikit-Learn to solve NLP Problems
Data Cleansing and Text Pre-Processing
Sentiment Analysis using Machine Learning in Python
Text Classification using Machine Learning in Python
Integrating with Twitter APIs",영어,https://www.udemy.com/course/natural-language-processing-with-machine-learning-in-python/
data-science,Data Science,Quantifying Energy Investments using Data Science,모든 수준,"17,000",23000,5.5시간 주문형 동영상,"배울 내용
Use this code at Checkout & get: a) free advertisement in our newsletter for 30 days b) our UK careers course for free. Send a pm: 77495A0C987830B7DA55
Suggestion: Buy this course at www [dot] greenenergyalgorithms [dot] com for 10 GBP and get: lifetime code updates + this course free on udemy + 2 certificates
The Code is UPDATED EVERY 6 months! Visit every 6 months and DOWNLOAD the updated code!
Learn about Flexibility, Drivers for Energy Investments
Learn about Investment combinations for Offshore wind farms
How the investment cost reduces with the investment amount
CAPEX calculation, Fixed, Variable and per-unit costs
Discount Factors and cumulative discounting",영어,https://www.udemy.com/course/data_for_energy_markets/
data-science,Deep Learning,"Deep Learning: masked face detection, recognition",전문가,"129,000",,12시간 주문형 동영상,"배울 내용
How to install Python, Tensorflow, Pycharm from scratch
How to create your own classification model
What's FaceNet
What's the difference between classification models and face recognition models
How to create your own FaceNet model by modifying the classification model
How to do the face alignment using SSD face detection
How to do the face alignment using MTCNN face detection
How to do the data cleaning
How to create masked face dataset
How to train your FaceNet model
What are training skills
How to implement training skills to train models effectively
더 보기",영어,https://www.udemy.com/course/ai-deep-learning-facial-masked-face-detection-recognition/
data-science,Data Science,Big Data in Economics / Energy,모든 수준,"17,000",69000,6.5시간 주문형 동영상,"배울 내용
Use this code at Checkout & get: a) free advertisement in our newsletter for 30 days b) our UK careers course for free. Send a pm: 0F26689B7609CF06313D
Suggestion: Buy this course at www [dot] greenenergyalgorithms [dot] com for 10 GBP and get: lifetime code updates + this course free on udemy + 2 certificates
The Code is UPDATED EVERY 6 months! Visit every 6 months and DOWNLOAD the updated code!
Big Data Methodology - Maximize Data Reduction & Minimize Loss of information. Application: Electricity demand
Step-by-step: MATLAB, Excel, Python
Creating a dummy Big Dataset
Methodologies for comparing Big Data
Summarizing Big Datasets
Selecting fewer observations with set frequencies
From Small Datasets to Big Data
더 보기",영어,https://www.udemy.com/course/data-engineering-for-electrical-energy-systems/
data-science,Data Visualization,Data Visualization in Python for Beginners,초급자,"17,000",23000,1.5시간 주문형 동영상,"배울 내용
Work with fundamental Data Science libraries to form different kinds of datasets
Master Matplotlib fundamentals and various standard graphs
Learn how to visualize data using Python and Matplotlib in a clear and concise manner
Use real-life applicable datasets to expand your learning
Understand and work with the connection between various data science/visualization libraries
Expand on your knowledge of Python 3 fundamentals",영어,https://www.udemy.com/course/python-data-vis/
data-science,Reinforcement Learning,Advanced Reinforcement Learning in Python: cutting-edge DQNs,모든 수준,"17,000",69000,8.5시간 주문형 동영상,"배울 내용
Master some of the most advanced Reinforcement Learning algorithms.
Learn how to create AIs that can act in a complex environment to achieve their goals.
Create from scratch advanced Reinforcement Learning agents using Python's most popular tools (PyTorch Lightning, OpenAI gym, Optuna)
Learn how to perform hyperparameter tuning (Choosing the best experimental conditions for our AI to learn)
Fundamentally understand the learning process for each algorithm.
Debug and extend the algorithms presented.
Understand and implement new algorithms from research papers.",영어,https://www.udemy.com/course/advanced-deep-qnetworks/
data-science,Math,College Level Neural Nets [I] - Basic Nets: Math & Practice!,모든 수준,"19,000",69000,13.5시간 주문형 동영상,"배울 내용
Step By Step Conceptual Introduction For Neural Networks And Deep Learning [Even If You Are A Beginner]
Understanding The Basic Perceptron[Neuron] Conceptually, Graphically, And Mathematically - Perceptron Convergence Theorem Proof
Mathematical Derivations For Deep Learning Modules
Step-By-Step Derivation Of BackPropagation Algorithm
Vectorization Of BackPropagation
Different Performance Metrics Like Performance - Recall - F1 Score - ROC & AUC
Mathematical Derivation Of Cross-Entropy Cost Function
Mathematical Derivation Of Back-Propagation Through Batch-Normalization
Different Solved Examples On Various Topics",영어,https://www.udemy.com/course/deep-learning-neural-nets-with-math-derivations-part-1/
data-science,Data Science,2023 Advanced Machine Learning and Deep Learning Projects,모든 수준,"17,000",39000,5.5시간 주문형 동영상,"배울 내용
Advanced NLP for Data Scientists
Advanced Image Processing
Text Data Processing
Text and Image Data Embeddings into the Same Vector Space
Implement Image Search like Google's Image Search
Cluster Text and Image Data",영어,https://www.udemy.com/course/advanced-natural-language-and-image-processing-projects/
data-science,ChatGPT,"ChatGPT Mega Course: Midjourney, Adobe Firefly AI, ChatGPT 4",모든 수준,"17,000",23000,13시간 주문형 동영상,"배울 내용
Master how to use AI tools like ChatGPT, Midjourney, and Adobe Firefly.
Able to create engaging content using ChatGPT
Able to create websites or basic applications with no programming knowledge
Becoming a master generating stunning images with Midjourney
Able to design with AI using Adobe Firefly
10x your productivity and complete advanced tasks in short periods
Become a learning machine using advanced ChatGPT strategies
Able to create cool projects using ChatGPT API",영어,https://www.udemy.com/course/chatgpt-mega-course-midjourney-adobe-firefly-ai-chatgpt-4-generative/
