대분류,소분류,강의명,난이도,가격(현재가격),가격(원래가격),총소요시간,강의소개,언어,출처
software-testing,REST Assured,REST Assured Java Framework | Step by Step for Beginners,모든 수준,무료,,온디맨드 동영상 1시간 41분,"REST assured from scratch
By the end of this course you will be able to create a complete REST assured API Testing framework in java
Complete knowledge on how to add and run API requests in your framework
How to do API XML and JSON response validation with REST Assured
How to Add project to Git, Commit, Push and Clone projects
Complete step-by-step hands-on knowledge with demo and examples",영어,https://www.udemy.com/course/rest-assured-java-framework-step-by-step-for-beginners/
software-testing,Selenium Testing Framework,Selenium for Beginners using Java step by step,중급자,무료,,온디맨드 동영상 3시간 43분,"An easy to understand and Learn Selenium from Scratch
Using Java with Selenium
Build selenium tests with chrome driver and Selenium",영어,https://www.udemy.com/course/selenium-using-java-for-automation-test-development/
software-testing,Software Testing,Mocking application with Moq,중급자,무료,,온디맨드 동영상 1시간 9분,"Understand what Mocking framework is all about
How to work with Moq
How to abstract the real implementation with Mock implementation
How to apply Moq framework in development and Testing",영어,https://www.udemy.com/course/moq-framework/
software-testing,Software Testing,Become Software Tester - A Complete Learning path to be a QA,초급자,무료,,온디맨드 동영상 1시간 17분,"Basic of Software Testing
What are the Scope of Software testing
How to Start career in Software testing
What to learn to become a Software Tester
Understand Software Testing field with Live demo
This course will give you high level Overview & Learning About Testing field.",영어,https://www.udemy.com/course/become-software-tester/
software-testing,Nightwatch.js,Nightwatch.js Quick Start Guide,초급자,무료,,온디맨드 동영상 57분,"Web automation with Nightwatch
web page testing
test automation for the web",영어,https://www.udemy.com/course/nightwatch-quick-start-guide/
software-testing,Java,AssertJ: Fluent Assertion In Test Automation,모든 수준,무료,,온디맨드 동영상 1시간 6분,"Basics of AssertJ
Writing Fluent Assertions For Selenium Automation Tests
Extend Assertions For Page Objects
Extend Assertions For WebElements",영어,https://www.udemy.com/course/assertj-fluent-assertion-in-test-automation/
software-testing,JMeter,JMeter 2021 | Short Course | Step by Step for Beginners,모든 수준,무료,,온디맨드 동영상 2시간,"JMeter Step by Step from scratch
How to use JMeter for projects
Basics and Features
Complete overview with hands-on practice and demo",영어,https://www.udemy.com/course/jmeter-2021-short-course-step-by-step-for-beginners/
software-testing,Automation Testing,Getting Started With TestProject,초급자,무료,,온디맨드 동영상 47분,Students in the course will learn how to use the powerful test automation tool TestProject,영어,https://www.udemy.com/course/getting-started-with-testproject/
software-testing,Automation Testing,Creating and working with automation test report using EARS,중급자,무료,,온디맨드 동영상 3시간 11분,"Understand how to build test automation reporting portal
Understand how to work with building web services
Understand building test harness system with powershell
Understand building extendability in code",영어,https://www.udemy.com/course/creating-automation-reports-with-ears/
software-testing,API Testing,Intro to Manual and Automated API testing with Postman,모든 수준,무료,,온디맨드 동영상 1시간 52분,"Detailed understanding of REST, REST architectural constraints, client-server architecture and HTTP request-response pair
Basic knowledge about RESTful APIs and JSON
Introduction to the manual API testing
Introduction to the Postman Automated API Testing",영어,https://www.udemy.com/course/introduction-to-api-testing-for-beginners/
software-testing,Resume and CV Writing,Fix an average SDET resume to be shortlisted+ Interview tips,모든 수준,무료,,온디맨드 동영상 1시간 2분,"Preparing a Credible Resume
Tips to get Resume shortlisted
SDET Interview process
Interview advice",영어,https://www.udemy.com/course/sdet-resume-and-interview-tips/
software-testing,Automation Testing,Cucumber & Java & Selenium automation framework - JASECU,초급자,무료,,온디맨드 동영상 1시간 59분,Setup of Jasecu UI & API automation testing framework from zero also for absolute beginners,영어,https://www.udemy.com/course/jasecu-ui-api-automation-framewok/
software-testing,Software Testing,Intro to the Manual Software Testing Interview (Q&A for QA),모든 수준,무료,,온디맨드 동영상 1시간 58분,"Answers to the Top 10 Software Testing Theory Interview questions
Each answer includes real-life practical example, which helps to better understand the theory
Each answer includes a video for those who prefer visual content
Each answer includes an article for those who to read and analyze thoughtfully",영어,https://www.udemy.com/course/intro-to-the-manual-software-testing-interview-qa-for-qa/
software-testing,Automation Testing,Sauce Labs Masterclass: Advanced Test Automation,전문가,무료,,온디맨드 동영상 1시간 57분,"How to sign up for a free trial of Sauce Labs
How to run data driven cross-browser test automation in Sauce Labs
How to execute test automation in parallel using NUnit
Advantages and disadvantages of running tests on Sauce Labs
Manual cross-browser testing
How to run your Selenium tests on the Sauce Labs cloud
How to configure custom Sauce Labs capabilities
How to set Sauce Labs timeouts
How to set test names
Sauce Labs Analytics",영어,https://www.udemy.com/course/sauce-labs/
software-testing,Automation Testing,Using UFT Developer for WPF Desktop Apps (Basic Course),초급자,무료,,온디맨드 동영상 1시간 44분,"UI Testautomation with UFT Developer
Building Basic Test Scripts
Working with Object Identification Center
Working with Application Models
Using Reporter Object
Define Custom Checkpoints
Use Visual Relation Identifiers
Parametrization and Data Driven Testing
Build Reusable Functions",영어,https://www.udemy.com/course/using-uft-developer-for-wpf-desktop-apps-basic-course/
software-testing,Software Development,ALM Octane - The Basics for Developers,초급자,무료,,온디맨드 동영상 1시간 59분,"ALM Octane Developer Access Overview
IDE Integration - Access Octane artifacts from your IDE
CI Integration - Get build insights from your pipeline
Integration of Selenium Tests as part of the pipeline
Define parameter sets for your pipeline",영어,https://www.udemy.com/course/alm-octane-the-basics-for-developers/
software-testing,Automation Testing,Using UFT Developer for Web Apps (Visual Studio and Csharp),초급자,무료,,온디맨드 동영상 1시간 59분,"UI Testautomation with UFT Developer
Building Basic Test Scripts
Working with Object Identification Center
Working with Application Models
Using Reporter Object
Define Custom Checkpoints
Screen Recording
Parametrization
Data Driven Testing
Reusable Functions",영어,https://www.udemy.com/course/using-uft-developer-for-web-apps-visual-studio-and-csharp/
software-testing,Cypress.io,Cypress 10 Component Testing Tutorial,중급자,무료,,온디맨드 동영상 30분,"How to Install Cypress 10
Set Up & Mounting A Component
Code a component test
Implement A Test Spy
Benefits of using component test",영어,https://www.udemy.com/course/cypress-10-component-testing-tutorial/
software-testing,Selenium WebDriver,"Selenium with Headless Chrome Browser, HTMLUnit & PhantomJs",초급자,무료,,온디맨드 동영상 55분,"Selenium Headless Browser Testing
Integration of Powerful PhantomJs headless browser and it's features
Integration of headless Chrome browser
Integration of HtmlUnitDriver",영어,https://www.udemy.com/course/selenium-with-headless-chrome-browser-htmlunit-phantomjs/
software-testing,Selenium WebDriver,Selenium 4.0 Observability,중급자,무료,,온디맨드 동영상 1시간 29분,"Observability
Selenium
Selenium Webdriver
Observability with Selenium",영어,https://www.udemy.com/course/selenium4observability/
software-testing,Selenium Testing Framework,Selenium Automation in Excel,모든 수준,무료,,온디맨드 동영상 1시간 1분,"Learn how to install Selenium
Learn Selenium framework in Excel.
Learn how to automate sending emails, inserting data, copying data and saving it in Excel
Send emails with Attachments",영어,https://www.udemy.com/course/selenium-automation-in-excel/
software-testing,JUnit,Testes Unit?rios em Java Utilizando o JUnit,모든 수준,무료,,온디맨드 동영상 1시간 54분,"Dominar os fundamentos do teste automático de software
Aprenderá a utilizar o JUnit para construir testes automáticos, porém, poderá utilizar qualquer outra ferramenta no lugar do JUnit (ver explicação na descrição do curso)
[Bônus 01] 1h de consultoria/coaching particular com Gustavo Farias com 50% de desconto",포르투갈어,https://www.udemy.com/course/testes-unidade-automaticos-software-junit/
software-testing,Java,Test Driven Development con Java y Junit5,초급자,무료,,온디맨드 동영상 1시간 4분,Entender qué quiere decir TDD y empezar a diseñar software con esta técnica.,스페인어,https://www.udemy.com/course/testdrivendevelopment/
software-testing,Automation Testing,Introdu??o aos testes automatizados,모든 수준,무료,,온디맨드 동영상 1시간 42분,Aprenda conceitos de automação de testes em diferentes camadas da aplicação para o desenvolvimento de sistemas de alta qualidade,포르투갈어,https://www.udemy.com/course/introducao-aos-testes-automatizados/
software-testing,Software Testing,Unit Testing en C#,초급자,무료,,온디맨드 동영상 1시간 58분,Unit testing automatizado,스페인어,https://www.udemy.com/course/unit-testing-nicopaez/
software-testing,Quality Management,Pengenalan Quality Engineering Di Dunia Industri,초급자,무료,,온디맨드 동영상 32분,"konsep kualitas dan menganalisis Biaya Kualitas Total
memahami dan mengimplementasikan Alat Kualitas dalam peningkatan proses.
mengklasifikasikan diagram kontrol untuk data variabel dan atribut, dan mengimplementasikan diagram kontrol sebagai alat dalam Kontrol Proses Statistik.
emahami pentingnya kualitas dalam pemasok, dan mendefinisikan Sistem Manajemen Mutu.",Indonesian,https://www.udemy.com/course/quality-engineering/
software-testing,Software Testing,Что такое тестирование и кто такой тестировщик 2020,모든 수준,무료,,온디맨드 동영상 36분,"По окончании этого курса Вы узнаете кто такой Тестировщик программного обеспечения,и чем он занимается.",러시아어,https://www.udemy.com/course/who_is_software_tester/
software-testing,Software Testing,Curs introductiv de Testare Software,초급자,무료,,온디맨드 동영상 53분,"De ce avem nevoie de QA
Ce face un QA
Cum se planifica si executa testarea
Cum se scriu rapoarte de bug",루마니아어,https://www.udemy.com/course/curs-introductiv-de-testare-software-qa/
software-testing,,Cypress Discovery Light Version,초급자,무료,,온디맨드 동영상 1시간 51분,"Programar em Javascript, a linguagem universal
Criar testes automatizados de ponta a ponta
Como manipular principais os elementos encontrados em aplicações web
Automatizar testes de regressão",포르투갈어,https://www.udemy.com/course/cypress-discovery-light-version/
software-testing,Software Testing,Learn OpenBullet from scratch,모든 수준,무료,,온디맨드 동영상 1시간 59분,"معرفة أهم اساسيات برنامج OpenBullet
التعرف على Proxies و Wordlist وكيفية اضافتها الى البرنامج
اساسيات صناعة config
القدرة على صناعة config",Arabic,https://www.udemy.com/course/learn-openbullet-from-scratch/
software-testing,Unit Testing,Curso de teste unit?rio com QUnit,모든 수준,무료,,온디맨드 동영상 1시간 5분,"Teste Unitário
QUnit",포르투갈어,https://www.udemy.com/course/curso-de-teste-unitario-com-qunit/
software-testing,Automation Testing,T?ng quan v? ki?m th? t? đ?ng,초급자,무료,,온디맨드 동영상 1시간 9분,"Nắm được kiến thức tổng quan về kiểm thử tự động
Nắm được kiến thức về các công cụ kiểm thử tự động
Nắm được kiến thức để lựa chọn đúng công cụ kiểm thử tự động cho dự án
Sử dụng được công cụ kiểm thử tự động akaAT",Vietnamese,https://www.udemy.com/course/automation-test-fundamental/
software-testing,Software Testing,Pengujian Proyek Sistem Informasi,초급자,무료,,온디맨드 동영상 1시간 17분,"Student akan memahami pengujian dasar, STLC, dan peran dari penguji
Student akan memahami sirkumtansi tes untuk menerapkan tes
Student akan memahami tingkat pengujian dan tahu bagaimana bekerja dengan tingkatan pengujian tersebut
diharapkan dapat menjalankan pengujian untuk sistem/ aplikasi/ perangkat lunak yang kini sudah sangat banyak pemakaiannya",Indonesian,https://www.udemy.com/course/pengujian-proyek-sistem-informasi/
software-testing,Software Testing,工程總監帶?學軟體測試 Learn QA testing with engineering director,초급자,무료,,온디맨드 동영상 35분,"用正確態度的面對軟體品質
認識品質的重要性
清楚了解測試工程師的角色定位和工作內容
設計Test case的多種思考方法
理解優先級的重要性",Traditional Chinese,https://www.udemy.com/course/learn-qa-testing-with-engineering-director/
software-testing,Software Testing,Werde ein Superheld des Software Testings,초급자,무료,,온디맨드 동영상 1시간 35분,"Grundlagen im Umgang mit MicroFocus ALM/Quality Center
Best Practices in MicroFocus ALM/Quality Center",독일어,https://www.udemy.com/course/alm_basics-werde_ein_superheld_des_software_testings/
