대분류,소분류,강의명,난이도,가격(현재가격),가격(원래가격),총소요시간,강의소개,언어,출처
programming-languages,C# (programming language),What is New in C# 8,중급자,무료,,온디맨드 동영상 1시간 53분,"Implementing default interface methods
Working with nulls in C# 8
How to use null-coalescing assignment operator
Understand work of IDisposable interface
Make use of using declaration
Trying disposable ref structs
Building new switch expressions
Using property patterns to match on properties
Using tuple like patterns on switch statements
Learn how to use deconstruction methods
Understanding and working with positional patterns
Readonly Members
Static Local Functions
Asynchronous Streams
Verbatim Interpolated Strings
Using hat operator
Working with new range operator",영어,https://www.udemy.com/course/what-is-new-in-c-sharp/
programming-languages,MATLAB,Introduction to MATLAB for Complete Beginners,모든 수준,무료,,온디맨드 동영상 1시간 46분,"Develop essential level skills of Programming with MATLAB
Working with M-Files, Functions and Scripts
You are fully able to start your own engineering and technical projects worked at University or College
Create a portfolio of MATLAB to apply for MATLAB jobs
Gain Hands-On experience with MATLAB for visualizing, analyzing and formulating essential problems using MATLAB programming skills",영어,https://www.udemy.com/course/introduction-to-matlab-for-complete-beginners/
programming-languages,Python,Python with AI,초급자,무료,,온디맨드 동영상 2시간,"Get started with Python programming
Understand Python fundamentals such as print, input, data conversion, if statement
Programming with confidence
Be ready to learn advanced Python programming",영어,https://www.udemy.com/course/pythonwithai/
programming-languages,C# (programming language),Fixing common errors in Unity C#,초급자,무료,,온디맨드 동영상 1시간 20분,"Discover the most common types of C# errors
Learn how to fix common errors
Discover how to debug a script
Look at both syntax and logic errors",영어,https://www.udemy.com/course/fixing-common-errors-in-unity-c/
programming-languages,Swift,Functions and Closures in Swift,초급자,무료,,온디맨드 동영상 1시간 45분,"Become familiar with functional features in Swift
Write more declarative and eloquent code
Become very comfortable with functions and closures in Swift
Create your own module or framework with some utility functions",영어,https://www.udemy.com/course/functional-programming-in-swift/
programming-languages,Object Oriented Programming,Object Oriented Programming with Java: Complete beginners,초급자,무료,,온디맨드 동영상 1시간 55분,"Know the basics of Java programming
Have a strong foundational understanding of Object Oriented Programming
Be able to write programs with classes, constructors, and methods in Java
Clear up confusion about the basic concepts of Object Oriented Programming
Clear up confsuion about basic coding concepts",영어,https://www.udemy.com/course/object-oriented-programming-with-java-complete-beginners/
programming-languages,Python,Using AWS S3 with Python,초급자,무료,,온디맨드 동영상 1시간 10분,"Introduction to S3 technology
Learn the AWS Console
Setup authentication to work with AWS
Work with S3 using Python
Create and manage S3 content using Python",영어,https://www.udemy.com/course/using-aws-s3-with-python/
programming-languages,Python,Introduction to Python Programming,초급자,무료,,온디맨드 동영상 2시간,"Python Programming
Functional Programming
Object Oriented Programming
Best Programming Practices
Hands on Programming",영어,https://www.udemy.com/course/introduction-to-python-programming-x/
programming-languages,Python,The Art of Doing: Fundamental Socket Python Programming,초급자,무료,,온디맨드 동영상 1시간 59분,"Networking Fundaments such as IP and port addresses, IPV4, TCP, and UDP protocols
How to use the socket module to create an IPV4/TCP client/server python
How to use the socket module to create an IPV4/UDP client/server in python
How to use the socket module to create a basic two way chat in the terminal in python
An introduction to the threading module",영어,https://www.udemy.com/course/the-art-of-doing-fundamental-socket-python-programming/
programming-languages,Java,Java for Beginners,초급자,무료,,온디맨드 동영상 1시간 53분,"Java basics
Android Basics",영어,https://www.udemy.com/course/learn-java-in-the-context-of-android-developmentjava-basics/
programming-languages,GameMaker Studio,Maze Games in GameMaker,초급자,무료,,온디맨드 동영상 2시간 57분,"Students can create a new game with GameMaker Studio
Students can create a Character for their game
Students program their Character to move
Students can explain the difference between a Sprite, Object and Room in GameMaker
Students can explain the difference between an Event and an Action in GameMaker
Students can explain how Fixed Movement, Keyboard Events and the No Key Event are used together to create Maze Game Character movement in GameMaker
Students can explain how the Step Event works and how it can be used to ask Questions from the game.
Student can create a Wall Object for their game
Students program a Character to be constrained by Wall Objects
Students can explain how Collisions work in GameMaker
Students use questions and (if-else) statements to ensure alignment in positioning
Students will configure parent-child relationships between objects
Students create groups for your sprites and objects to organise them
Students create health functionality and health bar displays in a Game Maker room
Students create multiple GameMaker rooms and the conditions which make the hero move from one room to another
Students use nested If Statements to test or create more advanced decision making
Students use Parent Child Relationships in the creation of many variations of monsters and gems
Students use sequences of sprite to create animations for movement and explosions",영어,https://www.udemy.com/course/maze-games-in-gamemaker/
programming-languages,C++ (programming language),C++ Fundamentals and Beyond:a detailed introduction and more,초급자,무료,,온디맨드 동영상 1시간 59분,"Learn the basics of C++ programming
Be able to write functional C++ programs
Feel confident in your understanding of C++
Learn about more complex concepts in C++ as well",영어,https://www.udemy.com/course/c-fundamentals-m/
programming-languages,JSON,Essential Secrets of JSON,모든 수준,무료,,온디맨드 동영상 53분,Students will get to know about JSON format,영어,https://www.udemy.com/course/essential-secrets-of-json/
programming-languages,Assembly Language,Introduction to Assembly Programming with ARM,초급자,무료,,온디맨드 동영상 1시간 55분,"Understand the basics of ARM emulation and program structure
The fundamentals of register, stack, and memory addressing modes
The concepts of arithmetic and logical operators
The main concept of branches, loops, and subroutine branches
The ways to interact with simple hardware devices",영어,https://www.udemy.com/course/introduction-to-assembly-programming-with-arm/
programming-languages,JavaScript,JavaScript Arrays and Objects Basic Data Structures,모든 수준,무료,,온디맨드 동영상 1시간 1분,"How to apply JavaScript code
Learn more about using Array methods
How to get values from an array
How to manipulate array contents",영어,https://www.udemy.com/course/javascript-coding/
programming-languages,C++ (programming language),Competitive programming basics for beginners using C++,초급자,무료,,온디맨드 동영상 1시간 12분,"Basic competitive programming concepts
Important algorithms with time complexity
Coding tips and shortcuts
Coding implementation of all basic concepts
C++ Standard Template Library",영어,https://www.udemy.com/course/competitive-programming-basics-cplusplus/
programming-languages,Python,Python Tutorial - Python for Beginners,모든 수준,무료,,온디맨드 동영상 31분,"Have a fundamental understanding of the Python programming language.
Build a complete understanding of Python from the ground up!",영어,https://www.udemy.com/course/learn-python-programming-one-stop-solution-for-beginners/
programming-languages,PHP,The Wizardly world of Php Magic Methods,중급자,무료,,온디맨드 동영상 33분,"Php Magic Methods
Invoke Magic Method
Php Call Magic Method
Php CallStatic Magic Method",영어,https://www.udemy.com/course/the-wizardly-world-of-php-magic-methods/
programming-languages,Algorithms,USACO Silver Java Course - Part 1,중급자,무료,,온디맨드 동영상 1시간 57분,"Sorting with built-in functions
Sorting user-defined objects
Sorting for problem-solving",영어,https://www.udemy.com/course/usaco-silver-java-course-part-1/
programming-languages,Algorithms,USACO Silver C++ Course - Part 1,중급자,무료,,온디맨드 동영상 1시간,"STL Sort Function and Comparator
Structures and Sorting
Sorting Problem-Solving Techniques
Time Complexity",영어,https://www.udemy.com/course/usaco-silver-c-course-part-1/
programming-languages,AP Computer Science,AP Computer Science A - Part 1,초급자,무료,,온디맨드 동영상 1시간 56분,"Gain a firm grasp on the basics of the Java programming language by learning about variables, data types, operators, and operations.
Learn how to instantiate, call, and use objects (including the String datatype).
Learn to utilize booleans and boolean expressions, especially in the context of if statements in order to modify a program’s control flow.
Acquire the skills necessary to manually traverse iterative statements, including for loops and while loops (this is an imperative skill for the exam).",영어,https://www.udemy.com/course/ap-computer-science-a-part-1/
programming-languages,MATLAB,Matlab for scientists: a beginners course,초급자,무료,,온디맨드 동영상 1시간 35분,"You will be able to explore and visualize your data using linegraphs, barplots, etc.
You will be able to adjust your data to your needs (load data, change data values, create dummy data, etc.).
You will be able to extract important summaries of your data (mean, variance, median, etc.).
You will be able to apply fundamental Matlab functions (for-loops, if-statements).
You will be able to differentiate vectors, matrices, cells, and structures. Besides, you will know their individual benefits.",영어,https://www.udemy.com/course/matlab-for-scientists-a-beginners-course/
programming-languages,Python,"Python, a simple, FREE 2023 guide to learning with problems!",모든 수준,무료,,온디맨드 동영상 30분,"Translate English into Python!
Solving problems by turning words and putting together a simple step by step or line by line solution
Students will have mastered fundamentals of the Python language including loops, if conditions and variables!
Students will further develop logical reasoning skills and will ultimately have fun (My personal goal for all students)",영어,https://www.udemy.com/course/python-2023/
programming-languages,JavaScript,Master JavaScript Array - Ministry of JavaScript,모든 수준,무료,,온디맨드 동영상 36분,"You will be able to learn that what are Arrays in JavaScript
You can be able to perform any action with Arrays in JavaScript
You will master the coding interviews wrt Arrays
You will get to know the useful methods of Arrays which are being used in JavaScript development.",영어,https://www.udemy.com/course/master-javascript-array/
programming-languages,Python Game Development,Python Course - Doing Crossing Road Game with Turtle Module,모든 수준,무료,,온디맨드 동영상 50분,"You will be able to do games by using Turtle Module.
You can use ""class"" to make projects.
Learn how to write your own Python programs.
Be confident in your Python programming abilities and knowledge so that you may apply for Python programming jobs.
Use Python to make your daily life easier.
You will learn Turtle Module very well.",영어,https://www.udemy.com/course/python-course-doing-crossing-road-game-with-turtle-module/
programming-languages,LangChain,Python CLI Chat Using Langchain,초급자,무료,,온디맨드 동영상 59분,"Interact with Large Language Models using Python.
Learn the basics of setting up a prompt for LLM's.
Use agents to get current information through tools we define to assist our LLM.
Add memory to a LLM so it is able to have context.",영어,https://www.udemy.com/course/python-cli-chat-using-langchain/
programming-languages,Object Oriented Programming,Intro to Object Oriented Programming with Java,초급자,무료,,온디맨드 동영상 1시간 10분,"Learn the fundamentals of Object Oriented Programming
Complete Coding exercises tailored to practice what you learn
Apply key concepts of Object Oriented Programming to Code and Projects!
Learn enough to get you started coding in Java and building applications
Work with Data and build complex objects/classes to solve complex problems",영어,https://www.udemy.com/course/intro-to-object-oriented-programming-with-java/
programming-languages,Jupyter Notebook,Learn Jupyter Notebooks for Beginners,초급자,무료,,온디맨드 동영상 1시간 27분,"What are Jupyter Notebooks
How to Install Jupyter Notebooks
How to use Jupyter Notebooks in their projects
How to run Python Codes in Jupyter Notebooks
How to add Images in Jupyter Notebooks
How to add Videos in Jupyter Notebooks
What is Replit
How to Register to Replit
How to run your Python codes on Replit
What is Google Colab
How to run your python codes on Google Colab
What is Anaconda Distribution
How to Install Anaconda Distribution
Learn The Basics of Markdown and use it in Jupyter Notebooks",영어,https://www.udemy.com/course/learn-jupyter-notebooks-for-beginners/
programming-languages,Programming Fundamentals,AP Computer Science A - Part 2,초급자,무료,,온디맨드 동영상 1시간 43분,"Learn about iteration in Java, including the use of while loops, for loops, and nested iteration
Gain the skills necessary to understand the structure of a Java class, including class constructors, static variables and methods, comments, and more
Learn how to create and traverse Arrays and ArrayLists, including how to traverse them with enhanced loops
Learn basic and advanced fundamentals of Java",영어,https://www.udemy.com/course/ap-computer-science-a-part-2/
programming-languages,Data Analysis,Basics of Plotly for Data Analysis & Data Science,초급자,무료,,온디맨드 동영상 1시간 53분,"Learn about Essentials of Plotly to create plots like Bar Charts, Line Charts, Scatter Plots, Histogram ,distribution plots , and more!
How to Create Layouts with Plotly's Dash library.
How to Deploy your interactive dashboards
Learn styling in Plotly",영어,https://www.udemy.com/course/plotly_real_world_projects_for_data-analysis_data-science/
programming-languages,Matplotlib,Introduction to Matplotlib for Complete Beginners,초급자,무료,,온디맨드 동영상 1시간 53분,"Develop essential level skills of Programming with Matplotlib
Plotting Data and Visualization in Matplotlib
You are fully able to start your own engineering and technical projects worked at University or College
Create a portfolio of Matplotlib to apply for Data Analysis jobs
Gain Hands-On experience with Matplotlib for visualizing, analyzing and formulating essential problems using Matplotlib programming skills",영어,https://www.udemy.com/course/introduction-to-matplotlib-for-complete-beginners-chapter/
programming-languages,Functional Programming,Functional Programming with Origami,중급자,무료,,온디맨드 동영상 46분,"Elements of Functional Programming
Functors and Monads
Return, Map, Bind, and Pipe
Partial and Total Functions
Effectual Types",영어,https://www.udemy.com/course/functional-programming-with-origami/
programming-languages,JDBC,Everything you need to know about JDBC,초급자,무료,,온디맨드 동영상 1시간 30분,"JDBC Architecture and API
Setting up H2 Database
Connecting Java applications to an RDBMS
Executing SQL commands
Handling result of SQL SELECT statements
Handling auto-incrementing primary key fields",영어,https://www.udemy.com/course/everything-you-need-to-know-about-jdbc/
programming-languages,Python,Learn Basics Python : ISL Interpretation Included,초급자,무료,,온디맨드 동영상 1시간 47분,"What are Data types in Python, Conditional Statements, Control Statements
Understanding Lists, Tuples, Dictionaries
Learning Math functions, Number functions, String functions, Random functions, Time functions, User-defined functions, Lambda functions
Knowledge around Modules, Files I/O, Exception Handling, Object-Oriented Programming, Decorators, Generators and Regular Expressions",영어,https://www.udemy.com/course/learn-python-sign-language-interpretation-included/
programming-languages,Coding Interview,Java Coding Interview Preparation - Coding Exercises,모든 수준,무료,,온디맨드 동영상 36분,"Learn how to break down complex problems, devise efficient algorithms, and implement practical solutions using Java.
Explore essential data structures such as arrays, linked lists, stacks, queues, trees, graphs, and hash tables.
Course covers common types of interview questions asked in Java programming interviews, such as string manipulation, array manipulation, sort and search.
Get practice on interview questions sourced from real-world company interview question stacks.",영어,https://www.udemy.com/course/java-coding-interview-preparation-coding-exercises/
programming-languages,Perl,Introduction to Perl IRL,모든 수준,무료,,온디맨드 동영상 1시간 52분,"Budding Perl developers looking for a more ""real"" learning experience
Professional Perl programmers looking to be reinvigorated with a passion for Perl
Any Perl programmer or dabbler looking for insights, tips, and tricks imparted exciting live coding sessions
Explore a little more about what Perl options exist on both Windows and Linux",영어,https://www.udemy.com/course/introduction-to-perl-irl/
programming-languages,Mobile App Development,Dart Course for Beginners (Sinhala),모든 수준,무료,,온디맨드 동영상 1시간 16분,"learning how to code
Have a strong foundation on Dart and is capable of jump starting with flutter
How to work with IntelliJ IDEA",영어,https://www.udemy.com/course/dart-course-for-beginners-sinhala/
programming-languages,C# (programming language),Quick Start - Learn programming in C#,초급자,무료,,온디맨드 동영상 1시간 59분,"You can write simple graphical apps.
You can use instructions in your programs.
You can use loops, conditional statements, and variables.
You will learn the basics of object-oriented programming.",영어,https://www.udemy.com/course/quick-start-learn-programming-in-csharp/
programming-languages,C (programming language),Fundamentals of Programming in C,초급자,무료,,온디맨드 동영상 1시간 35분,"Define and implement prints and variables in C
Define and apply pointers for variables, arrays, and strings
Create decision and repetition structures
Build custom functions with regular and pointer arguments",영어,https://www.udemy.com/course/fundamentals-of-programming-in-c/
software-testing,Selenium Testing Framework,Selenium WebDriver with C# for Beginners + Live Testing Site,모든 수준,무료,,온디맨드 동영상 1시간 22분,"Work with ID, Name, CSSPath and XPath selectors
Work with Input boxes, Check boxes, Radio buttons, Alert boxes and more",영어,https://www.udemy.com/course/selenium-qa/
software-testing,JMeter,JMeter - Step by Step for Beginners,모든 수준,무료,,온디맨드 동영상 8시간 2분,"Can use Jmeter for performance testing on multiple applications
Understand Jmeter in an easy way
Can start implementing performance testing",영어,https://www.udemy.com/course/jmeter-step-by-step-for-beginners/
software-testing,Automation Testing,Katalon Studio - Step by Step for Beginners,초급자,무료,,온디맨드 동영상 10시간 25분,"Install and Run Katalon Studio
Automate web applications using Katalon Studio
Create web ui tests for multiple browsers
Learn record and playback
Find objects using object spy
Execute web ui automation tests on multiple browsers
Results and Reporting
Send Email notification with results
Integrate with Jenkins for Continuous Integration
Integrate with Git (Version Control System)
Work with Katalon Studio for personal and enterprise projects",영어,https://www.udemy.com/course/katalon-studio-step-by-step-for-beginners/
software-testing,Selenium Testing Framework,Selenium Java Framework from Scratch,초급자,무료,,온디맨드 동영상 10시간 53분,"Create automation frameworks using Selenium in Java
Understand the basic concepts and working of Selenium
Understand the basic concepts of Automation Frameworks
Will be able to create test automation framework step by step",영어,https://www.udemy.com/course/selenium-java-framework-from-scratch/
software-testing,Selenium WebDriver,Selenium Webdriver: What are Implicit and Explicit Waits,중급자,무료,,온디맨드 동영상 1시간 20분,"Understand the importance of having good Synchronization
Understand Explicit Waits
Understand Implicit Waits
Understand the WebDriverWait class
Know how to use the WebDriverWait class
Know how to use DefaultWait class aka FluentWait",영어,https://www.udemy.com/course/synchronization/
software-testing,Selenium Testing Framework,Selenium Webdriver Automate 10 commercial Sites - Basics C1,초급자,무료,,온디맨드 동영상 3시간 5분,"This is a free course that would facilitate manual testers to step into automation and learn automating fundamental web forms using Selenium Webdriver.
This is the first part of the sequence of courses which are intended for manual testers to master their automation skills. This course would supply you with skills to automate web forms with learning about vital web elements using Selenium Webdriver. It will also make you familiar with Java (Scripting Language), Eclipe (Compiler/tool used to write script) and insight of different browsers plug-ins. We highly urge you to get yourself enrolled with the Second Part of the Course that is ‘Advance Selenium Webdriver Automate 10 commercial Sites - C2” once you have accomplished this course.
In ‘Advance Selenium Webdriver Automate 10 commercial Sites - C2” you will learn writing automation script immediately on working on real life industrial website. We have named it as Project. Once you have completed this course you will have a hands on experience of automating 10 Industrial Websites which will help you not only in gaining self-confidence but securing job as an Automation Engineer in many possible high profile Industrial domains.",영어,https://www.udemy.com/course/selenium-webdriver-learn-by-automating-10-commercial-sites/
software-testing,JMeter,Master JMeter from Basics (Performance + Load + API Testing),모든 수준,무료,,온디맨드 동영상 8시간 47분,"Working of JMeter
Developing Test Scenarios in JMeter
Ways how to do performance Testing with JMeter
Generate different types of Reports
Integration of JMeter with Selenium
JMeter advance Concepts
Practicing Sessions
Detail knowledge of JMeter Components",영어,https://www.udemy.com/course/master-jmeter-from-basics-performance-load-api-testing/
software-testing,Robot Framework,Robot Framework | Step-by-Step for Beginners,모든 수준,무료,,온디맨드 동영상 2시간 45분,"How to use Robot Framework for browser automation
How to setup Robot Framework
How to use Robot framework with Selenium",영어,https://www.udemy.com/course/robot-framework-step-by-step-for-beginners/
software-testing,Apache Groovy,Groovy | Step by Step for Beginners,모든 수준,무료,,온디맨드 동영상 5시간 32분,"What is Groovy
Groovy from basics
How to do Groovy programming",영어,https://www.udemy.com/course/groovy-step-by-step-for-beginners/
software-testing,LoadRunner,Performance Testing HP Loadrunner (Updated),모든 수준,무료,,온디맨드 동영상 8시간 52분,"Learn latest HP Loadrunner Tool
Concepts of Performance Testing
Independtly using loadrunner in your project for Performance Testing",영어,https://www.udemy.com/course/performance-testing-hp-loadrunner-updated/
software-testing,Robot Framework,Robot Framework|RIDE & Selenium - Step by Step for Beginners,모든 수준,무료,,온디맨드 동영상 2시간 38분,"Understand Robot Framework
Create Selenium automation tests with Robot Framework",영어,https://www.udemy.com/course/robot-frameworkride-selenium-step-by-step-for-beginners/
software-testing,Cypress.io,CYPRESS | Step-by-Step for Beginners | Hands-On Training,모든 수준,무료,,온디맨드 동영상 1시간 53분,"By the end of this course you will have practical hands-on knowledge on working with Cypress
Understanding of all features and settings of CYPRESS
You will be able to create Testing projects with CYPRESS
Complete hands-on knowledge with Demo",영어,https://www.udemy.com/course/cypress-step-by-step-for-beginners-hands-on-training/
software-testing,API Testing,API Testing with Katalon Studio - Step by Step for Beginners,초급자,무료,,온디맨드 동영상 6시간 8분,"Understand API Testing
Create API testing automation project with Katalon Studio
Use GIT for version control
Use Jenkins for Continuous Integration
Create automation testing for SOAP & REST web services",영어,https://www.udemy.com/course/api-testing-with-katalon-studio-step-by-step-for-beginners/
